id,observed_on,time_observed_at,user_id,user_login,url,latitude,longitude,positional_accuracy,place_town_name,place_county_name,place_state_name,place_country_name,scientific_name,field:oba collection method,field:oba collector id,field:trap installed,field:trap removed
20236585,2/9/19,2019-02-09 20:48:17 UTC,1459777,bethelfarm,https://www.inaturalist.org/observations/20236585,44.56744837,-123.2816225,50,,Benton,Oregon,United States,,net,,2/9/19 12:49,
20321217,2/9/19,2019-02-09 20:46:14 UTC,733757,pattiwittrup,https://www.inaturalist.org/observations/20321217,44.56771054,-123.2827908,200,,Benton,Oregon,United States,Homo sapiens,net,,2/9/19 12:48,
21044422,2/9/19,2019-02-09 20:50:08 UTC,1467407,richwittrup,https://www.inaturalist.org/observations/21044422,44.56710232,-123.2815158,200,,Benton,Oregon,United States,Asteraceae,net,,,
21169660,3/11/19,2019-03-11 22:21:00 UTC,841568,lohump,https://www.inaturalist.org/observations/21169660,43.85353031,-122.6365209,,,Lane,Oregon,United States,Lomatium hallii,net,Lori Humphreys,,
21239358,3/14/19,2019-03-14 20:58:26 UTC,792468,molfamily,https://www.inaturalist.org/observations/21239358,45.17103906,-123.185979,24,,Yamhill,Oregon,United States,Erica,net,,,
21239536,3/14/19,2019-03-14 21:03:40 UTC,792468,molfamily,https://www.inaturalist.org/observations/21239536,45.1714789,-123.1862363,16,,Yamhill,Oregon,United States,Bellis perennis,net,,,
21267007,3/15/19,2019-03-15 20:59:29 UTC,792468,molfamily,https://www.inaturalist.org/observations/21267007,45.17025925,-123.1857595,32,,Yamhill,Oregon,United States,Bellis perennis,net,,,
21301500,3/15/19,2019-03-15 23:21:16 UTC,327525,brianalindh,https://www.inaturalist.org/observations/21301500,44.93731333,-123.0144972,5,,Marion,Oregon,United States,Bellis perennis,net,,,
21301672,3/16/19,2019-03-16 21:55:10 UTC,327525,brianalindh,https://www.inaturalist.org/observations/21301672,44.93518,-123.0166556,65,,Marion,Oregon,United States,Erica carnea,net,,,
21331157,3/17/19,2019-03-17 20:15:52 UTC,792468,molfamily,https://www.inaturalist.org/observations/21331157,45.17298165,-123.2131044,65,,Yamhill,Oregon,United States,Pieris japonica,net,,,
21331221,3/17/19,2019-03-17 20:05:23 UTC,1445987,vettaesteel,https://www.inaturalist.org/observations/21331221,42.64653495,-123.3172987,5,,Josephine,Oregon,United States,Salix,net,,,
21331394,3/17/19,2019-03-17 20:21:52 UTC,792468,molfamily,https://www.inaturalist.org/observations/21331394,45.17342725,-123.2115749,16,,Yamhill,Oregon,United States,Bellis perennis,net,,,
21332643,3/17/19,2019-03-17 20:54:20 UTC,792468,molfamily,https://www.inaturalist.org/observations/21332643,45.20996253,-123.2005676,16,,Yamhill,Oregon,United States,Bellis perennis,net,,,
21347386,3/17/19,2019-03-17 21:23:58 UTC,754260,ellenwatrous,https://www.inaturalist.org/observations/21347386,44.59537204,-123.2853128,7,,Benton,Oregon,United States,Salix,net,,,
21347403,3/17/19,2019-03-17 22:23:04 UTC,754260,ellenwatrous,https://www.inaturalist.org/observations/21347403,44.60425555,-123.2405893,5,,Benton,Oregon,United States,Salix,net,,,
21347414,3/17/19,2019-03-17 23:35:00 UTC,754260,ellenwatrous,https://www.inaturalist.org/observations/21347414,44.59901049,-123.3156407,9,,Benton,Oregon,United States,Arctostaphylos glauca,net,,,
21347487,3/17/19,2019-03-17 22:38:38 UTC,620505,judithmaxwell,https://www.inaturalist.org/observations/21347487,42.25724141,-123.5836973,8,,Josephine,Oregon,United States,Salix,net,,3/17/19 15:40,
21368816,3/18/19,2019-03-18 21:47:55 UTC,792468,molfamily,https://www.inaturalist.org/observations/21368816,45.23010769,-123.1040274,64,,Yamhill,Oregon,United States,Bellis perennis,net,,,
21369401,3/18/19,2019-03-18 22:14:59 UTC,792468,molfamily,https://www.inaturalist.org/observations/21369401,45.23040769,-123.1640478,16,,Yamhill,Oregon,United States,Bellis perennis,net,,,
21380620,3/18/19,2019-03-18 21:18:41 UTC,841568,lohump,https://www.inaturalist.org/observations/21380620,43.98880768,-123.0352097,,,Lane,Oregon,United States,Oemleria cerasiformis,net,,,
21380641,3/18/19,2019-03-18 20:19:05 UTC,841568,lohump,https://www.inaturalist.org/observations/21380641,43.99020386,-123.0328979,,,Lane,Oregon,United States,Cardamine hirsuta,net,,,
21380659,3/18/19,2019-03-18 20:06:08 UTC,841568,lohump,https://www.inaturalist.org/observations/21380659,43.99009323,-123.0327454,,,Lane,Oregon,United States,Taraxacum officinale,net,,,
21380667,3/18/19,2019-03-18 19:56:46 UTC,841568,lohump,https://www.inaturalist.org/observations/21380667,43.98952866,-123.0329742,,,Lane,Oregon,United States,Draba verna,net,,,
21380726,3/18/19,2019-03-18 19:34:29 UTC,841568,lohump,https://www.inaturalist.org/observations/21380726,43.98957443,-123.0349808,,,Lane,Oregon,United States,Salix,net,,,
21387936,3/17/19,2019-03-17 21:22:55 UTC,327525,brianalindh,https://www.inaturalist.org/observations/21387936,44.92815,-123.06755,5,,Marion,Oregon,United States,Salix,net,,,
21387974,3/17/19,2019-03-17 21:11:43 UTC,327525,brianalindh,https://www.inaturalist.org/observations/21387974,44.92744167,-123.0695195,10,,Marion,Oregon,United States,Taraxacum officinale,net,,,
21388002,3/17/19,2019-03-17 22:00:24 UTC,327525,brianalindh,https://www.inaturalist.org/observations/21388002,44.929675,-123.0589833,5,,Marion,Oregon,United States,Salix,net,,,
21390355,3/18/19,2019-03-19 03:21:00 UTC,620505,judithmaxwell,https://www.inaturalist.org/observations/21390355,42.46151944,-123.4843611,8,,Josephine,Oregon,United States,Salix lucida,net,,,
21399642,3/19/19,2019-03-19 21:59:33 UTC,792468,molfamily,https://www.inaturalist.org/observations/21399642,45.50177384,-122.9844847,24,,Washington,Oregon,United States,Salix sitchensis,net,,,
21435467,3/20/19,,620505,judithmaxwell,https://www.inaturalist.org/observations/21435467,42.444618,-122.881593,196,,Jackson,Oregon,United States,,net,,,
21435643,3/20/19,2019-03-21 00:04:37 UTC,1542612,andonymelathopoulos,https://www.inaturalist.org/observations/21435643,44.56661792,-123.2818804,20,,Benton,Oregon,United States,Cactaceae,vane trap,,2019-03-20T17:11:00-07:00,2019-03-22T14:24:00-07:00
21435668,3/20/19,2019-03-21 00:11:46 UTC,792468,molfamily,https://www.inaturalist.org/observations/21435668,45.17100041,-123.1862176,48,,Yamhill,Oregon,United States,Narcissus 'tahiti',net,,,
21436427,3/20/19,2019-03-21 00:27:41 UTC,1542665,johndoejr,https://www.inaturalist.org/observations/21436427,44.56684701,-123.2805922,45,,Benton,Oregon,United States,Dudleya farinosa,net,,,
21436435,3/20/19,2019-03-21 00:36:23 UTC,792468,molfamily,https://www.inaturalist.org/observations/21436435,45.1707544,-123.1854586,64,,Yamhill,Oregon,United States,Bellis perennis,net,,,
21444705,3/20/19,2019-03-20 21:59:26 UTC,754260,ellenwatrous,https://www.inaturalist.org/observations/21444705,44.5752504,-123.3095778,6,,Benton,Oregon,United States,Salix,net,,,
21473537,3/21/19,2019-03-21 23:32:00 UTC,620505,judithmaxwell,https://www.inaturalist.org/observations/21473537,42.41186667,-123.3852,6,,Josephine,Oregon,United States,Arctostaphylos patula,net,,,
21524905,3/23/19,2019-03-23 18:46:48 UTC,327525,brianalindh,https://www.inaturalist.org/observations/21524905,44.92768,-123.0668805,10,,Marion,Oregon,United States,Salix,net,,,
21574371,3/24/19,2019-03-24 22:48:17 UTC,175529,jerrypaul,https://www.inaturalist.org/observations/21574371,44.60259385,-123.2661036,5,,Benton,Oregon,United States,Salix discolor,net,,,
21574697,3/24/19,2019-03-24 22:49:59 UTC,1550876,cassie_bouska,https://www.inaturalist.org/observations/21574697,43.06656253,-124.1398428,5,,Coos,Oregon,United States,Berberis aquifolium,net,,,
21574801,3/24/19,2019-03-24 23:00:40 UTC,1427305,hotdesert,https://www.inaturalist.org/observations/21574801,43.06693741,-124.1403384,5,,Coos,Oregon,United States,Rosmarinus officinalis,net,,,
21586602,3/24/19,2019-03-24 19:47:13 UTC,841568,lohump,https://www.inaturalist.org/observations/21586602,43.99687576,-123.1190109,,,Lane,Oregon,United States,Oemleria cerasiformis,net,,,
21587233,3/24/19,2019-03-24 21:14:37 UTC,841568,lohump,https://www.inaturalist.org/observations/21587233,43.99906921,-123.1258392,,,Lane,Oregon,United States,Oemleria cerasiformis,net,,,
21600922,3/24/19,2019-03-24 19:22:22 UTC,327525,brianalindh,https://www.inaturalist.org/observations/21600922,45.03515,-124.0061639,10,,Lincoln,Oregon,United States,Salix,net,,,
21642240,3/26/19,2019-03-26 20:49:02 UTC,792468,molfamily,https://www.inaturalist.org/observations/21642240,45.50133682,-122.9855542,12,,Washington,Oregon,United States,Salix lucida,net,,,
21644390,3/26/19,2019-03-26 21:53:35 UTC,792468,molfamily,https://www.inaturalist.org/observations/21644390,45.4997367,-122.9892716,16,,Washington,Oregon,United States,Prunus cerasifera,net,,,
21645372,3/17/19,2019-03-17 21:33:58 UTC,752114,stephaniehazen,https://www.inaturalist.org/observations/21645372,44.92817342,-123.0674995,5,,Marion,Oregon,United States,Salix,net,,,
21645380,3/26/19,2019-03-26 22:25:51 UTC,752114,stephaniehazen,https://www.inaturalist.org/observations/21645380,44.88451636,-122.8876364,5,,Marion,Oregon,United States,Salix caprea,net,,,
21646081,3/26/19,2019-03-26 20:39:16 UTC,327525,brianalindh,https://www.inaturalist.org/observations/21646081,44.92734994,-123.0684374,5,,Marion,Oregon,United States,Salix,net,,,
21646843,3/26/19,2019-03-26 21:19:05 UTC,327525,brianalindh,https://www.inaturalist.org/observations/21646843,44.92848667,-123.0680612,1550,,Marion,Oregon,United States,Berberis aquifolium,net,,,
21646899,3/26/19,2019-03-26 22:11:12 UTC,327525,brianalindh,https://www.inaturalist.org/observations/21646899,44.93083,-123.0326833,5,,Marion,Oregon,United States,Erythronium oregonum,net,,,
21647327,3/26/19,2019-03-26 23:38:53 UTC,792468,molfamily,https://www.inaturalist.org/observations/21647327,45.16799239,-123.185897,16,,Yamhill,Oregon,United States,Brassica rapa,net,,,
21669183,2/9/19,2019-02-09 20:57:20 UTC,78982,mayagoklany,https://www.inaturalist.org/observations/21669183,44.56669773,-123.2814228,50,,Benton,Oregon,United States,Homo sapiens,net,,,
21711740,3/28/19,2019-03-28 20:41:36 UTC,792468,molfamily,https://www.inaturalist.org/observations/21711740,45.1710591,-123.1865563,16,,Yamhill,Oregon,United States,Brassicaceae,net,,,
21712447,3/28/19,2019-03-28 21:02:22 UTC,792468,molfamily,https://www.inaturalist.org/observations/21712447,45.17364248,-123.1845371,24,,Yamhill,Oregon,United States,Oemleria cerasiformis,net,,,
21712977,3/28/19,2019-03-28 21:21:06 UTC,792468,molfamily,https://www.inaturalist.org/observations/21712977,45.1740232,-123.1807258,32,,Yamhill,Oregon,United States,Salix lucida,net,,,
21714494,3/28/19,2019-03-28 22:10:12 UTC,792468,molfamily,https://www.inaturalist.org/observations/21714494,45.17117515,-123.1865371,16,,Yamhill,Oregon,United States,Bellis perennis,net,,,
21723715,3/28/19,2019-03-28 19:33:59 UTC,327525,brianalindh,https://www.inaturalist.org/observations/21723715,44.92949667,-123.0385138,10,,Marion,Oregon,United States,Bellis perennis,net,,,
21723748,3/28/19,2019-03-28 19:39:33 UTC,327525,brianalindh,https://www.inaturalist.org/observations/21723748,44.92999167,-123.039575,30,,Marion,Oregon,United States,Skimmia,net,,,
21749215,3/29/19,2019-03-29 20:01:50 UTC,754260,ellenwatrous,https://www.inaturalist.org/observations/21749215,44.59378617,-123.2865175,8,,Benton,Oregon,United States,,net,,,
21749452,3/29/19,2019-03-29 20:09:45 UTC,1550876,cassie_bouska,https://www.inaturalist.org/observations/21749452,43.06665117,-124.1398534,5,,Coos,Oregon,United States,Berberis aquifolium,net,,,
21749638,3/29/19,2019-03-29 20:14:15 UTC,1550876,cassie_bouska,https://www.inaturalist.org/observations/21749638,43.06695719,-124.1402039,10,,Coos,Oregon,United States,Rosmarinus officinalis,net,,,
21751550,3/29/19,2019-03-29 21:06:23 UTC,792468,molfamily,https://www.inaturalist.org/observations/21751550,45.24742883,-123.2745888,32,,Yamhill,Oregon,United States,Salix sitchensis,net,,,
21752086,3/24/19,2019-03-24 20:36:24 UTC,1423344,jessica789,https://www.inaturalist.org/observations/21752086,45.84160614,-122.8452454,,,Columbia,Oregon,United States,Salix,net,,,
21755162,3/29/19,2019-03-29 22:15:18 UTC,754260,ellenwatrous,https://www.inaturalist.org/observations/21755162,44.59941383,-123.3149722,6,,Benton,Oregon,United States,,net,,,
21756299,3/29/19,2019-03-29 22:49:23 UTC,754260,ellenwatrous,https://www.inaturalist.org/observations/21756299,44.59915597,-123.3156315,8,,Benton,Oregon,United States,Arctostaphylos densiflora,net,,,
21764300,3/29/19,2019-03-29 22:27:00 UTC,620505,judithmaxwell,https://www.inaturalist.org/observations/21764300,42.46329722,-123.4860889,12,,Josephine,Oregon,United States,Salix,net,,,
21773499,3/29/19,2019-03-29 21:00:33 UTC,1447015,phylismcintosh,https://www.inaturalist.org/observations/21773499,42.46131373,-123.4844376,5,,Josephine,Oregon,United States,Salix,net,,,
21777656,3/29/19,2019-03-29 20:51:59 UTC,175529,jerrypaul,https://www.inaturalist.org/observations/21777656,44.60307715,-123.264488,5,,Benton,Oregon,United States,Berberis aquifolium,net,,3/29/19 13:53,
21778380,3/29/19,2019-03-29 20:54:30 UTC,175529,jerrypaul,https://www.inaturalist.org/observations/21778380,44.60325477,-123.2641286,5,,Benton,Oregon,United States,Arctostaphylos columbiana,net,,,
21791437,3/30/19,2019-03-30 19:02:47 UTC,1560167,annelesenne,https://www.inaturalist.org/observations/21791437,45.56538767,-122.8629773,4,,Washington,Oregon,United States,Prunus laurocerasus,net,,,
21793543,3/30/19,2019-03-30 19:47:41 UTC,1447015,phylismcintosh,https://www.inaturalist.org/observations/21793543,42.06415694,-123.6348671,5,,Josephine,Oregon,United States,Narcissus 'tahiti',net,,,
21794149,3/30/19,2019-03-30 19:54:36 UTC,841568,lohump,https://www.inaturalist.org/observations/21794149,44.03238297,-123.0873032,,,Lane,Oregon,United States,Prunus,net,,,
21795235,3/30/19,2019-03-30 20:19:03 UTC,1560167,annelesenne,https://www.inaturalist.org/observations/21795235,45.56437281,-122.8582162,5,,Washington,Oregon,United States,Pyrus calleryana,net,,,
21795672,3/30/19,2019-03-30 20:31:15 UTC,1560167,annelesenne,https://www.inaturalist.org/observations/21795672,45.56482995,-122.8584231,4,,Washington,Oregon,United States,Taraxacum,net,,,
21795961,3/30/19,2019-03-30 20:37:29 UTC,1560167,annelesenne,https://www.inaturalist.org/observations/21795961,45.5648698,-122.8584523,5,,Washington,Oregon,United States,Erica,net,,,
21796870,3/30/19,2019-03-30 20:55:29 UTC,792468,molfamily,https://www.inaturalist.org/observations/21796870,45.19104439,-123.165285,3603,,Yamhill,Oregon,United States,Salix lucida,net,,,
21796973,3/30/19,2019-03-30 20:23:31 UTC,1434192,heidinoordijk,https://www.inaturalist.org/observations/21796973,45.56488659,-122.8580467,8,,Washington,Oregon,United States,Salicaceae,net,,,
21797591,3/30/19,2019-03-30 21:10:09 UTC,1403213,amyj1210,https://www.inaturalist.org/observations/21797591,45.56413083,-122.8577724,5,,Washington,Oregon,United States,Salix,net,,,
21797826,3/30/19,2019-03-30 21:15:24 UTC,841568,lohump,https://www.inaturalist.org/observations/21797826,44.03149033,-123.0865707,,,Lane,Oregon,United States,Salix,net,,,
21797837,3/30/19,2019-03-30 21:14:17 UTC,1447015,phylismcintosh,https://www.inaturalist.org/observations/21797837,42.09562466,-123.6854354,5,,Josephine,Oregon,United States,Arctostaphylos viscida,net,,,
21798614,3/30/19,2019-03-30 21:30:37 UTC,754260,ellenwatrous,https://www.inaturalist.org/observations/21798614,44.57405499,-123.3103725,5,,Benton,Oregon,United States,Salix,net,,,
21800281,3/30/19,2019-03-30 20:31:14 UTC,854908,erybak,https://www.inaturalist.org/observations/21800281,45.56515298,-122.8577741,3,,Washington,Oregon,United States,Salix,net,,,
21800423,3/30/19,2019-03-30 21:08:37 UTC,854908,erybak,https://www.inaturalist.org/observations/21800423,45.56433112,-122.8580286,9,,Washington,Oregon,United States,Taraxacum,net,,,
21800634,3/30/19,2019-03-30 19:58:27 UTC,1450900,karenrichards,https://www.inaturalist.org/observations/21800634,44.03249238,-123.0872319,5,,Lane,Oregon,United States,Prunus,net,,,
21801703,3/30/19,2019-03-30 22:30:19 UTC,429964,amelathopoulos,https://www.inaturalist.org/observations/21801703,44.56003065,-123.2890599,9,,Benton,Oregon,United States,Prunus,net,,,
21801786,3/30/19,2019-03-30 20:36:56 UTC,1424904,newpawpaw,https://www.inaturalist.org/observations/21801786,45.56515106,-122.8577261,8,,Washington,Oregon,United States,Taraxacum,net,,,
21801815,3/30/19,2019-03-30 20:56:14 UTC,1424904,newpawpaw,https://www.inaturalist.org/observations/21801815,45.56367234,-122.8579274,10,,Washington,Oregon,United States,Salix,net,,,
21801844,3/30/19,2019-03-30 21:47:16 UTC,1424904,newpawpaw,https://www.inaturalist.org/observations/21801844,45.56528262,-122.8633598,5,,Washington,Oregon,United States,Pyrus communis,net,,,
21801954,3/30/19,2019-03-30 20:35:07 UTC,325615,grottaa,https://www.inaturalist.org/observations/21801954,45.5651774,-122.8579601,5,,Washington,Oregon,United States,Salicaceae,net,,,
21801995,3/30/19,2019-03-30 20:46:38 UTC,325615,grottaa,https://www.inaturalist.org/observations/21801995,45.56514815,-122.8580213,19,,Washington,Oregon,United States,Taraxacum officinale,net,,,
21802054,3/30/19,2019-03-30 21:37:53 UTC,325615,grottaa,https://www.inaturalist.org/observations/21802054,45.56541687,-122.8629624,20,,Washington,Oregon,United States,Berberis aquifolium,net,,,
21802717,3/30/19,2019-03-30 23:04:23 UTC,792468,molfamily,https://www.inaturalist.org/observations/21802717,45.50271391,-122.9866755,16,,Washington,Oregon,United States,Salix lucida,net,,,
21803123,3/30/19,2019-03-30 20:23:19 UTC,1425646,francis_opila,https://www.inaturalist.org/observations/21803123,45.56468624,-122.8579782,11,,Washington,Oregon,United States,Taraxacum,net,,,
21803149,3/30/19,2019-03-30 20:37:20 UTC,1566342,laura947,https://www.inaturalist.org/observations/21803149,45.56517153,-122.8581127,8,,Washington,Oregon,United States,Salix sitchensis,net,,,
21803156,3/30/19,2019-03-30 20:44:22 UTC,1425646,francis_opila,https://www.inaturalist.org/observations/21803156,45.56488037,-122.857933,,,Washington,Oregon,United States,Salix,net,,,
21803165,3/30/19,2019-03-30 23:14:16 UTC,754260,ellenwatrous,https://www.inaturalist.org/observations/21803165,44.5213175,-123.2953282,7,,Benton,Oregon,United States,Salix,net,,,
21803328,3/30/19,2019-03-30 20:50:14 UTC,1566342,laura947,https://www.inaturalist.org/observations/21803328,45.56460135,-122.8582159,7,,Washington,Oregon,United States,Taraxacum officinale,net,,,
21803360,3/30/19,2019-03-30 21:40:50 UTC,1566342,laura947,https://www.inaturalist.org/observations/21803360,45.56462849,-122.8627936,5,,Washington,Oregon,United States,Berberis repens,net,,,
21803584,3/30/19,2019-03-30 23:27:16 UTC,792468,molfamily,https://www.inaturalist.org/observations/21803584,45.49978587,-122.9892209,8,,Washington,Oregon,United States,Prunus,net,,,
21803692,3/30/19,2019-03-30 23:27:30 UTC,1566342,laura947,https://www.inaturalist.org/observations/21803692,45.5647187,-122.862921,4,,Washington,Oregon,United States,Salix,net,,,
21804617,3/30/19,2019-03-30 20:24:18 UTC,1462047,marksg,https://www.inaturalist.org/observations/21804617,45.56415602,-122.8580582,5,,Washington,Oregon,United States,Taraxacum officinale,net,,,
21804634,3/30/19,2019-03-30 20:29:57 UTC,1462047,marksg,https://www.inaturalist.org/observations/21804634,45.56404111,-122.8579737,5,,Washington,Oregon,United States,Salix,net,,,
21804652,3/30/19,2019-03-30 20:48:15 UTC,1462047,marksg,https://www.inaturalist.org/observations/21804652,45.56400234,-122.8578412,5,,Washington,Oregon,United States,Salicaceae,net,,,
21804669,3/30/19,2019-03-30 20:48:53 UTC,1462047,marksg,https://www.inaturalist.org/observations/21804669,45.56397418,-122.8578796,5,,Washington,Oregon,United States,Salicaceae,net,,,
21804687,3/30/19,2019-03-30 20:58:33 UTC,1462047,marksg,https://www.inaturalist.org/observations/21804687,45.55695412,-122.8672905,1647,,Washington,Oregon,United States,Salicaceae,net,,,
21804705,3/30/19,2019-03-30 21:11:33 UTC,1462047,marksg,https://www.inaturalist.org/observations/21804705,45.56438263,-122.857974,5,,Washington,Oregon,United States,Taraxacum officinale,net,,,
21804719,3/30/19,2019-03-30 21:14:41 UTC,1462047,marksg,https://www.inaturalist.org/observations/21804719,45.56477088,-122.8582964,5,,Washington,Oregon,United States,Taraxacum officinale,net,,,
21804728,3/30/19,2019-03-30 21:20:59 UTC,1462047,marksg,https://www.inaturalist.org/observations/21804728,45.56509488,-122.8582722,5,,Washington,Oregon,United States,Taraxacum officinale,net,,,
21804737,3/30/19,2019-03-30 21:36:34 UTC,1462047,marksg,https://www.inaturalist.org/observations/21804737,45.56525099,-122.8630216,5,,Washington,Oregon,United States,Prunus,net,,,
21805258,3/30/19,2019-03-31 00:09:36 UTC,754260,ellenwatrous,https://www.inaturalist.org/observations/21805258,44.52048764,-123.2951781,4,,Benton,Oregon,United States,Salix,net,,,
21806386,3/30/19,2019-03-31 00:34:55 UTC,754260,ellenwatrous,https://www.inaturalist.org/observations/21806386,44.52039021,-123.2952461,5,,Benton,Oregon,United States,Prunus,net,,,
21806449,3/30/19,2019-03-31 00:38:51 UTC,792468,molfamily,https://www.inaturalist.org/observations/21806449,45.49988469,-122.98902,48,,Washington,Oregon,United States,Berberis aquifolium,net,,,
21809702,3/30/19,2019-03-30 20:40:43 UTC,1505195,alpineambrosia,https://www.inaturalist.org/observations/21809702,45.56512844,-122.8576577,4,,Washington,Oregon,United States,Taraxacum officinale,net,,,
21812426,3/30/19,2019-03-31 00:10:00 UTC,620505,judithmaxwell,https://www.inaturalist.org/observations/21812426,42.09556944,-123.6854056,6,,Josephine,Oregon,United States,Arctostaphylos viscida,net,,,
21812602,3/30/19,2019-03-31 01:05:00 UTC,620505,judithmaxwell,https://www.inaturalist.org/observations/21812602,42.09493611,-123.6840778,32,,Josephine,Oregon,United States,Olsynium douglasii,net,,,
21812653,3/30/19,2019-03-31 01:41:00 UTC,620505,judithmaxwell,https://www.inaturalist.org/observations/21812653,42.15561667,-123.6498056,24,,Josephine,Oregon,United States,Salix,net,,,
21812855,3/30/19,2019-03-30 21:56:12 UTC,327525,brianalindh,https://www.inaturalist.org/observations/21812855,45.0350695,-124.0063472,5,,Lincoln,Oregon,United States,Salix,net,,,
21812980,3/30/19,2019-03-30 20:01:02 UTC,327525,brianalindh,https://www.inaturalist.org/observations/21812980,44.86207,-123.4563217,5,,Polk,Oregon,United States,Ranunculus,net,,,
21816996,3/30/19,2019-03-30 20:45:08 UTC,1423260,ahickman,https://www.inaturalist.org/observations/21816996,45.56504002,-122.8581611,5,,Washington,Oregon,United States,Salix lasiolepis,net,,,
21817024,3/30/19,2019-03-30 21:05:55 UTC,1423260,ahickman,https://www.inaturalist.org/observations/21817024,45.56483303,-122.8584511,5,,Washington,Oregon,United States,Erica,net,,,
21817029,3/30/19,2019-03-30 21:18:43 UTC,1423260,ahickman,https://www.inaturalist.org/observations/21817029,45.56479384,-122.8584227,5,,Washington,Oregon,United States,Saxifraga aizoides,net,,,
21817039,3/30/19,2019-03-31 05:37:53 UTC,1423260,ahickman,https://www.inaturalist.org/observations/21817039,45.56523961,-122.8629355,15,,Washington,Oregon,United States,Malpighiales,net,,,
21828888,3/30/19,2019-03-30 22:47:29 UTC,429964,amelathopoulos,https://www.inaturalist.org/observations/21828888,44.56015381,-123.2896476,10,,Benton,Oregon,United States,Salix,net,,,
21838499,3/30/19,2019-03-30 20:59:58 UTC,1539907,pdxmartha,https://www.inaturalist.org/observations/21838499,45.56370741,-122.8580258,5,,Washington,Oregon,United States,Lamium purpureum,net,,,
21838512,3/30/19,2019-03-30 21:16:05 UTC,1539907,pdxmartha,https://www.inaturalist.org/observations/21838512,45.564701,-122.858243,,,Washington,Oregon,United States,Taraxacum officinale,net,,,
21838534,3/30/19,2019-03-30 20:31:43 UTC,1539907,pdxmartha,https://www.inaturalist.org/observations/21838534,45.565202,-122.857919,,,Washington,Oregon,United States,Salix,net,,,
21839049,3/30/19,2019-03-30 21:51:52 UTC,752114,stephaniehazen,https://www.inaturalist.org/observations/21839049,44.88450886,-122.8876927,5,,Marion,Oregon,United States,Salix,net,,,
21841502,3/31/19,2019-03-31 19:26:37 UTC,752114,stephaniehazen,https://www.inaturalist.org/observations/21841502,44.88483294,-122.8877449,5,,Marion,Oregon,United States,Ranunculus,net,,,
21841523,3/31/19,2019-03-31 19:32:40 UTC,752114,stephaniehazen,https://www.inaturalist.org/observations/21841523,44.88407195,-122.8880466,5,,Marion,Oregon,United States,Taraxacum,net,,3/31/19 12:33,
21843921,3/31/19,2019-03-31 20:38:57 UTC,754260,ellenwatrous,https://www.inaturalist.org/observations/21843921,44.59597716,-123.3143253,6,,Benton,Oregon,United States,Salix,net,,,
21845317,3/31/19,2019-03-31 21:12:02 UTC,1550876,cassie_bouska,https://www.inaturalist.org/observations/21845317,43.0504474,-124.1313911,10,,Coos,Oregon,United States,,net,,,
21846732,3/30/19,2019-03-30 20:19:29 UTC,1561159,jocelyn_mcauley,https://www.inaturalist.org/observations/21846732,45.56496372,-122.8577826,9,,Washington,Oregon,United States,Salix,net,,,
21846759,3/30/19,2019-03-30 20:54:10 UTC,1561159,jocelyn_mcauley,https://www.inaturalist.org/observations/21846759,45.56384757,-122.8579202,11,,Washington,Oregon,United States,Conium maculatum,net,,,
21846780,3/30/19,2019-03-30 21:31:43 UTC,1561159,jocelyn_mcauley,https://www.inaturalist.org/observations/21846780,45.565422,-122.863153,,,Washington,Oregon,United States,Prunus cerasifera,net,,,
21853706,3/31/19,2019-04-01 00:31:57 UTC,754260,ellenwatrous,https://www.inaturalist.org/observations/21853706,44.60418544,-123.2410237,8,,Benton,Oregon,United States,Salix,net,,,
21900645,3/31/19,,620505,judithmaxwell,https://www.inaturalist.org/observations/21900645,42.56245556,-123.5816722,48,,Josephine,Oregon,United States,,net,,,
21927165,4/2/19,2019-04-02 23:34:23 UTC,792468,molfamily,https://www.inaturalist.org/observations/21927165,45.16779179,-123.1849484,12,,Yamhill,Oregon,United States,Brassica rapa,net,,,
21928209,4/2/19,2019-04-03 00:03:48 UTC,792468,molfamily,https://www.inaturalist.org/observations/21928209,45.19219554,-123.165838,3756,,Yamhill,Oregon,United States,Acer macrophyllum,net,,,
21935494,3/31/19,2019-03-31 22:33:00 UTC,841568,lohump,https://www.inaturalist.org/observations/21935494,43.85402539,-122.637987,,,Lane,Oregon,United States,Marah oregana,net,,,
21935798,3/31/19,2019-03-31 23:16:00 UTC,841568,lohump,https://www.inaturalist.org/observations/21935798,43.85353319,-122.6368048,,,Lane,Oregon,United States,Lomatium hallii,net,,,
21938922,4/2/19,2019-04-03 00:43:00 UTC,620505,judithmaxwell,https://www.inaturalist.org/observations/21938922,42.45883889,-123.4840333,12,,Josephine,Oregon,United States,Salix,net,,,
21956537,4/3/19,2019-04-03 19:47:47 UTC,792468,molfamily,https://www.inaturalist.org/observations/21956537,45.43395837,-122.8023014,8,,Washington,Oregon,United States,Ribes sanguineum,net,,,
21959507,4/3/19,2019-04-03 21:26:14 UTC,792468,molfamily,https://www.inaturalist.org/observations/21959507,45.16392383,-123.1871701,24,,Yamhill,Oregon,United States,Salix,net,,,
21960443,4/3/19,2019-04-03 21:51:07 UTC,792468,molfamily,https://www.inaturalist.org/observations/21960443,45.16802291,-123.1858581,16,,Yamhill,Oregon,United States,Brassica rapa,net,,,
21961339,4/3/19,2019-04-03 22:16:10 UTC,792468,molfamily,https://www.inaturalist.org/observations/21961339,45.17096439,-123.1866538,32,,Yamhill,Oregon,United States,Brassicaceae,net,,,
21963760,4/3/19,2019-04-03 21:14:28 UTC,327525,brianalindh,https://www.inaturalist.org/observations/21963760,44.93008,-123.032425,30,,Marion,Oregon,United States,Erythronium oregonum,net,,,
21963796,4/3/19,2019-04-03 23:04:20 UTC,327525,brianalindh,https://www.inaturalist.org/observations/21963796,44.93559167,-123.0150445,5,,Marion,Oregon,United States,Salix,net,,,
21966113,3/28/19,2019-03-28 23:10:00 UTC,28,tiwane,https://www.inaturalist.org/observations/21966113,34.73600833,-118.3908367,,,Los Angeles,California,United States,Phacelia tanacetifolia,net,,4/1/19 17:37,4/2/19 14:37
21971184,4/3/19,2019-04-04 00:07:08 UTC,327525,brianalindh,https://www.inaturalist.org/observations/21971184,44.93598,-123.0174333,5,,Marion,Oregon,United States,Andrena,net,,,
21984671,4/4/19,2019-04-04 16:13:18 UTC,808137,robmor,https://www.inaturalist.org/observations/21984671,44.61774251,-123.2815167,5,,Benton,Oregon,United States,Narcissus 'tahiti',net,,,
22002007,4/4/19,2019-04-05 00:14:58 UTC,792468,molfamily,https://www.inaturalist.org/observations/22002007,45.17084405,-123.1860863,32,,Yamhill,Oregon,United States,Taraxacum,net,,,
22013024,3/29/19,2019-03-29 21:24:00 UTC,28,tiwane,https://www.inaturalist.org/observations/22013024,33.72592667,-115.8216533,,,Riverside,California,United States,Eriophyllum wallacei,net,,4/5/19 12:45,
22107893,4/6/19,2019-04-06 18:45:37 UTC,792468,molfamily,https://www.inaturalist.org/observations/22107893,45.15705905,-123.3222808,16,,Yamhill,Oregon,United States,Ranunculus occidentalis,net,,,
22107960,4/6/19,2019-04-06 20:15:44 UTC,792468,molfamily,https://www.inaturalist.org/observations/22107960,45.15387092,-123.3219175,48,,Yamhill,Oregon,United States,Taraxacum,net,,,
22108952,4/6/19,2019-04-06 20:48:04 UTC,792468,molfamily,https://www.inaturalist.org/observations/22108952,45.16808747,-123.1860097,12,,Yamhill,Oregon,United States,Brassica rapa,net,,,
22120563,4/4/19,2019-04-04 22:20:00 UTC,841568,lohump,https://www.inaturalist.org/observations/22120563,43.9899,-123.0353,20,,Lane,Oregon,United States,Oemleria cerasiformis,net,,,
22120627,4/6/19,2019-04-06 21:05:45 UTC,1467407,richwittrup,https://www.inaturalist.org/observations/22120627,44.69983813,-123.4374199,8,,Benton,Oregon,United States,Cichorieae,net,,,
22120833,4/4/19,2019-04-04 22:41:00 UTC,841568,lohump,https://www.inaturalist.org/observations/22120833,43.99,-123.0349,20,,Lane,Oregon,United States,Salix,net,,,
22125358,4/6/19,2019-04-06 21:14:39 UTC,1434967,emtimm,https://www.inaturalist.org/observations/22125358,44.6995536,-123.4382627,9,,Benton,Oregon,United States,Berberis aquifolium,net,,,
22153928,4/7/19,2019-04-07 18:51:01 UTC,800960,pamarion,https://www.inaturalist.org/observations/22153928,45.64135264,-122.8180239,5,,Multnomah,Oregon,United States,Taraxacum,net,,,
22214517,4/8/19,2019-04-08 22:58:02 UTC,1462047,marksg,https://www.inaturalist.org/observations/22214517,45.51486201,-122.8466986,5,,Washington,Oregon,United States,Taraxacum officinale,net,,,
22214741,4/8/19,2019-04-08 23:00:35 UTC,1582689,twoleglaura,https://www.inaturalist.org/observations/22214741,45.517262,-122.6366553,50,Portland,Multnomah,Oregon,United States,,net,,,
22251979,4/9/19,2019-04-09 20:03:20 UTC,792468,molfamily,https://www.inaturalist.org/observations/22251979,45.49940044,-122.9823305,16,,Washington,Oregon,United States,Salix lucida,net,,,
22253466,4/9/19,2019-04-09 20:30:56 UTC,792468,molfamily,https://www.inaturalist.org/observations/22253466,45.50209302,-122.9806625,16,,Washington,Oregon,United States,Salix,net,,,
22255175,4/9/19,2019-04-09 21:15:28 UTC,792468,molfamily,https://www.inaturalist.org/observations/22255175,45.50159111,-122.9832081,6,,Washington,Oregon,United States,Brassica rapa,net,,,
22257723,4/9/19,2019-04-09 22:28:56 UTC,792468,molfamily,https://www.inaturalist.org/observations/22257723,45.55768627,-122.9147747,16,,Washington,Oregon,United States,Brassica rapa,net,,,
22258843,4/9/19,2019-04-09 22:57:26 UTC,754260,ellenwatrous,https://www.inaturalist.org/observations/22258843,44.59929431,-123.3156662,8,,Benton,Oregon,United States,Berberis aquifolium,net,,,
22310738,4/9/19,2019-04-09 22:35:00 UTC,620505,judithmaxwell,https://www.inaturalist.org/observations/22310738,42.31406667,-122.9734333,12,,Jackson,Oregon,United States,Adelinia grande,net,,,
22310908,4/9/19,2019-04-10 00:57:00 UTC,620505,judithmaxwell,https://www.inaturalist.org/observations/22310908,42.48042778,-122.6745139,12,,Jackson,Oregon,United States,Lomatium utriculatum,net,,,
22359826,4/9/19,2019-04-09 20:03:25 UTC,792775,dto,https://www.inaturalist.org/observations/22359826,45.5168258,-122.9915449,1700,,Washington,Oregon,United States,Salix,vane trap,,,
22359924,4/9/19,2019-04-09 20:29:19 UTC,792775,dto,https://www.inaturalist.org/observations/22359924,45.5020767,-122.9806441,9,,Washington,Oregon,United States,Salix,net,,,
22359926,4/9/19,2019-04-09 21:13:37 UTC,792775,dto,https://www.inaturalist.org/observations/22359926,45.501421,-122.983198,2700,,Washington,Oregon,United States,Brassica rapa,net,,,
22359932,4/9/19,2019-04-09 21:36:17 UTC,792775,dto,https://www.inaturalist.org/observations/22359932,45.5168258,-122.9915449,1700,,Washington,Oregon,United States,Berberis aquifolium,net,,,
22359954,4/9/19,2019-04-09 21:47:48 UTC,792775,dto,https://www.inaturalist.org/observations/22359954,45.5168258,-122.9915449,1700,,Washington,Oregon,United States,Ranunculus occidentalis,net,,,
22380983,4/12/19,2019-04-12 19:34:15 UTC,831425,fffpat2,https://www.inaturalist.org/observations/22380983,45.24671746,-123.2749628,5,,Yamhill,Oregon,United States,Taraxacum,net,,,
22381054,4/12/19,2019-04-12 19:35:23 UTC,885553,threeyees,https://www.inaturalist.org/observations/22381054,45.24681584,-123.2744467,9,,Yamhill,Oregon,United States,Taraxacum officinale,net,,,
22381090,4/12/19,2019-04-12 19:38:17 UTC,816767,jeaniet,https://www.inaturalist.org/observations/22381090,45.24695438,-123.2753062,5,,Yamhill,Oregon,United States,Taraxacum,net,,,
22381116,4/12/19,2019-04-12 19:38:58 UTC,792468,molfamily,https://www.inaturalist.org/observations/22381116,45.24687236,-123.274998,48,,Yamhill,Oregon,United States,Taraxacum,net,,,
22381447,4/12/19,2019-04-12 19:36:52 UTC,354308,maryjomosby,https://www.inaturalist.org/observations/22381447,45.24683217,-123.2748489,5,,Yamhill,Oregon,United States,Taraxacum,net,,,
22381476,4/12/19,2019-04-12 19:48:18 UTC,816767,jeaniet,https://www.inaturalist.org/observations/22381476,45.24701343,-123.2747387,10,,Yamhill,Oregon,United States,Berberis aquifolium,net,,,
22381954,4/12/19,2019-04-12 19:59:22 UTC,792468,molfamily,https://www.inaturalist.org/observations/22381954,45.24629647,-123.2748313,12,,Yamhill,Oregon,United States,Ribes sanguineum,net,,,
22383115,4/12/19,2019-04-12 20:28:25 UTC,885553,threeyees,https://www.inaturalist.org/observations/22383115,45.24575395,-123.2720576,7,,Yamhill,Oregon,United States,Salix sitchensis,net,,,
22383185,4/12/19,2019-04-12 20:30:12 UTC,792468,molfamily,https://www.inaturalist.org/observations/22383185,45.24583499,-123.2723006,16,,Yamhill,Oregon,United States,Salix scouleriana,net,,,
22383214,4/12/19,2019-04-12 20:29:49 UTC,831425,fffpat2,https://www.inaturalist.org/observations/22383214,45.24590488,-123.272258,10,,Yamhill,Oregon,United States,Salix scouleriana,net,PEF,,
22383227,4/12/19,2019-04-12 19:53:24 UTC,354308,maryjomosby,https://www.inaturalist.org/observations/22383227,45.24682827,-123.2754702,5,,Yamhill,Oregon,United States,Bellis perennis,net,,,
22383272,4/12/19,2019-04-12 20:30:12 UTC,354308,maryjomosby,https://www.inaturalist.org/observations/22383272,45.24596343,-123.2723707,5,,Yamhill,Oregon,United States,Salix,net,,,
22383304,4/12/19,2019-04-12 20:31:50 UTC,1351592,emilygladhart,https://www.inaturalist.org/observations/22383304,45.24599734,-123.2724266,9,,Yamhill,Oregon,United States,Salix,net,,,
22385779,4/12/19,2019-04-12 21:39:19 UTC,175529,jerrypaul,https://www.inaturalist.org/observations/22385779,44.60291643,-123.2647382,5,,Benton,Oregon,United States,Stewartia pseudocamellia,net,,,4/12/19 14:40
22388224,4/12/19,2019-04-12 20:35:38 UTC,1085105,canalest,https://www.inaturalist.org/observations/22388224,45.24578573,-123.2721697,5,,Yamhill,Oregon,United States,Salix sitchensis,net,,,
22388292,4/12/19,2019-04-12 19:33:15 UTC,1085105,canalest,https://www.inaturalist.org/observations/22388292,45.24658767,-123.2745737,10,,Yamhill,Oregon,United States,Taraxacum officinale,net,,,
22388729,4/12/19,2019-04-12 22:55:10 UTC,754260,ellenwatrous,https://www.inaturalist.org/observations/22388729,44.59905073,-123.3153711,5,,Benton,Oregon,United States,Berberis repens,net,,,
22389017,4/12/19,2019-04-12 21:07:49 UTC,1447015,phylismcintosh,https://www.inaturalist.org/observations/22389017,42.48624184,-122.6659982,5,,Jackson,Oregon,United States,Ranunculus occidentalis,net,,,
22389174,4/12/19,2019-04-12 23:06:37 UTC,1447015,phylismcintosh,https://www.inaturalist.org/observations/22389174,42.48059307,-122.6743488,5,,Jackson,Oregon,United States,Plagiobothrys nothofulvus,net,,,
22391661,4/12/19,2019-04-13 00:24:50 UTC,792468,molfamily,https://www.inaturalist.org/observations/22391661,45.23021625,-123.1035213,200,,Yamhill,Oregon,United States,Bellis perennis,net,,,
22392362,4/12/19,2019-04-12 22:03:09 UTC,327525,brianalindh,https://www.inaturalist.org/observations/22392362,44.93533333,-123.0148778,5,,Marion,Oregon,United States,,net,,,
22392464,4/12/19,2019-04-12 22:05:13 UTC,327525,brianalindh,https://www.inaturalist.org/observations/22392464,44.93535333,-123.0149167,5,,Marion,Oregon,United States,Taraxacum,net,,,
22392533,4/12/19,2019-04-12 22:11:52 UTC,327525,brianalindh,https://www.inaturalist.org/observations/22392533,44.93571333,-123.0146722,30,,Marion,Oregon,United States,,net,,,
22392693,4/12/19,2019-04-12 22:32:51 UTC,327525,brianalindh,https://www.inaturalist.org/observations/22392693,44.936305,-123.0146722,5,,Marion,Oregon,United States,Bellis perennis,net,,,
22392873,4/12/19,2019-04-13 01:01:12 UTC,792468,molfamily,https://www.inaturalist.org/observations/22392873,45.21098742,-123.1734508,32,,Yamhill,Oregon,United States,Bellis perennis,net,,,
22394725,4/12/19,2019-04-13 01:35:55 UTC,752114,stephaniehazen,https://www.inaturalist.org/observations/22394725,44.88392212,-122.8879396,5,,Marion,Oregon,United States,,net,,4/12/19 18:36,
22394779,4/12/19,2019-04-13 01:57:26 UTC,752114,stephaniehazen,https://www.inaturalist.org/observations/22394779,44.89532868,-122.8924384,5,,Marion,Oregon,United States,,net,,4/12/19 18:57,
22395411,4/12/19,2019-04-13 00:02:23 UTC,327525,brianalindh,https://www.inaturalist.org/observations/22395411,44.93522167,-123.0147083,10,,Marion,Oregon,United States,Pyrus,net,,,
22395456,4/12/19,2019-04-13 00:04:53 UTC,327525,brianalindh,https://www.inaturalist.org/observations/22395456,44.93552,-123.0152056,5,,Marion,Oregon,United States,Salix,net,,,
22395557,4/12/19,2019-04-12 22:40:08 UTC,327525,brianalindh,https://www.inaturalist.org/observations/22395557,44.933345,-123.0151667,10,,Marion,Oregon,United States,Taraxacum,net,,,
22395781,4/9/19,2019-04-09 22:16:23 UTC,327525,brianalindh,https://www.inaturalist.org/observations/22395781,44.93683833,-123.0334917,1590,,Marion,Oregon,United States,,net,,,
22396408,4/12/19,2019-04-13 02:09:00 UTC,620505,judithmaxwell,https://www.inaturalist.org/observations/22396408,42.48048889,-122.6745028,96,,Jackson,Oregon,United States,Plagiobothrys nothofulvus,net,,,
22404973,4/12/19,2019-04-12 19:04:54 UTC,792775,dto,https://www.inaturalist.org/observations/22404973,45.2472475,-123.2752583,8,,Yamhill,Oregon,United States,Taraxacum officinale,net,,,
22404977,4/12/19,2019-04-12 20:32:00 UTC,792775,dto,https://www.inaturalist.org/observations/22404977,45.24595449,-123.2723008,10,,Yamhill,Oregon,United States,Salix scouleriana,net,,,
22413420,4/12/19,2019-04-12 18:48:00 UTC,1482843,jdillow,https://www.inaturalist.org/observations/22413420,45.30404251,-122.9636732,6,,Yamhill,Oregon,United States,Arctostaphylos manzanita,net,,,
22417083,4/12/19,2019-04-12 20:30:06 UTC,816767,jeaniet,https://www.inaturalist.org/observations/22417083,45.2457289,-123.271931,5,,Yamhill,Oregon,United States,Salix,net,,,
22419401,4/12/19,2019-04-12 19:38:54 UTC,1542491,nicolaspackard,https://www.inaturalist.org/observations/22419401,45.2460423,-123.275059,135,,Yamhill,Oregon,United States,Taraxacum,net,,,
22419437,4/12/19,2019-04-12 20:37:39 UTC,1542491,nicolaspackard,https://www.inaturalist.org/observations/22419437,45.2206825,-123.1983147,2500,,Yamhill,Oregon,United States,Salix sitchensis,net,,,
22502118,4/4/19,2019-04-04 17:00:21 UTC,325615,grottaa,https://www.inaturalist.org/observations/22502118,45.47778556,-123.2333793,82,,Washington,Oregon,United States,,pan trap,,4/2/19 11:00,4/4/19 9:30
22502121,4/4/19,2019-04-04 17:30:16 UTC,325615,grottaa,https://www.inaturalist.org/observations/22502121,45.47784358,-123.2403884,194,,Washington,Oregon,United States,,pan trap,,4/2/19 11:00,4/4/19 10:00
22502124,4/4/19,2019-04-04 17:30:34 UTC,325615,grottaa,https://www.inaturalist.org/observations/22502124,45.47376889,-123.2477041,227,,Washington,Oregon,United States,,pan trap,,4/2/19 12:00,4/4/19 10:30
22502125,4/14/19,2019-04-14 20:48:41 UTC,1539907,pdxmartha,https://www.inaturalist.org/observations/22502125,45.51603104,-123.9044366,11,,Tillamook,Oregon,United States,Ericaceae,net,,,
22576394,4/16/19,2019-04-16 21:19:06 UTC,792468,molfamily,https://www.inaturalist.org/observations/22576394,45.43422951,-122.8020158,64,,Washington,Oregon,United States,Taraxacum officinale,net,,,
22585938,4/16/19,2019-04-17 02:41:00 UTC,620505,judithmaxwell,https://www.inaturalist.org/observations/22585938,42.35634722,-123.406925,6,,Josephine,Oregon,United States,Arctostaphylos viscida,net,,,
22585993,4/16/19,2019-04-17 02:47:00 UTC,620505,judithmaxwell,https://www.inaturalist.org/observations/22585993,42.35636944,-123.40675,64,,Josephine,Oregon,United States,Ranunculus occidentalis,net,,,
22586018,4/16/19,2019-04-17 02:49:00 UTC,620505,judithmaxwell,https://www.inaturalist.org/observations/22586018,42.35641389,-123.4068833,48,,Josephine,Oregon,United States,Lithophragma,net,,,
22586044,4/16/19,2019-04-17 03:01:00 UTC,620505,judithmaxwell,https://www.inaturalist.org/observations/22586044,42.35596389,-123.4105278,48,,Josephine,Oregon,United States,Acer macrophyllum,net,,,
22628910,4/17/19,2019-04-17 21:52:55 UTC,754260,ellenwatrous,https://www.inaturalist.org/observations/22628910,44.59913345,-123.314848,9,,Benton,Oregon,United States,Erythronium oregonum,net,,,
22629701,4/17/19,2019-04-17 21:48:15 UTC,1462047,marksg,https://www.inaturalist.org/observations/22629701,45.51513792,-122.8456194,65,,Washington,Oregon,United States,Bellis perennis,net,,,
22630025,4/17/19,2019-04-17 22:16:43 UTC,754260,ellenwatrous,https://www.inaturalist.org/observations/22630025,44.59934395,-123.3160393,4,,Benton,Oregon,United States,Balsamorhiza deltoidea,net,,,
22630348,4/17/19,2019-04-17 22:22:04 UTC,1478567,nancy280,https://www.inaturalist.org/observations/22630348,45.43421775,-122.802411,9,,Washington,Oregon,United States,Taraxacum officinale,net,,,
22630450,4/16/19,2019-04-16 21:58:50 UTC,1462047,marksg,https://www.inaturalist.org/observations/22630450,45.48911688,-122.8338557,1414,,Washington,Oregon,United States,Taraxacum officinale,net,,,
22630463,4/17/19,2019-04-17 22:26:01 UTC,1462047,marksg,https://www.inaturalist.org/observations/22630463,45.51539946,-122.8458763,65,,Washington,Oregon,United States,Salix,net,,,
22630738,4/17/19,2019-04-17 22:34:13 UTC,1629810,jnoren,https://www.inaturalist.org/observations/22630738,45.43417355,-122.8031151,65,,Washington,Oregon,United States,Taraxacum officinale,net,,,
22631820,4/17/19,2019-04-17 22:57:43 UTC,792468,molfamily,https://www.inaturalist.org/observations/22631820,45.43461072,-122.802994,24,,Washington,Oregon,United States,Taraxacum officinale,net,,,
22631873,4/17/19,2019-04-17 22:57:03 UTC,754260,ellenwatrous,https://www.inaturalist.org/observations/22631873,44.59938638,-123.3157214,9,,Benton,Oregon,United States,Fragaria virginiana,net,,,
22632949,4/17/19,2019-04-17 23:10:58 UTC,1462047,marksg,https://www.inaturalist.org/observations/22632949,45.51532519,-122.8467411,5,,Washington,Oregon,United States,Bellis perennis,net,,,
22637237,4/17/19,2019-04-17 23:00:29 UTC,327525,brianalindh,https://www.inaturalist.org/observations/22637237,44.96218,-123.2574217,5,,Polk,Oregon,United States,Bellis perennis,net,,,
22637306,4/17/19,2019-04-17 23:15:05 UTC,327525,brianalindh,https://www.inaturalist.org/observations/22637306,44.96254667,-123.257605,10,,Polk,Oregon,United States,Crataegus monogyna,net,,,
22637357,4/17/19,2019-04-17 23:27:40 UTC,327525,brianalindh,https://www.inaturalist.org/observations/22637357,44.96398667,-123.25888,6535,,Polk,Oregon,United States,Ranunculus,net,,,
22637429,4/17/19,2019-04-17 23:51:37 UTC,327525,brianalindh,https://www.inaturalist.org/observations/22637429,44.963255,-123.2618867,1966,,Polk,Oregon,United States,Danthonia californica,net,,,
22637489,4/17/19,2019-04-18 00:05:29 UTC,327525,brianalindh,https://www.inaturalist.org/observations/22637489,44.96327167,-123.2610633,5,,Polk,Oregon,United States,Marah oregana,net,,,
22639432,4/17/19,2019-04-18 02:03:17 UTC,792468,molfamily,https://www.inaturalist.org/observations/22639432,45.17107505,-123.1866747,96,,Yamhill,Oregon,United States,Raphanus bipinnatus,net,,,
22663985,4/18/19,2019-04-18 17:42:01 UTC,792468,molfamily,https://www.inaturalist.org/observations/22663985,45.29198913,-123.1886853,8,,Yamhill,Oregon,United States,Taraxacum officinale,net,,,
22668320,4/18/19,2019-04-18 18:15:29 UTC,792468,molfamily,https://www.inaturalist.org/observations/22668320,45.33806548,-123.1849934,32,,Yamhill,Oregon,United States,Taraxacum officinale,net,,,
22670414,4/18/19,2019-04-18 19:06:07 UTC,792468,molfamily,https://www.inaturalist.org/observations/22670414,45.50005284,-122.98948,24,,Washington,Oregon,United States,Ribes aureum,net,,,
22671123,4/18/19,2019-04-18 19:21:07 UTC,792468,molfamily,https://www.inaturalist.org/observations/22671123,45.49979141,-122.9866225,32,,Washington,Oregon,United States,Mahonia,net,,,
22672474,4/18/19,2019-04-18 19:50:50 UTC,792468,molfamily,https://www.inaturalist.org/observations/22672474,45.50152054,-122.983239,32,,Washington,Oregon,United States,Brassica rapa,net,,,
22673289,4/18/19,2019-04-18 20:06:30 UTC,792468,molfamily,https://www.inaturalist.org/observations/22673289,45.50202925,-122.9824068,16,,Washington,Oregon,United States,Salix,net,,,
22675271,4/18/19,2019-04-18 18:46:49 UTC,1462047,marksg,https://www.inaturalist.org/observations/22675271,45.51531731,-122.8462561,5,,Washington,Oregon,United States,Salicaceae,net,,,
22675699,4/18/19,2019-04-18 21:07:04 UTC,754260,ellenwatrous,https://www.inaturalist.org/observations/22675699,44.58565133,-123.2507365,3,,Benton,Oregon,United States,Berberis aquifolium,net,,,
22675862,4/18/19,2019-04-18 21:13:11 UTC,792468,molfamily,https://www.inaturalist.org/observations/22675862,45.49857972,-122.9842585,16,,Washington,Oregon,United States,Prunus,net,,,
22676025,4/18/19,2019-04-18 21:16:42 UTC,808137,robmor,https://www.inaturalist.org/observations/22676025,44.58586651,-123.2505226,5,,Benton,Oregon,United States,Berberis aquifolium,net,,,
22676998,4/18/19,2019-04-18 18:22:29 UTC,752114,stephaniehazen,https://www.inaturalist.org/observations/22676998,44.87643574,-124.0373693,5,,Lincoln,Oregon,United States,Lonicera involucrata,net,,,
22677016,4/18/19,2019-04-18 20:44:10 UTC,752114,stephaniehazen,https://www.inaturalist.org/observations/22677016,44.8290769,-124.0637983,5,,Lincoln,Oregon,United States,Gaultheria shallon,net,,,
22677063,4/18/19,2019-04-18 21:40:18 UTC,752114,stephaniehazen,https://www.inaturalist.org/observations/22677063,44.76019677,-124.0659276,5,,Lincoln,Oregon,United States,Gaultheria shallon,net,,,
22677126,4/18/19,2019-04-18 21:37:21 UTC,808137,robmor,https://www.inaturalist.org/observations/22677126,44.58593465,-123.2508817,5,,Benton,Oregon,United States,Viburnum tinus,net,,,
22677186,4/18/19,2019-04-18 21:42:38 UTC,792468,molfamily,https://www.inaturalist.org/observations/22677186,45.49978068,-122.9891397,12,,Washington,Oregon,United States,Berberis aquifolium,net,,,
22677584,4/18/19,2019-04-18 21:50:49 UTC,754260,ellenwatrous,https://www.inaturalist.org/observations/22677584,44.58615048,-123.2509035,6,,Benton,Oregon,United States,Eschscholzia californica,net,,,
22677674,4/18/19,2019-04-18 21:54:30 UTC,752114,stephaniehazen,https://www.inaturalist.org/observations/22677674,44.7601189,-124.0660057,5,,Lincoln,Oregon,United States,Rubus ursinus,net,,,
22678189,4/18/19,2019-04-18 19:49:13 UTC,792775,dto,https://www.inaturalist.org/observations/22678189,45.50147376,-122.9830812,8,,Washington,Oregon,United States,Brassica rapa,net,,,
22678223,4/18/19,2019-04-18 20:08:28 UTC,792775,dto,https://www.inaturalist.org/observations/22678223,45.50201621,-122.9824411,13,,Washington,Oregon,United States,Salix,net,,,
22678245,4/18/19,2019-04-18 20:59:50 UTC,792775,dto,https://www.inaturalist.org/observations/22678245,45.49882469,-122.9829827,9,,Washington,Oregon,United States,Conium maculatum,net,,,
22678263,4/18/19,2019-04-18 21:11:20 UTC,792775,dto,https://www.inaturalist.org/observations/22678263,45.49853976,-122.9840643,9,,Washington,Oregon,United States,Prunus emarginata,net,,,
22678278,4/18/19,2019-04-18 21:43:15 UTC,792775,dto,https://www.inaturalist.org/observations/22678278,45.49974231,-122.9895349,29,,Washington,Oregon,United States,Taraxacum officinale,net,,,
22679512,4/18/19,2019-04-18 22:30:04 UTC,1566342,laura947,https://www.inaturalist.org/observations/22679512,45.69407112,-122.7846937,9,,Multnomah,Oregon,United States,Ribes sanguineum,net,,,
22680222,4/18/19,2019-04-18 22:49:16 UTC,752114,stephaniehazen,https://www.inaturalist.org/observations/22680222,44.61182807,-124.0500194,5,,Lincoln,Oregon,United States,Lithodora,net,,,
22680873,4/18/19,2019-04-18 23:10:52 UTC,752114,stephaniehazen,https://www.inaturalist.org/observations/22680873,44.61838339,-124.0535055,5,,Lincoln,Oregon,United States,Ericaceae,net,,,
22681687,4/18/19,2019-04-18 23:30:04 UTC,752114,stephaniehazen,https://www.inaturalist.org/observations/22681687,44.61470558,-124.0627319,5,,Lincoln,Oregon,United States,,net,,,
22681717,4/18/19,2019-04-18 21:15:29 UTC,175529,jerrypaul,https://www.inaturalist.org/observations/22681717,44.58585272,-123.2505835,5,,Benton,Oregon,United States,Berberis aquifolium,net,,,
22681758,4/18/19,2019-04-18 23:29:09 UTC,1546088,scotttienken,https://www.inaturalist.org/observations/22681758,45.3296159,-122.9685921,100,,Yamhill,Oregon,United States,Brassica rapa,net,,,
22681840,4/18/19,2019-04-18 23:35:05 UTC,752114,stephaniehazen,https://www.inaturalist.org/observations/22681840,44.61471899,-124.0627951,5,,Lincoln,Oregon,United States,Vaccinium ovatum,net,,,
22681954,4/18/19,2019-04-18 23:39:41 UTC,792468,molfamily,https://www.inaturalist.org/observations/22681954,45.33134041,-122.9675722,32,,Yamhill,Oregon,United States,Brassica rapa,net,,,
22681982,4/18/19,2019-04-18 23:40:09 UTC,752114,stephaniehazen,https://www.inaturalist.org/observations/22681982,44.61460655,-124.0629103,5,,Lincoln,Oregon,United States,Vaccinium ovatum,net,,,
22682080,4/18/19,2019-04-18 23:41:24 UTC,752114,stephaniehazen,https://www.inaturalist.org/observations/22682080,44.6146174,-124.0629147,5,,Lincoln,Oregon,United States,Vaccinium ovatum,net,,,
22682244,4/18/19,2019-04-18 23:46:04 UTC,752114,stephaniehazen,https://www.inaturalist.org/observations/22682244,44.61457675,-124.063005,5,,Lincoln,Oregon,United States,Vaccinium ovatum,net,,,
22682501,4/18/19,2019-04-18 23:51:59 UTC,752114,stephaniehazen,https://www.inaturalist.org/observations/22682501,44.61446137,-124.0630934,5,,Lincoln,Oregon,United States,Vaccinium ovatum,net,,,
22682613,4/18/19,2019-04-18 23:54:15 UTC,752114,stephaniehazen,https://www.inaturalist.org/observations/22682613,44.61466053,-124.0631487,5,,Lincoln,Oregon,United States,Vaccinium ovatum,net,,,
22682788,4/18/19,2019-04-18 23:59:11 UTC,752114,stephaniehazen,https://www.inaturalist.org/observations/22682788,44.61466815,-124.0631433,5,,Lincoln,Oregon,United States,Vaccinium ovatum,net,,,
22682937,4/18/19,2019-04-19 00:02:11 UTC,752114,stephaniehazen,https://www.inaturalist.org/observations/22682937,44.61466782,-124.0631096,5,,Lincoln,Oregon,United States,Vaccinium ovatum,net,,,
22685002,4/18/19,2019-04-18 21:28:09 UTC,733757,pattiwittrup,https://www.inaturalist.org/observations/22685002,44.58567721,-123.2507115,8,,Benton,Oregon,United States,Berberis aquifolium,net,,,
22686122,4/18/19,2019-04-19 00:34:30 UTC,792468,molfamily,https://www.inaturalist.org/observations/22686122,45.20464987,-123.1324344,12,,Yamhill,Oregon,United States,Vitaceae,net,,,
22687493,4/18/19,2019-04-18 21:17:56 UTC,327525,brianalindh,https://www.inaturalist.org/observations/22687493,45.02223617,-123.1452167,165,,Polk,Oregon,United States,Amelanchier alnifolia,net,,,
22687604,4/18/19,2019-04-18 21:28:03 UTC,327525,brianalindh,https://www.inaturalist.org/observations/22687604,45.02401667,-123.1436472,5,,Polk,Oregon,United States,Arbutus menziesii,net,,,
22688110,4/18/19,2019-04-18 21:35:38 UTC,327525,brianalindh,https://www.inaturalist.org/observations/22688110,45.02361383,-123.1473917,5005,,Polk,Oregon,United States,Ranunculus,net,,,
22688327,4/18/19,2019-04-18 21:44:45 UTC,327525,brianalindh,https://www.inaturalist.org/observations/22688327,45.02593883,-123.1505667,30,,Polk,Oregon,United States,Taraxacum officinale,net,,,
22688474,4/18/19,2019-04-18 22:37:50 UTC,327525,brianalindh,https://www.inaturalist.org/observations/22688474,45.02204167,-123.149825,165,,Polk,Oregon,United States,Prunus,net,,,
22704483,4/18/19,2019-04-18 21:06:28 UTC,1467407,richwittrup,https://www.inaturalist.org/observations/22704483,44.58569597,-123.2507022,12,,Benton,Oregon,United States,Berberis aquifolium,net,,,
22705558,4/18/19,2019-04-18 19:24:56 UTC,770229,englerj,https://www.inaturalist.org/observations/22705558,45.49980726,-122.9865631,7,,Washington,Oregon,United States,Berberis aquifolium,net,,,
22705581,4/18/19,2019-04-18 19:51:17 UTC,770229,englerj,https://www.inaturalist.org/observations/22705581,45.50154239,-122.9831958,9,,Washington,Oregon,United States,Brassica rapa,net,,,
22705604,4/18/19,2019-04-18 20:08:51 UTC,770229,englerj,https://www.inaturalist.org/observations/22705604,45.50192495,-122.9826639,3,,Washington,Oregon,United States,Salix,net,,,
22705625,4/18/19,2019-04-18 21:43:52 UTC,770229,englerj,https://www.inaturalist.org/observations/22705625,45.49975879,-122.9892141,8,,Washington,Oregon,United States,Ribes sanguineum,net,,,
22707355,4/18/19,,620505,judithmaxwell,https://www.inaturalist.org/observations/22707355,42.42784167,-123.5442528,32,,Josephine,Oregon,United States,Erythronium,net,,,
22707458,4/18/19,,620505,judithmaxwell,https://www.inaturalist.org/observations/22707458,42.35636944,-123.40675,64,,Josephine,Oregon,United States,Ranunculus occidentalis,net,,,
22707580,4/18/19,2019-04-19 00:50:00 UTC,620505,judithmaxwell,https://www.inaturalist.org/observations/22707580,42.4272,-123.5453,48,,Josephine,Oregon,United States,Ceanothus cuneatus,net,,,
22707894,4/18/19,,620505,judithmaxwell,https://www.inaturalist.org/observations/22707894,42.3035,-123.1889,6,,Jackson,Oregon,United States,Arctostaphylos,net,,,
22708009,4/18/19,,620505,judithmaxwell,https://www.inaturalist.org/observations/22708009,42.3035,-123.1889,48,,Jackson,Oregon,United States,Boraginaceae,net,,,
22709776,4/18/19,2019-04-18 23:15:13 UTC,1566342,laura947,https://www.inaturalist.org/observations/22709776,45.69271865,-122.7879772,10,,Multnomah,Oregon,United States,Ribes divaricatum,net,,,
22715711,4/18/19,2019-04-18 18:57:00 UTC,1539907,pdxmartha,https://www.inaturalist.org/observations/22715711,45.4732266,-122.6127947,22,Portland,Multnomah,Oregon,United States,Viburnum carlesii,net,,,
22715873,4/18/19,2019-04-18 18:55:00 UTC,1539907,pdxmartha,https://www.inaturalist.org/observations/22715873,45.47322167,-122.6126679,11,Portland,Multnomah,Oregon,United States,Ribes grossularia,net,,,
22716045,4/18/19,2019-04-18 21:00:00 UTC,1539907,pdxmartha,https://www.inaturalist.org/observations/22716045,45.47319439,-122.6127155,11,Portland,Multnomah,Oregon,United States,Eruca vesicaria,net,,,
22718655,4/19/19,2019-04-19 18:48:26 UTC,620505,judithmaxwell,https://www.inaturalist.org/observations/22718655,42.09620806,-123.6840879,16,,Josephine,Oregon,United States,Lomatium,net,,,
22719542,4/19/19,2019-04-19 19:06:31 UTC,1447015,phylismcintosh,https://www.inaturalist.org/observations/22719542,42.09567843,-123.6841866,5,,Josephine,Oregon,United States,Lomatium,net,,,
22727655,4/19/19,2019-04-19 22:01:36 UTC,860617,laustin,https://www.inaturalist.org/observations/22727655,42.06584506,-123.6359435,5,,Josephine,Oregon,United States,Ranunculus occidentalis,net,,,
22727909,4/19/19,2019-04-19 18:49:06 UTC,620505,judithmaxwell,https://www.inaturalist.org/observations/22727909,42.09615319,-123.6840617,16,,Josephine,Oregon,United States,Arctostaphylos viscida,net,,,
22727923,4/19/19,2019-04-19 22:09:22 UTC,620505,judithmaxwell,https://www.inaturalist.org/observations/22727923,42.06654769,-123.6371992,24,,Josephine,Oregon,United States,Ranunculus occidentalis,net,,,
22730181,4/19/19,2019-04-19 23:01:55 UTC,620505,judithmaxwell,https://www.inaturalist.org/observations/22730181,42.06315258,-123.6346843,24,,Josephine,Oregon,United States,Fragaria,net,,,
22730305,4/19/19,2019-04-19 23:03:58 UTC,620505,judithmaxwell,https://www.inaturalist.org/observations/22730305,42.062623,-123.6352362,24,,Josephine,Oregon,United States,Ceanothus cuneatus,net,,,
22730425,4/19/19,2019-04-19 23:01:57 UTC,1447015,phylismcintosh,https://www.inaturalist.org/observations/22730425,42.06282409,-123.6349528,30,,Josephine,Oregon,United States,Ranunculus occidentalis,net,,,
22740780,4/17/19,2019-04-17 17:29:51 UTC,841568,lohump,https://www.inaturalist.org/observations/22740780,44.03286515,-123.0946639,8,,Lane,Oregon,United States,Osmanthus  burkwoodii,net,,,
22740941,4/18/19,2019-04-18 21:49:26 UTC,841568,lohump,https://www.inaturalist.org/observations/22740941,43.83443069,-122.7674789,,,Lane,Oregon,United States,,net,,,
22741029,4/18/19,2019-04-18 22:05:57 UTC,841568,lohump,https://www.inaturalist.org/observations/22741029,43.8329277,-122.7664871,,,Lane,Oregon,United States,,net,,,
22741138,4/18/19,2019-04-18 22:50:48 UTC,841568,lohump,https://www.inaturalist.org/observations/22741138,43.79202271,-122.7590637,,,Lane,Oregon,United States,Salix,net,,,
22776191,4/20/19,2019-04-20 20:37:26 UTC,1482843,jdillow,https://www.inaturalist.org/observations/22776191,45.1680994,-123.1858563,6,,Yamhill,Oregon,United States,Taraxacum officinale,net,,,
22776289,4/20/19,2019-04-20 20:39:34 UTC,1482843,jdillow,https://www.inaturalist.org/observations/22776289,45.1680206,-123.1859753,4,,Yamhill,Oregon,United States,Brassica rapa,net,,,
22785476,4/18/19,2019-04-18 21:51:27 UTC,1467407,richwittrup,https://www.inaturalist.org/observations/22785476,44.5859688,-123.2510224,4,,Benton,Oregon,United States,Viburnum,net,,,
22786548,4/20/19,2019-04-20 20:56:50 UTC,1425646,francis_opila,https://www.inaturalist.org/observations/22786548,45.643871,-122.813253,,,Multnomah,Oregon,United States,Salix,net,,,
22786589,4/20/19,2019-04-20 21:19:21 UTC,1425646,francis_opila,https://www.inaturalist.org/observations/22786589,45.64478683,-122.8136292,,,Multnomah,Oregon,United States,Prunus,net,,,
22786635,4/20/19,2019-04-20 22:05:03 UTC,1425646,francis_opila,https://www.inaturalist.org/observations/22786635,45.642043,-122.816987,,,Multnomah,Oregon,United States,Brassicaceae,net,,,
22786653,4/20/19,2019-04-20 22:18:48 UTC,1425646,francis_opila,https://www.inaturalist.org/observations/22786653,45.642088,-122.816873,,,Multnomah,Oregon,United States,Taraxacum officinale,net,,,
22794397,4/20/19,2019-04-20 20:41:46 UTC,792468,molfamily,https://www.inaturalist.org/observations/22794397,45.16826729,-123.1875265,16,,Yamhill,Oregon,United States,Brassica rapa,net,,,
22797447,4/20/19,2019-04-20 21:03:54 UTC,1504693,desireeportercostello,https://www.inaturalist.org/observations/22797447,45.64454483,-122.8133179,1399,,Multnomah,Oregon,United States,,net,,,
22797471,4/20/19,2019-04-20 21:14:22 UTC,1504693,desireeportercostello,https://www.inaturalist.org/observations/22797471,45.64454483,-122.8133179,5,,Multnomah,Oregon,United States,Ribes sanguineum,net,,,
22797488,4/20/19,2019-04-20 21:58:42 UTC,1504693,desireeportercostello,https://www.inaturalist.org/observations/22797488,45.64227922,-122.8168515,3,,Multnomah,Oregon,United States,Taraxacum officinale,net,,,
22838187,4/21/19,2019-04-21 20:27:54 UTC,1504693,desireeportercostello,https://www.inaturalist.org/observations/22838187,45.49153892,-122.6147557,11,Portland,Multnomah,Oregon,United States,,net,,,
22846658,4/21/19,2019-04-21 22:28:45 UTC,429964,amelathopoulos,https://www.inaturalist.org/observations/22846658,44.71476061,-122.7129073,4,,Linn,Oregon,United States,Berberis aquifolium,net,,,
22848362,4/21/19,2019-04-21 22:45:41 UTC,429964,amelathopoulos,https://www.inaturalist.org/observations/22848362,44.71439711,-122.7132358,6,,Linn,Oregon,United States,Amelanchier,net,,,
22848949,4/21/19,2019-04-21 23:03:21 UTC,752114,stephaniehazen,https://www.inaturalist.org/observations/22848949,44.88445295,-122.887802,5,,Marion,Oregon,United States,Muntingia calabura,net,,,
22849239,4/21/19,2019-04-21 23:09:13 UTC,752114,stephaniehazen,https://www.inaturalist.org/observations/22849239,44.88463404,-122.8878143,5,,Marion,Oregon,United States,Ranunculaceae,net,,,
22850753,4/21/19,2019-04-21 23:32:30 UTC,752114,stephaniehazen,https://www.inaturalist.org/observations/22850753,44.88462109,-122.8877519,50,,Marion,Oregon,United States,Prunus,net,,,
22852408,4/21/19,2019-04-22 00:00:49 UTC,1504693,desireeportercostello,https://www.inaturalist.org/observations/22852408,45.47542493,-122.5859373,10,Portland,Multnomah,Oregon,United States,,net,,,
22895925,4/22/19,2019-04-22 18:28:29 UTC,816767,jeaniet,https://www.inaturalist.org/observations/22895925,45.13409884,-123.3739955,5,,Yamhill,Oregon,United States,Ranunculus occidentalis,net,,,
22896642,4/22/19,2019-04-22 18:41:57 UTC,816767,jeaniet,https://www.inaturalist.org/observations/22896642,45.13435545,-123.3741182,10,,Yamhill,Oregon,United States,Bellis perennis,net,,,
22906120,4/22/19,2019-04-22 21:08:43 UTC,754260,ellenwatrous,https://www.inaturalist.org/observations/22906120,44.59874734,-123.3159711,15,,Benton,Oregon,United States,Lomatium dissectum,net,,,
22931187,4/22/19,2019-04-23 06:57:00 UTC,620505,judithmaxwell,https://www.inaturalist.org/observations/22931187,42.2335,-123.6607,,,Josephine,Oregon,United States,Camassia quamash,net,,,
22931291,4/22/19,2019-04-22 23:47:00 UTC,620505,judithmaxwell,https://www.inaturalist.org/observations/22931291,42.2335,-123.6607,64,,Josephine,Oregon,United States,Ranunculus occidentalis,net,,,
22931397,4/22/19,2019-04-22 23:41:00 UTC,620505,judithmaxwell,https://www.inaturalist.org/observations/22931397,42.2335,-123.6607,6,,Josephine,Oregon,United States,Arctostaphylos viscida,net,,,
22957933,4/23/19,2019-04-23 19:37:29 UTC,792775,dto,https://www.inaturalist.org/observations/22957933,45.17048321,-123.1854819,10,,Yamhill,Oregon,United States,Bellis perennis,net,,,
22957941,4/23/19,2019-04-23 19:38:38 UTC,792775,dto,https://www.inaturalist.org/observations/22957941,45.17050606,-123.1854769,10,,Yamhill,Oregon,United States,Taraxacum officinale,net,,,
22966161,4/23/19,2019-04-23 22:12:14 UTC,620505,judithmaxwell,https://www.inaturalist.org/observations/22966161,42.24070671,-123.6903725,16,,Josephine,Oregon,United States,Ranunculus occidentalis,net,,,
22983984,4/23/19,2019-04-24 05:10:00 UTC,620505,judithmaxwell,https://www.inaturalist.org/observations/22983984,42.2407,-123.6903,,,Josephine,Oregon,United States,Camassia quamash,net,,,
22997380,3/24/19,2019-03-24 22:45:57 UTC,1427302,sturges,https://www.inaturalist.org/observations/22997380,43.06661928,-124.139927,5,,Coos,Oregon,United States,,net,,,
23008769,4/24/19,2019-04-24 18:38:06 UTC,1119443,lindazahl,https://www.inaturalist.org/observations/23008769,45.86635129,-122.8223018,5,,Columbia,Oregon,United States,Camassia,net,,,
23009849,4/23/19,2019-04-23 23:26:01 UTC,620505,judithmaxwell,https://www.inaturalist.org/observations/23009849,42.23600282,-123.6989326,32,,Josephine,Oregon,United States,Lomatium,net,,,
23009896,4/24/19,2019-04-24 18:55:15 UTC,620505,judithmaxwell,https://www.inaturalist.org/observations/23009896,42.31378456,-122.9756152,32,,Jackson,Oregon,United States,Ranunculus occidentalis,net,,,
23011581,4/24/19,2019-04-24 19:10:30 UTC,1119443,lindazahl,https://www.inaturalist.org/observations/23011581,45.86880627,-122.8269812,5,,Columbia,Oregon,United States,Plectritis congesta,net,,,
23014174,4/24/19,2019-04-24 19:22:16 UTC,1119443,lindazahl,https://www.inaturalist.org/observations/23014174,45.86800433,-122.8307181,5,,Columbia,Oregon,United States,Taraxacum,net,,,
23014471,4/24/19,2019-04-24 20:01:57 UTC,754260,ellenwatrous,https://www.inaturalist.org/observations/23014471,44.65717895,-123.2353943,9,,Benton,Oregon,United States,Camassia leichtlinii,net,,,
23015028,4/24/19,2019-04-24 20:15:41 UTC,829567,tonistephan,https://www.inaturalist.org/observations/23015028,44.6371627,-121.1419785,9,,Jefferson,Oregon,United States,,net,,,
23017532,4/24/19,2019-04-24 20:35:15 UTC,1561159,jocelyn_mcauley,https://www.inaturalist.org/observations/23017532,45.5313886,-122.6089497,17,Portland,Multnomah,Oregon,United States,Acer circinatum,net,,,
23018321,4/24/19,2019-04-24 21:16:24 UTC,754260,ellenwatrous,https://www.inaturalist.org/observations/23018321,44.59126843,-123.3107446,7,,Benton,Oregon,United States,Marah oregana,net,,,
23020874,4/24/19,2019-04-24 22:03:02 UTC,754260,ellenwatrous,https://www.inaturalist.org/observations/23020874,44.58909947,-123.3112221,7,,Benton,Oregon,United States,Ranunculus occidentalis,net,,,
23033643,4/24/19,2019-04-25 00:57:45 UTC,927865,natalielozano,https://www.inaturalist.org/observations/23033643,45.49836174,-122.6017904,22,Portland,Multnomah,Oregon,United States,Malus,net,,,
23035898,4/24/19,2019-04-25 00:52:17 UTC,327525,brianalindh,https://www.inaturalist.org/observations/23035898,44.95426167,-123.0091695,65,,Marion,Oregon,United States,Camassia quamash,net,,,
23037876,4/24/19,2019-04-25 05:25:00 UTC,620505,judithmaxwell,https://www.inaturalist.org/observations/23037876,42.3137,-122.9756,,,Jackson,Oregon,United States,Calochortus tolmiei,net,,,
23038195,4/24/19,2019-04-25 05:38:00 UTC,620505,judithmaxwell,https://www.inaturalist.org/observations/23038195,42.3137,-122.9756,,,Jackson,Oregon,United States,Quercus garryana,net,,,
23061529,4/25/19,2019-04-25 17:43:58 UTC,752114,stephaniehazen,https://www.inaturalist.org/observations/23061529,44.95231912,-123.0134643,5,,Marion,Oregon,United States,Ceanothus,net,,,
23062066,4/25/19,2019-04-25 17:56:06 UTC,752114,stephaniehazen,https://www.inaturalist.org/observations/23062066,44.95231795,-123.0135061,5,,Marion,Oregon,United States,Ceanothus thyrsiflorus thyrsiflorus,net,,,
23062100,4/25/19,2019-04-25 17:57:14 UTC,752114,stephaniehazen,https://www.inaturalist.org/observations/23062100,44.95225769,-123.0134267,5,,Marion,Oregon,United States,Ceanothus thyrsiflorus thyrsiflorus,net,,,
23066325,4/25/19,2019-04-25 19:18:50 UTC,752114,stephaniehazen,https://www.inaturalist.org/observations/23066325,44.88402568,-122.88791,10,,Marion,Oregon,United States,Taraxacum officinale,net,,,
23066479,4/25/19,2019-04-25 19:21:30 UTC,752114,stephaniehazen,https://www.inaturalist.org/observations/23066479,44.88397849,-122.887993,5,,Marion,Oregon,United States,Taraxacum officinale,net,,,
23066670,4/25/19,2019-04-25 19:24:48 UTC,752114,stephaniehazen,https://www.inaturalist.org/observations/23066670,44.884023,-122.888055,10,,Marion,Oregon,United States,Taraxacum,net,,,
23066738,4/25/19,2019-04-25 19:26:18 UTC,752114,stephaniehazen,https://www.inaturalist.org/observations/23066738,44.88402673,-122.8879094,5,,Marion,Oregon,United States,Taraxacum officinale,net,,,
23066840,4/25/19,2019-04-25 19:28:49 UTC,752114,stephaniehazen,https://www.inaturalist.org/observations/23066840,44.88413787,-122.8880272,5,,Marion,Oregon,United States,Taraxacum officinale,net,,,
23066936,4/25/19,2019-04-25 19:30:34 UTC,752114,stephaniehazen,https://www.inaturalist.org/observations/23066936,44.88408247,-122.8879793,5,,Marion,Oregon,United States,Taraxacum officinale,net,,,
23068845,4/25/19,2019-04-25 19:59:28 UTC,754260,ellenwatrous,https://www.inaturalist.org/observations/23068845,44.59881392,-123.3153085,9,,Benton,Oregon,United States,Plectritis congesta,net,,,
23070769,4/25/19,2019-04-25 20:37:15 UTC,754260,ellenwatrous,https://www.inaturalist.org/observations/23070769,44.59882012,-123.3155564,7,,Benton,Oregon,United States,Cornus nuttallii,net,,,
23079714,4/25/19,2019-04-25 23:12:23 UTC,754260,ellenwatrous,https://www.inaturalist.org/observations/23079714,44.57293366,-123.3108893,8,,Benton,Oregon,United States,Camassia quamash,net,,,
23080727,4/25/19,2019-04-25 20:25:07 UTC,327525,brianalindh,https://www.inaturalist.org/observations/23080727,44.93766667,-123.0338667,30,,Marion,Oregon,United States,Hedera helix,net,,,
23080798,4/25/19,2019-04-25 20:31:57 UTC,327525,brianalindh,https://www.inaturalist.org/observations/23080798,44.93717,-123.0350888,120,,Marion,Oregon,United States,Prunus laurocerasus,net,,,
23081258,4/25/19,2019-04-25 21:06:35 UTC,327525,brianalindh,https://www.inaturalist.org/observations/23081258,44.9365,-123.0291888,10,,Marion,Oregon,United States,Ceanothus,net,,,
23086587,4/25/19,2019-04-26 01:18:31 UTC,792775,dto,https://www.inaturalist.org/observations/23086587,45.38093099,-122.7608605,10,,Washington,Oregon,United States,Laurales,net,,,
23089123,4/25/19,2019-04-25 21:32:45 UTC,327525,brianalindh,https://www.inaturalist.org/observations/23089123,44.93484167,-123.0285862,10,,Marion,Oregon,United States,Limnanthes douglasii,net,,,
23089258,4/25/19,2019-04-25 21:49:24 UTC,327525,brianalindh,https://www.inaturalist.org/observations/23089258,44.93525333,-123.0293583,10,,Marion,Oregon,United States,Camassia quamash,net,,,
23089469,4/25/19,2019-04-25 23:42:43 UTC,327525,brianalindh,https://www.inaturalist.org/observations/23089469,44.93496163,-123.0289447,23,,Marion,Oregon,United States,Acer circinatum,net,,,
23102174,4/25/19,2019-04-25 22:55:00 UTC,620505,judithmaxwell,https://www.inaturalist.org/observations/23102174,42.20445,-123.3019861,22226,,Josephine,Oregon,United States,Salix,net,,,
23102255,4/25/19,2019-04-26 00:27:00 UTC,620505,judithmaxwell,https://www.inaturalist.org/observations/23102255,42.1361,-123.3525,16,,Josephine,Oregon,United States,Arctostaphylos patula,net,,,
23102882,4/25/19,2019-04-26 01:25:00 UTC,620505,judithmaxwell,https://www.inaturalist.org/observations/23102882,42.1381,-123.3446,,,Josephine,Oregon,United States,,net,,,
23230203,4/26/19,2019-04-26 21:42:08 UTC,754260,ellenwatrous,https://www.inaturalist.org/observations/23230203,44.59912424,-123.3150438,9,,Benton,Oregon,United States,Limnanthes douglasii,net,,,
23240718,4/26/19,2019-04-26 22:35:57 UTC,754260,ellenwatrous,https://www.inaturalist.org/observations/23240718,44.59908105,-123.3153637,3,,Benton,Oregon,United States,Camassia leichtlinii,net,,,
23251239,4/26/19,2019-04-26 23:29:47 UTC,327525,brianalindh,https://www.inaturalist.org/observations/23251239,44.93539802,-123.0309335,65,,Marion,Oregon,United States,Malus,net,,,
23251459,4/26/19,2019-04-26 21:45:09 UTC,327525,brianalindh,https://www.inaturalist.org/observations/23251459,44.930845,-123.0323862,10,,Marion,Oregon,United States,Claytonia sibirica,net,,,
23251845,4/26/19,2019-04-26 22:18:38 UTC,327525,brianalindh,https://www.inaturalist.org/observations/23251845,44.930645,-123.0333555,81,,Marion,Oregon,United States,Prosartes hookeri,net,,,
23319046,4/26/19,2019-04-27 06:14:00 UTC,620505,judithmaxwell,https://www.inaturalist.org/observations/23319046,42.5294,-123.5881,,,Josephine,Oregon,United States,Madia elegans,net,,,
23320163,4/26/19,2019-04-27 06:37:00 UTC,620505,judithmaxwell,https://www.inaturalist.org/observations/23320163,42.5294,-123.5881,,,Josephine,Oregon,United States,Lupinus latifolius,net,,,
23320746,4/26/19,2019-04-26 22:26:00 UTC,620505,judithmaxwell,https://www.inaturalist.org/observations/23320746,42.4414,-123.6838,,,Josephine,Oregon,United States,,net,,,
23320869,4/26/19,2019-04-26 23:13:00 UTC,620505,judithmaxwell,https://www.inaturalist.org/observations/23320869,42.44310833,-123.6824722,24,,Josephine,Oregon,United States,Lomatium,net,,,
23321014,4/26/19,2019-04-27 02:31:00 UTC,620505,judithmaxwell,https://www.inaturalist.org/observations/23321014,42.50822778,-123.6228944,64,,Josephine,Oregon,United States,Mimulus,net,,,
23370280,4/25/19,2019-04-25 21:27:50 UTC,620505,judithmaxwell,https://www.inaturalist.org/observations/23370280,42.13611552,-123.3525615,16,,Josephine,Oregon,United States,Arctostaphylos patula,net,,,
23370339,4/25/19,2019-04-25 22:28:12 UTC,620505,judithmaxwell,https://www.inaturalist.org/observations/23370339,42.13807203,-123.3446533,16,,Josephine,Oregon,United States,,net,,,
23479676,4/27/19,2019-04-27 21:33:11 UTC,752114,stephaniehazen,https://www.inaturalist.org/observations/23479676,44.89427604,-122.8859026,5,,Marion,Oregon,United States,,net,,,
23479936,4/27/19,2019-04-27 21:34:40 UTC,752114,stephaniehazen,https://www.inaturalist.org/observations/23479936,44.89423643,-122.8858739,5,,Marion,Oregon,United States,Plectritis,net,,,
23484023,4/27/19,2019-04-27 21:51:03 UTC,752114,stephaniehazen,https://www.inaturalist.org/observations/23484023,44.89540462,-122.8857157,5,,Marion,Oregon,United States,Camassia,net,,,
23484940,4/27/19,2019-04-27 21:55:03 UTC,752114,stephaniehazen,https://www.inaturalist.org/observations/23484940,44.89552482,-122.8857203,5,,Marion,Oregon,United States,Camassia,net,,,
23485710,4/27/19,2019-04-27 21:59:11 UTC,752114,stephaniehazen,https://www.inaturalist.org/observations/23485710,44.89540357,-122.8855704,5,,Marion,Oregon,United States,Camassia quamash,net,,,
23486736,4/27/19,2019-04-27 22:02:49 UTC,752114,stephaniehazen,https://www.inaturalist.org/observations/23486736,44.89538035,-122.8854495,5,,Marion,Oregon,United States,Lomatium utriculatum,net,,,
23487275,4/27/19,2019-04-27 22:04:34 UTC,429964,amelathopoulos,https://www.inaturalist.org/observations/23487275,44.55952028,-123.2294226,16,,Linn,Oregon,United States,Ribes,net,,,
23487521,4/27/19,2019-04-27 22:06:14 UTC,752114,stephaniehazen,https://www.inaturalist.org/observations/23487521,44.8952252,-122.8853835,5,,Marion,Oregon,United States,Lomatium utriculatum,net,,,
23489826,4/27/19,2019-04-27 22:16:06 UTC,752114,stephaniehazen,https://www.inaturalist.org/observations/23489826,44.89512433,-122.8853987,5,,Marion,Oregon,United States,Lomatium utriculatum,net,,,
23490559,4/27/19,2019-04-27 22:19:02 UTC,752114,stephaniehazen,https://www.inaturalist.org/observations/23490559,44.89537294,-122.8855891,5,,Marion,Oregon,United States,Camassia,net,,,
23492548,4/27/19,2019-04-27 22:27:00 UTC,752114,stephaniehazen,https://www.inaturalist.org/observations/23492548,44.89700179,-122.8863913,5,,Marion,Oregon,United States,Ranunculus occidentalis,net,,,
23496391,4/27/19,2019-04-27 22:43:24 UTC,752114,stephaniehazen,https://www.inaturalist.org/observations/23496391,44.89680285,-122.8942473,5,,Marion,Oregon,United States,Plectritis congesta congesta,net,,,
23498155,4/27/19,2019-04-27 22:53:05 UTC,752114,stephaniehazen,https://www.inaturalist.org/observations/23498155,44.89737638,-122.8936478,5,,Marion,Oregon,United States,Camassia quamash,net,,,
23499667,4/27/19,2019-04-27 22:58:57 UTC,752114,stephaniehazen,https://www.inaturalist.org/observations/23499667,44.89753593,-122.8934906,5,,Marion,Oregon,United States,Camassia,net,,,
23530414,4/26/19,2019-04-27 00:24:07 UTC,175529,jerrypaul,https://www.inaturalist.org/observations/23530414,44.60285072,-123.2647835,5,,Benton,Oregon,United States,Berberis darwinii,net,,,
23531004,4/26/19,2019-04-26 23:18:16 UTC,175529,jerrypaul,https://www.inaturalist.org/observations/23531004,44.60303986,-123.2644983,5,,Benton,Oregon,United States,Ceanothus cuneatus,net,,,4/26/19 16:22
23531350,4/27/19,2019-04-27 21:15:20 UTC,327525,brianalindh,https://www.inaturalist.org/observations/23531350,44.92735,-123.0696722,10,,Marion,Oregon,United States,Marah oregana,net,,,
23531663,4/27/19,2019-04-27 21:45:41 UTC,327525,brianalindh,https://www.inaturalist.org/observations/23531663,44.92872167,-123.0676112,10,,Marion,Oregon,United States,Malus,net,,,
23532044,4/27/19,2019-04-27 22:08:20 UTC,327525,brianalindh,https://www.inaturalist.org/observations/23532044,44.92754667,-123.0715722,1533,,Marion,Oregon,United States,,net,,,
23660743,3/31/19,2019-03-31 22:10:00 UTC,1539907,pdxmartha,https://www.inaturalist.org/observations/23660743,45.41412006,-122.6349011,7,,Multnomah,Oregon,United States,,net,,,
23669398,3/31/19,2019-03-31 21:50:00 UTC,1539907,pdxmartha,https://www.inaturalist.org/observations/23669398,45.47313409,-122.6133159,7,Portland,Multnomah,Oregon,United States,Rosmarinus officinalis,net,,,
23672041,3/31/19,2019-03-31 21:45:00 UTC,1539907,pdxmartha,https://www.inaturalist.org/observations/23672041,45.47319174,-122.6132613,5,Portland,Multnomah,Oregon,United States,Lamium purpureum,net,,,
23673560,3/31/19,2019-03-31 22:00:00 UTC,1539907,pdxmartha,https://www.inaturalist.org/observations/23673560,45.47325272,-122.6129639,5,Portland,Multnomah,Oregon,United States,,net,,,
23675465,4/27/19,2019-04-27 22:45:00 UTC,1539907,pdxmartha,https://www.inaturalist.org/observations/23675465,45.4735173,-122.6122972,10,Portland,Multnomah,Oregon,United States,Ribes grossularia,net,,,
23703547,4/19/19,2019-04-19 21:18:07 UTC,1445574,janknapik,https://www.inaturalist.org/observations/23703547,42.06376907,-123.6346208,9,,Josephine,Oregon,United States,,net,,,
23712262,4/28/19,2019-04-28 19:27:59 UTC,1539907,pdxmartha,https://www.inaturalist.org/observations/23712262,45.473242,-122.6124255,21,Portland,Multnomah,Oregon,United States,,net,,,
23719105,4/28/19,2019-04-28 19:54:36 UTC,816767,jeaniet,https://www.inaturalist.org/observations/23719105,45.13392752,-123.3728176,10,,Yamhill,Oregon,United States,Rosmarinus officinalis,net,,,
23727087,4/28/19,2019-04-28 20:02:53 UTC,1582689,twoleglaura,https://www.inaturalist.org/observations/23727087,45.64152711,-122.8180418,5,,Multnomah,Oregon,United States,,net,,,
23741271,4/28/19,2019-04-28 19:53:08 UTC,325615,grottaa,https://www.inaturalist.org/observations/23741271,45.55684771,-122.6463527,20,Portland,Multnomah,Oregon,United States,Pyrus pyrifolia,net,,,
23741389,4/28/19,2019-04-28 20:38:59 UTC,325615,grottaa,https://www.inaturalist.org/observations/23741389,45.55673246,-122.6461925,10,Portland,Multnomah,Oregon,United States,,net,,,
23741521,4/28/19,2019-04-28 20:58:38 UTC,325615,grottaa,https://www.inaturalist.org/observations/23741521,45.55690752,-122.6466411,10,Portland,Multnomah,Oregon,United States,Camassia,net,,,
23755125,4/28/19,2019-04-28 22:06:23 UTC,754260,ellenwatrous,https://www.inaturalist.org/observations/23755125,44.60054382,-123.2425312,5,,Benton,Oregon,United States,Prunus virginiana,net,,,
23785725,4/28/19,2019-04-28 23:53:12 UTC,754260,ellenwatrous,https://www.inaturalist.org/observations/23785725,44.36371464,-123.3748333,6,,Benton,Oregon,United States,Camassia quamash,net,,,
23791910,4/28/19,2019-04-28 20:56:56 UTC,1425646,francis_opila,https://www.inaturalist.org/observations/23791910,45.557421,-122.690824,,Portland,Multnomah,Oregon,United States,Vaccinium,net,,,
23792249,4/28/19,2019-04-28 21:08:56 UTC,1425646,francis_opila,https://www.inaturalist.org/observations/23792249,45.557441,-122.69081,,Portland,Multnomah,Oregon,United States,Poaceae,net,,,
23792612,4/28/19,2019-04-28 22:47:04 UTC,1425646,francis_opila,https://www.inaturalist.org/observations/23792612,45.557381,-122.69086,,Portland,Multnomah,Oregon,United States,Acer circinatum,net,,,
23803562,4/28/19,2019-04-28 18:00:00 UTC,1462047,marksg,https://www.inaturalist.org/observations/23803562,45.51734315,-122.8500714,65,,Washington,Oregon,United States,Syringa vulgaris,net,,,
23819128,4/28/19,2019-04-28 22:44:06 UTC,175529,jerrypaul,https://www.inaturalist.org/observations/23819128,44.63172323,-123.1966304,5,,Benton,Oregon,United States,,net,,,
23819551,4/28/19,2019-04-28 19:52:00 UTC,327525,brianalindh,https://www.inaturalist.org/observations/23819551,44.9299,-122.9525217,5,,Marion,Oregon,United States,Bellis perennis,net,,,
23819895,4/28/19,2019-04-28 20:09:21 UTC,327525,brianalindh,https://www.inaturalist.org/observations/23819895,44.93105333,-122.9528667,5,,Marion,Oregon,United States,Claytonia sibirica,net,,,
23822047,4/28/19,2019-04-28 22:58:54 UTC,175529,jerrypaul,https://www.inaturalist.org/observations/23822047,44.63176497,-123.1965553,5,,Benton,Oregon,United States,Nemophila menziesii,net,,,
23823242,4/28/19,2019-04-28 23:55:23 UTC,175529,jerrypaul,https://www.inaturalist.org/observations/23823242,44.62520483,-123.2179032,5,,Benton,Oregon,United States,Holodiscus discolor,net,,,
23836646,4/28/19,2019-04-28 19:12:57 UTC,1447015,phylismcintosh,https://www.inaturalist.org/observations/23836646,42.06525451,-123.1689441,10,,Jackson,Oregon,United States,Berberis aquifolium,net,,,
23836690,4/28/19,2019-04-28 21:23:29 UTC,1447015,phylismcintosh,https://www.inaturalist.org/observations/23836690,42.07145691,-123.1793457,10,,Jackson,Oregon,United States,Lomatium,net,,,
23836763,4/28/19,2019-04-28 21:26:30 UTC,1447015,phylismcintosh,https://www.inaturalist.org/observations/23836763,42.07178238,-123.1799917,30,,Jackson,Oregon,United States,Berberis aquifolium,net,,,
23865529,4/28/19,2019-04-28 22:14:00 UTC,620505,judithmaxwell,https://www.inaturalist.org/observations/23865529,42.06532222,-123.1693139,6,,Jackson,Oregon,United States,,net,,,
23865731,4/28/19,2019-04-28 22:12:00 UTC,620505,judithmaxwell,https://www.inaturalist.org/observations/23865731,42.06557778,-123.1691278,128,,Jackson,Oregon,United States,Berberis aquifolium,net,,,
23866320,4/28/19,2019-04-29 00:23:00 UTC,620505,judithmaxwell,https://www.inaturalist.org/observations/23866320,42.07181111,-123.1796861,16,,Jackson,Oregon,United States,Lomatium,net,,,
23866811,4/28/19,2019-04-29 00:38:00 UTC,620505,judithmaxwell,https://www.inaturalist.org/observations/23866811,42.07149167,-123.1795056,16,,Jackson,Oregon,United States,,net,,,
23968162,4/25/19,2019-04-25 22:47:07 UTC,841568,lohump,https://www.inaturalist.org/observations/23968162,44.00196457,-123.1330719,,,Lane,Oregon,United States,Nemophila menziesii,net,,,
23974440,4/25/19,2019-04-26 00:02:18 UTC,841568,lohump,https://www.inaturalist.org/observations/23974440,44.00285721,-123.1329422,,,Lane,Oregon,United States,Salix,net,,,
23987873,4/29/19,2019-04-29 18:38:18 UTC,1119443,lindazahl,https://www.inaturalist.org/observations/23987873,45.86632086,-122.8224956,5,,Columbia,Oregon,United States,Camassia quamash,net,,,
23989469,4/29/19,2019-04-29 18:44:01 UTC,1119443,lindazahl,https://www.inaturalist.org/observations/23989469,45.86616442,-122.821742,5,,Columbia,Oregon,United States,Plectritis congesta brachystemon,net,,,4/30/19 16:46
24014917,4/29/19,2019-04-29 20:26:23 UTC,620505,judithmaxwell,https://www.inaturalist.org/observations/24014917,42.42146951,-122.9056172,16,,Jackson,Oregon,United States,Lasthenia californica,net,,,
24021680,4/29/19,2019-04-29 20:52:58 UTC,620505,judithmaxwell,https://www.inaturalist.org/observations/24021680,42.42147335,-122.9052963,16,,Jackson,Oregon,United States,Ceanothus cuneatus,net,,,
24059646,4/29/19,2019-04-29 23:11:48 UTC,620505,judithmaxwell,https://www.inaturalist.org/observations/24059646,42.48050709,-122.6730999,8,,Jackson,Oregon,United States,Castilleja,net,,,
24061339,4/29/19,2019-04-29 23:16:06 UTC,620505,judithmaxwell,https://www.inaturalist.org/observations/24061339,42.48062567,-122.673311,32,,Jackson,Oregon,United States,Ranunculus occidentalis,net,,,
24083683,4/26/19,2019-04-26 21:32:00 UTC,841568,lohump,https://www.inaturalist.org/observations/24083683,43.9899,-123.0353,20,,Lane,Oregon,United States,Camassia,net,,,
24085550,4/29/19,2019-04-29 23:11:33 UTC,620505,judithmaxwell,https://www.inaturalist.org/observations/24085550,42.48051732,-122.6731063,6,,Jackson,Oregon,United States,Calochortus tolmiei,net,,,
24086661,4/29/19,2019-04-30 00:47:17 UTC,754260,ellenwatrous,https://www.inaturalist.org/observations/24086661,44.59893295,-123.3156572,5,,Benton,Oregon,United States,,net,,,
24118355,4/26/19,2019-04-26 21:12:34 UTC,841568,lohump,https://www.inaturalist.org/observations/24118355,43.98871613,-123.0354538,,,Lane,Oregon,United States,Malus,net,,,
24122442,4/26/19,2019-04-26 22:16:06 UTC,841568,lohump,https://www.inaturalist.org/observations/24122442,43.98973465,-123.0335159,,,Lane,Oregon,United States,,net,,,
24122505,4/26/19,2019-04-26 22:34:37 UTC,841568,lohump,https://www.inaturalist.org/observations/24122505,43.99040985,-123.0331345,,,Lane,Oregon,United States,Trifolium subterraneum,net,,,
24125282,4/26/19,2019-04-26 22:54:56 UTC,841568,lohump,https://www.inaturalist.org/observations/24125282,43.98996353,-123.0324936,,,Lane,Oregon,United States,Prunus emarginata,net,,,
24136087,4/28/19,2019-04-28 21:40:08 UTC,841568,lohump,https://www.inaturalist.org/observations/24136087,44.02187729,-123.1579361,,,Lane,Oregon,United States,Plectritis congesta,net,,,
24136927,4/28/19,2019-04-28 21:54:30 UTC,841568,lohump,https://www.inaturalist.org/observations/24136927,44.02122879,-123.1584396,,,Lane,Oregon,United States,Lithophragma tenellum,net,,,
24137757,4/28/19,2019-04-28 22:32:40 UTC,841568,lohump,https://www.inaturalist.org/observations/24137757,44.02175522,-123.1594009,,,Lane,Oregon,United States,Fragaria vesca,net,,,
24141477,4/28/19,2019-04-28 23:04:24 UTC,841568,lohump,https://www.inaturalist.org/observations/24141477,44.02726364,-123.1592331,,,Lane,Oregon,United States,Arbutus menziesii,net,,,
24181550,4/28/19,2019-04-28 21:07:45 UTC,927865,natalielozano,https://www.inaturalist.org/observations/24181550,45.6421446,-122.8168236,24,,Multnomah,Oregon,United States,Brassicaceae,net,,,
24181729,4/28/19,2019-04-28 21:40:09 UTC,927865,natalielozano,https://www.inaturalist.org/observations/24181729,45.64345988,-122.8187992,24,,Multnomah,Oregon,United States,Brassicaceae,net,,,
24182226,4/28/19,2019-04-28 21:51:45 UTC,927865,natalielozano,https://www.inaturalist.org/observations/24182226,45.64141562,-122.817877,16,,Multnomah,Oregon,United States,Rubus,net,,,
24194531,4/30/19,2019-04-30 16:27:38 UTC,1560167,annelesenne,https://www.inaturalist.org/observations/24194531,45.56631517,-122.8604362,8,,Washington,Oregon,United States,Cornus florida,net,,,
24194756,4/30/19,2019-04-30 16:30:53 UTC,1560167,annelesenne,https://www.inaturalist.org/observations/24194756,45.56633312,-122.8612796,4,,Washington,Oregon,United States,Cistus,net,,,
24195382,4/30/19,2019-04-30 16:37:47 UTC,1560167,annelesenne,https://www.inaturalist.org/observations/24195382,45.56546554,-122.8635637,3,,Washington,Oregon,United States,Cytisus,net,,,
24199167,4/30/19,2019-04-30 17:15:06 UTC,841568,lohump,https://www.inaturalist.org/observations/24199167,43.68109131,-123.0766449,,,Lane,Oregon,United States,Dicentra formosa,net,,,
24199704,4/30/19,2019-04-30 17:21:09 UTC,841568,lohump,https://www.inaturalist.org/observations/24199704,,,,,,,,,net,,,
24202364,4/30/19,2019-04-30 17:33:43 UTC,841568,lohump,https://www.inaturalist.org/observations/24202364,,,,,,,,Claytonia sibirica,net,,,
24208428,4/30/19,2019-04-30 19:04:00 UTC,792775,dto,https://www.inaturalist.org/observations/24208428,45.1706196,-123.185626,68,,Yamhill,Oregon,United States,Bellis perennis,net,,,
24208449,4/30/19,2019-04-30 19:05:05 UTC,792775,dto,https://www.inaturalist.org/observations/24208449,45.1706196,-123.185626,34,,Yamhill,Oregon,United States,,net,,,
24230094,4/30/19,2019-04-30 23:02:15 UTC,752114,stephaniehazen,https://www.inaturalist.org/observations/24230094,44.88438921,-122.8875929,5,,Marion,Oregon,United States,Rosmarinus officinalis,net,,,
24232250,4/21/19,2019-04-22 00:28:08 UTC,1423344,jessica789,https://www.inaturalist.org/observations/24232250,45.88126002,-122.8927995,263,,Columbia,Oregon,United States,,net,,,
24232480,4/21/19,2019-04-22 01:09:09 UTC,1423344,jessica789,https://www.inaturalist.org/observations/24232480,45.88193893,-122.892189,,,Columbia,Oregon,United States,Taraxacum,net,,,
24234364,4/30/19,2019-04-30 19:49:32 UTC,1423344,jessica789,https://www.inaturalist.org/observations/24234364,45.83021498,-122.9631961,17,,Columbia,Oregon,United States,Rhododendron,net,,,
24234621,4/30/19,2019-04-30 20:33:45 UTC,1423344,jessica789,https://www.inaturalist.org/observations/24234621,45.83020821,-122.9616766,33,,Columbia,Oregon,United States,Taraxacum,net,,,
24234814,4/30/19,2019-04-30 20:47:05 UTC,1423344,jessica789,https://www.inaturalist.org/observations/24234814,45.82966232,-122.9615326,,,Columbia,Oregon,United States,,net,,,
24239961,4/30/19,2019-04-30 20:33:25 UTC,327525,brianalindh,https://www.inaturalist.org/observations/24239961,45.02230506,-123.1457883,25,,Polk,Oregon,United States,Bellis perennis,net,,,
24240100,4/30/19,2019-05-01 01:19:18 UTC,327525,brianalindh,https://www.inaturalist.org/observations/24240100,45.02248124,-123.1457881,22,,Polk,Oregon,United States,Crataegus,net,,,
24240347,4/30/19,2019-04-30 23:15:57 UTC,327525,brianalindh,https://www.inaturalist.org/observations/24240347,45.02236117,-123.1476055,10,,Polk,Oregon,United States,Arbutus menziesii,net,,,
24240384,4/30/19,2019-04-30 23:23:36 UTC,327525,brianalindh,https://www.inaturalist.org/observations/24240384,45.02157217,-123.1500083,5,,Polk,Oregon,United States,Geranium lucidum,net,,,
24254523,4/30/19,,620505,judithmaxwell,https://www.inaturalist.org/observations/24254523,42.0068,-123.5499,24,,Josephine,Oregon,United States,,net,,,
24254662,4/30/19,,620505,judithmaxwell,https://www.inaturalist.org/observations/24254662,42.0068,-123.5499,32,,Josephine,Oregon,United States,Arctostaphylos patula,net,,,
24256257,4/28/19,2019-04-28 21:09:33 UTC,1586075,rachelphariss,https://www.inaturalist.org/observations/24256257,45.64210596,-122.8167981,6,,Multnomah,Oregon,United States,Brassicaceae,net,,,
24256298,4/28/19,2019-04-28 21:41:39 UTC,1586075,rachelphariss,https://www.inaturalist.org/observations/24256298,45.64343159,-122.8187573,7,,Multnomah,Oregon,United States,Brassicaceae,net,,,
24256304,4/28/19,2019-04-28 22:00:32 UTC,1586075,rachelphariss,https://www.inaturalist.org/observations/24256304,45.64173625,-122.8198006,8,,Multnomah,Oregon,United States,Berberis aquifolium,net,,,
24256805,4/30/19,2019-04-30 19:28:53 UTC,175529,jerrypaul,https://www.inaturalist.org/observations/24256805,43.6873,-122.3735,10,,Lane,Oregon,United States,Berberis aquifolium,net,,,
24256887,4/30/19,2019-04-30 21:16:59 UTC,175529,jerrypaul,https://www.inaturalist.org/observations/24256887,43.6898,-122.374,,,Lane,Oregon,United States,Taraxacum officinale,net,,,
24260176,4/30/19,2019-04-30 18:48:29 UTC,1119443,lindazahl,https://www.inaturalist.org/observations/24260176,45.83025207,-122.9588494,359,,Columbia,Oregon,United States,Bellis perennis,pan trap,,4/30/19 11:51,4/30/19 14:19
24260278,4/30/19,2019-04-30 19:16:38 UTC,1119443,lindazahl,https://www.inaturalist.org/observations/24260278,45.82987622,-122.9615571,10,,Columbia,Oregon,United States,Taraxacum,net,,,
24260357,4/30/19,2019-04-30 20:47:04 UTC,1119443,lindazahl,https://www.inaturalist.org/observations/24260357,45.82977933,-122.9618788,5,,Columbia,Oregon,United States,,net,,,
24260496,4/30/19,2019-04-30 21:18:12 UTC,1119443,lindazahl,https://www.inaturalist.org/observations/24260496,45.82963763,-122.9612783,5,,Columbia,Oregon,United States,,pan trap,,4/30/19 12:11,4/30/19 14:18
24260524,4/30/19,2019-04-30 21:33:53 UTC,1119443,lindazahl,https://www.inaturalist.org/observations/24260524,45.82971496,-122.9612616,39689,,Columbia,Oregon,United States,Fragaria vesca,pan trap,,4/30/19 12:34,4/30/19 14:34
24260593,4/30/19,2019-05-01 00:09:41 UTC,1119443,lindazahl,https://www.inaturalist.org/observations/24260593,45.86631076,-122.8222886,10,,Columbia,Oregon,United States,Toxicoscordion venenosum,net,,,
24260648,4/30/19,2019-05-01 00:18:05 UTC,1119443,lindazahl,https://www.inaturalist.org/observations/24260648,45.86625553,-122.8224376,5,,Columbia,Oregon,United States,Camassia quamash,net,,,
24260672,4/30/19,2019-05-01 00:52:50 UTC,1119443,lindazahl,https://www.inaturalist.org/observations/24260672,45.86874474,-122.8270098,5,,Columbia,Oregon,United States,Plectritis,net,,,
24309697,5/1/19,2019-05-01 19:32:50 UTC,829567,tonistephan,https://www.inaturalist.org/observations/24309697,44.28726575,-120.8440377,7,,Crook,Oregon,United States,Salix,net,,,
24310260,5/1/19,2019-05-01 19:39:32 UTC,620505,judithmaxwell,https://www.inaturalist.org/observations/24310260,42.21992355,-123.0380925,22151,,Jackson,Oregon,United States,Calochortus tolmiei,net,,,
24316534,5/1/19,2019-05-01 20:52:25 UTC,754260,ellenwatrous,https://www.inaturalist.org/observations/24316534,44.65870159,-123.234778,7,,Benton,Oregon,United States,Insecta,net,,,
24319452,5/1/19,2019-05-01 21:37:31 UTC,754260,ellenwatrous,https://www.inaturalist.org/observations/24319452,44.657179,-123.235394,,,Benton,Oregon,United States,Claytonia sibirica,net,,,
24321686,5/1/19,2019-05-01 22:07:12 UTC,754260,ellenwatrous,https://www.inaturalist.org/observations/24321686,44.65668905,-123.2337361,8,,Benton,Oregon,United States,Camassia leichtlinii,net,,,
24323930,5/1/19,2019-05-01 22:40:02 UTC,1482843,jdillow,https://www.inaturalist.org/observations/24323930,45.27386963,-123.01103,4,,Yamhill,Oregon,United States,Allium schoenoprasum,net,,,
24325815,5/1/19,2019-05-01 23:05:06 UTC,1482843,jdillow,https://www.inaturalist.org/observations/24325815,45.27390037,-123.0110947,9,,Yamhill,Oregon,United States,Fragaria,net,,,
24326253,5/1/19,2019-05-01 23:10:43 UTC,752114,stephaniehazen,https://www.inaturalist.org/observations/24326253,44.88425648,-122.8877148,5,,Marion,Oregon,United States,Rosmarinus,net,,,
24326327,5/1/19,2019-05-01 23:11:27 UTC,752114,stephaniehazen,https://www.inaturalist.org/observations/24326327,44.88431008,-122.8877902,5,,Marion,Oregon,United States,Rosmarinus,net,,,
24328618,5/1/19,2019-05-01 23:33:13 UTC,754260,ellenwatrous,https://www.inaturalist.org/observations/24328618,44.63905883,-123.289592,12,,Benton,Oregon,United States,Claytonia sibirica,net,,,
24336108,5/1/19,2019-05-01 19:40:04 UTC,620505,judithmaxwell,https://www.inaturalist.org/observations/24336108,42.14928193,-123.0477415,24,,Jackson,Oregon,United States,Lomatium,net,,,
24337412,4/30/19,2019-04-30 23:25:07 UTC,327525,brianalindh,https://www.inaturalist.org/observations/24337412,45.0217695,-123.1499945,30,,Polk,Oregon,United States,Ranunculus uncinatus,net,,,
24338449,5/1/19,2019-05-01 22:42:19 UTC,327525,brianalindh,https://www.inaturalist.org/observations/24338449,44.96182,-123.25753,5005,,Polk,Oregon,United States,Crataegus monogyna,net,,,
24338489,5/1/19,2019-05-01 23:21:09 UTC,327525,brianalindh,https://www.inaturalist.org/observations/24338489,44.96167833,-123.2596133,5,,Polk,Oregon,United States,Valerianella locusta,net,,,
24338599,5/1/19,2019-05-01 23:40:02 UTC,327525,brianalindh,https://www.inaturalist.org/observations/24338599,44.96412,-123.260405,962,,Polk,Oregon,United States,Lomatium nudicaule,net,,,
24338656,5/1/19,2019-05-01 23:49:59 UTC,327525,brianalindh,https://www.inaturalist.org/observations/24338656,44.87524667,-123.2239,3870,,Polk,Oregon,United States,Camassia quamash,net,,,
24351062,5/1/19,2019-05-02 05:35:00 UTC,620505,judithmaxwell,https://www.inaturalist.org/observations/24351062,42.1492,-123.0477,,,Jackson,Oregon,United States,Dichelostemma,net,,,
24351364,5/1/19,2019-05-01 22:40:00 UTC,620505,judithmaxwell,https://www.inaturalist.org/observations/24351364,42.14939444,-123.0475778,65,,Jackson,Oregon,United States,Lomatium utriculatum,net,,,
24351953,5/1/19,2019-05-02 05:50:00 UTC,620505,judithmaxwell,https://www.inaturalist.org/observations/24351953,42.1492,-123.0477,,,Jackson,Oregon,United States,Senecio,net,,,
24368306,5/1/19,2019-05-01 19:21:21 UTC,1447015,phylismcintosh,https://www.inaturalist.org/observations/24368306,42.14963421,-123.0484814,22,,Jackson,Oregon,United States,Lomatium,net,,,
24368314,5/1/19,2019-05-01 19:23:25 UTC,1447015,phylismcintosh,https://www.inaturalist.org/observations/24368314,42.14963597,-123.0485137,5,,Jackson,Oregon,United States,Calochortus,net,,,
24390581,5/2/19,2019-05-02 19:15:38 UTC,829567,tonistephan,https://www.inaturalist.org/observations/24390581,44.23104258,-120.9943937,9,,Crook,Oregon,United States,Magnoliopsida,net,,,
24392246,5/2/19,2019-05-02 19:39:50 UTC,754260,ellenwatrous,https://www.inaturalist.org/observations/24392246,45.67842314,-121.3063904,6,,Wasco,Oregon,United States,Lomatium nudicaule,net,,,
24401546,5/2/19,2019-05-02 22:05:56 UTC,1462047,marksg,https://www.inaturalist.org/observations/24401546,45.44834339,-122.8695413,5,,Washington,Oregon,United States,Geranium lucidum,net,,,
24401861,5/2/19,2019-05-02 22:26:36 UTC,1462047,marksg,https://www.inaturalist.org/observations/24401861,45.4480662,-122.8693862,5,,Washington,Oregon,United States,,net,,,
24402306,5/2/19,2019-05-02 22:40:07 UTC,1462047,marksg,https://www.inaturalist.org/observations/24402306,45.44795205,-122.8698366,5005,,Washington,Oregon,United States,Iris tenax,net,,,
24403485,2/9/19,2019-02-09 12:49:57 UTC,1450900,karenrichards,https://www.inaturalist.org/observations/24403485,44.594313,-123.2346685,65,,Benton,Oregon,United States,Bombus caliginosus,net,,,
24404055,5/2/19,2019-05-02 23:13:30 UTC,752114,stephaniehazen,https://www.inaturalist.org/observations/24404055,44.89492761,-122.8864511,5,,Marion,Oregon,United States,Plectritis congesta,net,,,
24404351,5/2/19,2019-05-02 23:18:19 UTC,752114,stephaniehazen,https://www.inaturalist.org/observations/24404351,44.89484156,-122.8862491,5,,Marion,Oregon,United States,Plectritis congesta,net,,,
24404602,5/2/19,2019-05-02 23:21:27 UTC,1462047,marksg,https://www.inaturalist.org/observations/24404602,45.44853383,-122.8687171,30,,Washington,Oregon,United States,Marah oregana,net,,,
24404919,5/2/19,2019-05-02 23:25:49 UTC,752114,stephaniehazen,https://www.inaturalist.org/observations/24404919,44.89514847,-122.8855991,10,,Marion,Oregon,United States,Lomatium utriculatum,net,,,
24405055,5/2/19,2019-05-02 23:28:27 UTC,752114,stephaniehazen,https://www.inaturalist.org/observations/24405055,44.89521754,-122.8853943,5,,Marion,Oregon,United States,Lomatium utriculatum,net,,,
24405192,5/2/19,2019-05-02 23:31:40 UTC,752114,stephaniehazen,https://www.inaturalist.org/observations/24405192,44.89520547,-122.8853484,5,,Marion,Oregon,United States,Lomatium utriculatum,net,,,
24405555,5/2/19,2019-05-02 23:36:24 UTC,752114,stephaniehazen,https://www.inaturalist.org/observations/24405555,44.89527981,-122.8856831,5,,Marion,Oregon,United States,Camassia leichtlinii,net,,,
24405735,5/2/19,2019-05-02 23:38:55 UTC,752114,stephaniehazen,https://www.inaturalist.org/observations/24405735,44.89541828,-122.8856508,5,,Marion,Oregon,United States,Camassia leichtlinii,net,,,
24406167,5/2/19,2019-05-02 23:46:25 UTC,752114,stephaniehazen,https://www.inaturalist.org/observations/24406167,44.89533425,-122.8857291,5,,Marion,Oregon,United States,Camassia quamash,net,,,
24407072,5/2/19,2019-05-03 00:03:05 UTC,752114,stephaniehazen,https://www.inaturalist.org/observations/24407072,44.89512848,-122.8874704,5,,Marion,Oregon,United States,Iris tenax,net,,,
24407223,5/2/19,2019-05-03 00:05:10 UTC,1462047,marksg,https://www.inaturalist.org/observations/24407223,45.45121218,-122.8698396,10,,Washington,Oregon,United States,Vicia sativa,net,,,
24413532,5/2/19,2019-05-02 20:17:54 UTC,327525,brianalindh,https://www.inaturalist.org/observations/24413532,44.93547,-123.0306917,65,,Marion,Oregon,United States,Prunus laurocerasus,net,,,
