id,observed_on,time_observed_at,user_id,image_url,place_guess,latitude,longitude,positional_accuracy,place_town_name,place_county_name,place_state_name,place_admin1_name,place_admin2_name,scientific_name,field:flower bee is visiting,field:location name,field:number of bees collected,field:oba collection method,field:oba collector id,field:sample id,field:trap installed,field:trap removed
13456829,6/15/2018,2018-06-15 17:33:16 UTC,800960,https://static.inaturalist.org/photos/19753841/medium.jpg?1529088477,"8633 Mosier the Dalles Hwy, Mosier, OR, US",45.68747833,-121.3857717,5,,Wasco,Oregon,Oregon,Wasco,Cyanus segetum,,,3,net,A,26,,
10299013,3/18/2018,2018-03-18 22:40:40 UTC,429964,https://static.inaturalist.org/photos/14319340/medium.jpeg?1521575867,"3070 SW Morris Ave, Corvallis, OR 97333, USA",44.55552457,-123.2854209,7,,Benton,Oregon,Oregon,Benton,,,bumble bee flew into my house,1,net,apm,1,,
10330143,3/20/2018,2018-03-20 19:57:48 UTC,429964,https://static.inaturalist.org/photos/14319667/medium.jpeg?1521576706,"2824 NW Orchard Ave, Corvallis, OR 97330, USA",44.56745898,-123.2832032,8,,Benton,Oregon,Oregon,Benton,Osmanthus × burkwoodii,,OSU pollinator garden,3,net,apm,2,,
10330837,3/20/2018,2018-03-20 20:42:53 UTC,429964,https://static.inaturalist.org/photos/14320640/medium.jpeg?1521579462,"NE Smith Ln, Corvallis, OR 97333, USA",44.56543029,-123.2409816,5,,Linn,Oregon,Oregon,Linn,Salix,,OSU organic club farm,5,net,apm,3,,
10507984,3/29/2018,2018-03-29 20:38:49 UTC,429964,https://static.inaturalist.org/photos/14618284/medium.jpeg?1522424362,"17701 Gopher Valley Rd, Sheridan, OR 97378, USA",45.13396833,-123.372543,16,,Yamhill,Oregon,Oregon,Yamhill,Arctostaphylos densiflora,,,1,net,apm,4,,
10529001,3/31/2018,2018-03-31 17:49:33 UTC,429964,https://static.inaturalist.org/photos/14656613/medium.jpeg?1522518658,"Coos County, US-OR, US",43.39458552,-124.2532426,15,,Coos,Oregon,Oregon,Coos,Glandora diffusa,,,1,net,apm,5,,
10534831,3/31/2018,2018-03-31 22:12:02 UTC,429964,https://static.inaturalist.org/photos/14666666/medium.jpeg?1522536312,"2075 Overleaf Loop, Yachats, OR 97498, USA",44.32433021,-124.1038733,6,,Lincoln,Oregon,Oregon,Lincoln,Ceanothus gloriosus,,,6,net,apm,6,,
10556591,3/31/2018,2018-03-31 22:53:38 UTC,429964,https://static.inaturalist.org/photos/14704276/medium.jpeg?1522623152,"804 Trail, Yachats, OR 97498, USA",44.32584701,-124.1035201,7,,Lincoln,Oregon,Oregon,Lincoln,Salix,,,3,net,apm,7,,
11141260,4/18/2018,2018-04-18 21:16:18 UTC,429964,https://static.inaturalist.org/photos/15761810/medium.jpeg?1524094893,"2824 NW Orchard Ave, Corvallis, OR 97330, USA",44.56757934,-123.2830002,6,,Benton,Oregon,Oregon,Benton,Ceanothus,,OSU,7,net,apm,8,,
11286903,4/21/2018,2018-04-21 21:42:24 UTC,429964,https://static.inaturalist.org/photos/16052556/medium.jpeg?1524347025,"2824 NW Orchard Ave, Corvallis, OR 97330, USA",44.56755587,-123.2829928,11,,Benton,Oregon,Oregon,Benton,Ceanothus,,osu,5,net,apm,9,,
11293629,4/21/2018,2018-04-22 00:11:42 UTC,429964,https://static.inaturalist.org/photos/16066126/medium.jpeg?1524356397,"2708 NW Johnson Ave, Corvallis, OR 97330, USA",44.56846237,-123.2815094,,,Benton,Oregon,Oregon,Benton,Andrena miserabilis,,,12,net,apm,10,,
12167479,5/5/2018,2018-05-05 18:33:00 UTC,429964,https://static.inaturalist.org/photos/17487591/medium.jpeg?1525565933,"753-853 SW 35th St, Corvallis, OR 97333, USA",44.5598512,-123.2882593,57,,Benton,Oregon,Oregon,Benton,Berberidaceae,,oak creek,3,net,apm,11,,
12179292,5/5/2018,2018-05-05 18:43:05 UTC,429964,https://static.inaturalist.org/photos/17487648/medium.jpeg?1525566027,"Benton County, US-OR, US",44.56012202,-123.2888956,7,,Benton,Oregon,Oregon,Benton,Ceanothus cuneatus,,oak creek,3,net,apm,12,,
12179371,5/5/2018,2018-05-05 18:50:43 UTC,429964,https://static.inaturalist.org/photos/17487701/medium.jpeg?1525566127,"671-733 SW 35th St, Corvallis, OR 97331, USA",44.56055649,-123.2888625,5,,Benton,Oregon,Oregon,Benton,Prunus,,,3,net,apm,13,,
12179389,5/5/2018,2018-05-05 19:45:20 UTC,429964,https://static.inaturalist.org/photos/17487716/medium.jpeg?1525566156,"1150 SW Philomath Blvd, Corvallis, OR 97333, USA",44.55474977,-123.2700239,12,,Benton,Oregon,Oregon,Benton,Camassia quamash quamash,,pioneer park,7,net,apm,14,,
12538356,5/16/2018,2018-05-16 23:41:13 UTC,429964,https://static.inaturalist.org/photos/18110014/medium.jpeg?1526542845,"Vietnam Veterans Memorial Highway, The Dalles, OR 97058, USA",45.6732348,-121.2645058,2900,,Wasco,Oregon,Oregon,Wasco,Ceanothus,,,1,net,apm,15,,
12538376,5/16/2018,2018-05-16 23:59:05 UTC,429964,https://static.inaturalist.org/photos/18110053/medium.jpeg?1526542910,"5343-5573 Historic Columbia River Hwy, The Dalles, OR 97058, USA",45.66837605,-121.2456915,9,,Wasco,Oregon,Oregon,Wasco,Vicia,,,6,net,apm,16,,
12563019,5/17/2018,2018-05-17 23:53:43 UTC,429964,https://static.inaturalist.org/photos/18151035/medium.jpeg?1526605917,"7725 Mosier-The Dalles Hwy, The Dalles, OR 97058, USA",45.6874803,-121.338421,8,,Wasco,Oregon,Oregon,Wasco,,,,0,pan trap,apm,17,2018-05-17T16:54:00-07:00,2018-05-20T18:38:00-07:00
12563022,5/17/2018,2018-05-18 00:11:51 UTC,429964,https://static.inaturalist.org/photos/18151040/medium.jpeg?1526605934,"7725 Mosier-The Dalles Hwy, The Dalles, OR 97058, USA",45.68750882,-121.3384288,4,,Wasco,Oregon,Oregon,Wasco,Vicia,,,7,net,apm,18,,
12563026,5/17/2018,2018-05-18 00:47:51 UTC,429964,https://static.inaturalist.org/photos/18151048/medium.jpeg?1526605956,"6364-6638 Historic Columbia River Hwy, Mosier, OR 97040, USA",45.68124182,-121.2999989,5,,Wasco,Oregon,Oregon,Wasco,,,,0,pan trap,apm,19,2018-05-17T17:48:00-07:00,2018-05-20T18:50:00-07:00
12563031,5/17/2018,2018-05-18 01:05:01 UTC,429964,https://static.inaturalist.org/photos/18151057/medium.jpeg?1526605973,"5343-5573 Historic Columbia River Hwy, The Dalles, OR 97058, USA",45.66812988,-121.2434618,6,,Wasco,Oregon,Oregon,Wasco,,,,0,pan trap,apm,20,2018-05-17T18:05:00-07:00,2018-05-20T19:08:00-07:00
12563037,5/17/2018,2018-05-18 01:10:28 UTC,429964,https://static.inaturalist.org/photos/18151063/medium.jpeg?1526605988,"5343-5573 Historic Columbia River Hwy, The Dalles, OR 97058, USA",45.66801779,-121.2435692,4,,Wasco,Oregon,Oregon,Wasco,,,,0,vane trap,apm,21,2018-05-17T18:11:00-07:00,2018-05-20T19:11:00-07:00
12662359,5/20/2018,2018-05-21 01:10:27 UTC,429964,https://static.inaturalist.org/photos/18322833/medium.jpeg?1526865203,"Mosier Plateau Trail, Mosier, OR 97040, USA",45.68700865,-121.3852011,4,,Wasco,Oregon,Oregon,Wasco,,,,0,pan trap,apm,22,2018-05-17T14:30:00-07:00,2018-05-20T18:12:00-07:00
13670613,6/22/2018,2018-06-22 14:07:25 UTC,429964,https://static.inaturalist.org/photos/20131518/medium.jpeg?1529681868,"Lane County, US-OR, US",43.69682915,-122.2659848,8,,Lane,Oregon,Oregon,Lane,,,,0,pan trap,apm,22vi-1,2018-06-22T07:09:00-07:00,
13670640,6/22/2018,2018-06-22 14:38:45 UTC,429964,https://static.inaturalist.org/photos/20131587/medium.jpeg?1529681941,"Lane County, US-OR, US",43.61924326,-122.1086463,12,,Lane,Oregon,Oregon,Lane,,,,0,pan trap,apm,22vi2,2018-06-22T07:40:00-07:00,2018-06-22T19:18:00-07:00
13670692,6/22/2018,2018-06-22 15:03:26 UTC,429964,https://static.inaturalist.org/photos/20131652/medium.jpeg?1529682027,"Crescent, OR 97733, USA",43.5502238,-121.9507267,5,,Klamath,Oregon,Oregon,Klamath,,,,0,pan trap,apm,22vi3,2018-06-22T08:04:00-07:00,2018-06-22T18:58:00-07:00
13670700,6/22/2018,2018-06-22 15:17:48 UTC,429964,https://static.inaturalist.org/photos/20131673/medium.jpeg?1529682063,"Klamath County, US-OR, US",43.47261325,-121.8927594,8,,Klamath,Oregon,Oregon,Klamath,,,,0,pan trap,apm,22vi4,2018-06-22T08:18:00-07:00,2018-06-22T18:39:00-07:00
13670726,,,429964,https://static.inaturalist.org/photos/20131715/medium.jpeg?1529682104,"OR-58, Crescent, OR 97733, USA",43.34929387,-121.774207,9,,Klamath,Oregon,Oregon,Klamath,,,,0,pan trap,apm,22vi5,2018-06-22T08:41:00-07:00,2018-06-22T18:21:00-07:00
13679921,6/22/2018,2018-06-22 15:46:22 UTC,429964,https://static.inaturalist.org/photos/20147616/medium.jpeg?1529701236,"Klamath County, US-OR, US",43.33986565,-121.7652458,7,,Klamath,Oregon,Oregon,Klamath,Angiospermae,,,0,pan trap,apm,22vi6,2018-06-22T08:47:00-07:00,
13685289,6/22/2018,2018-06-22 23:55:49 UTC,429964,https://static.inaturalist.org/photos/20156687/medium.jpeg?1529711899,"28900 The Dalles-California Hwy, Chiloquin, OR 97624, USA",42.48851537,-121.8768645,6,,Klamath,Oregon,Oregon,Klamath,Eschscholzia californica,,,7,net,apm,22vi7,,
13722414,6/22/2018,2018-06-23 03:01:32 UTC,429964,https://static.inaturalist.org/photos/20218165/medium.jpeg?1529804307,"Lane County, US-OR, US",43.69662224,-122.2661554,9,,Lane,Oregon,Oregon,Lane,,,,5,net,apm,22vi8,,
13722509,,,429964,https://static.inaturalist.org/photos/20273413/medium.jpeg?1529882605,"Sisters, OR 97759, USA",44.43262137,-121.9591404,7,,Linn,Oregon,Oregon,Linn,,,,0,pan trap,apm,23vi1,2018-06-23T18:36:00-07:00,2018-06-24T17:30:00-07:00
13753464,6/23/2018,2018-06-24 01:48:21 UTC,429964,https://static.inaturalist.org/photos/20273452/medium.jpeg?1529882647,"NF-830, Sisters, OR 97759, USA",44.42427151,-121.918275,3,,Linn,Oregon,Oregon,Linn,,,,0,pan trap,apm,23vi2,2018-06-23T18:48:00-07:00,
13753484,6/23/2018,2018-06-24 02:19:34 UTC,429964,https://static.inaturalist.org/photos/20273508/medium.jpeg?1529882700,"US-20, Sisters, OR 97759, USA",44.36373972,-121.6168436,6,,Deschutes,Oregon,Oregon,Deschutes,,,,0,pan trap,apm,23vi3,2018-06-23T19:20:00-07:00,2018-06-24T16:27:00-07:00
12527145,5/16/2018,2018-05-16 22:37:42 UTC,429964,https://static.inaturalist.org/photos/18089738/medium.jpeg?1526510321,"Riverfront Trail, The Dalles, OR 97058, USA",45.63040276,-121.1981075,5,,Wasco,Oregon,Oregon,Wasco,,,,0,nest block,apm,block 130,,
11909430,4/30/2018,2018-04-30 19:33:08 UTC,429964,https://static.inaturalist.org/photos/17049875/medium.jpeg?1525116839,"SW Campus Way, Corvallis, OR 97330, USA",44.56599744,-123.311298,11,,Benton,Oregon,Oregon,Benton,,,,0,nest block,apm,block144,,
12563012,5/17/2018,2018-05-17 23:10:43 UTC,429964,https://static.inaturalist.org/photos/18151017/medium.jpeg?1526605884,"Mosier Plateau Trail, Mosier, OR 97040, USA",45.68691135,-121.3849104,6,,Wasco,Oregon,Oregon,Wasco,,,,0,nest block,apm,block175,,
12563016,5/17/2018,2018-05-17 23:19:37 UTC,429964,https://static.inaturalist.org/photos/18151026/medium.jpeg?1526605899,"Mosier Plateau Trail, Mosier, OR 97040, USA",45.68734181,-121.3863452,4,,Wasco,Oregon,Oregon,Wasco,,,,0,nest block,apm,block180,,
15769495,8/2/2018,2018-08-02 21:01:56 UTC,429964,https://static.inaturalist.org/photos/23559149/medium.jpeg?1534896002,"Clatsop County, US-OR, US",46.10223554,-123.5061473,3,,Clatsop,Oregon,Oregon,Clatsop,Cirsium vulgare,,,7,net,apm,viii-2,,
15055138,8/2/2018,2018-08-02 20:10:03 UTC,429964,https://static.inaturalist.org/photos/22475711/medium.jpeg?1533243846,"92630 Maggie Johnson Rd, Astoria, OR 97103, USA",46.1657413,-123.5982442,2799,,Clatsop,Oregon,Oregon,Clatsop,Digitalis purpurea,,,0,net,apm,viii-2-1,,
11341608,4/22/2018,2018-04-22 22:29:24 UTC,429964,https://static.inaturalist.org/photos/16154110/medium.jpeg?1524438920,"Marquam Trail, Portland, OR 97221, USA",45.51034033,-122.7193477,4,Portland,Multnomah,Oregon,Oregon,Multnomah,,,,8,net,bls,tba,,
14526838,7/19/2018,2018-07-19 22:27:50 UTC,792859,https://static.inaturalist.org/photos/21632109/medium.jpg?1532039489,"17570 Wolf Dr, Sandy, OR, US",45.39636667,-122.2553717,5,,Clackamas,Oregon,Oregon,Clackamas,Cosmos bipinnatus,,,1,net,C Vanden Heuvel,1,,
12525100,5/16/2018,2018-05-16 21:14:48 UTC,792859,https://static.inaturalist.org/photos/18086109/medium.jpg?1526505482,"3831 Klindt Dr, The Dalles, OR, US",45.63023833,-121.1980533,5,,Wasco,Oregon,Oregon,Wasco,Bombus nevadensis,,,1,net,CV,1,,
12802322,5/22/2018,2018-05-22 20:27:52 UTC,12665,https://static.inaturalist.org/photos/18562952/medium.jpg?1527266825,"14000–14198 Stampher Rd, Lake Oswego, OR, US",45.42246996,-122.6585346,10,,Clackamas,Oregon,Oregon,Clackamas,Physocarpus capitatus,,Trying creek confluence,,net,Doc,1,,
12468673,4/18/2018,2018-04-18 21:05:00 UTC,384451,https://static.inaturalist.org/photos/17996208/medium.jpg?1526355181,"Columbia County, Oregon, Fairgrounds",45.848936,-122.86942,30,,Columbia,Oregon,Oregon,Columbia,Taraxacum officinale,,"Oregon, St. Helens, Fairgrounds, Demogarden",2,net,DRB,1,,
12471655,4/18/2018,2018-04-19 01:42:00 UTC,384451,https://static.inaturalist.org/photos/17996434/medium.jpg?1526355688,"Oregon, Scappoose, Brimacombe",45.78537,-122.886832,13,,Columbia,Oregon,Oregon,Columbia,,,"Oregon, Scappoose, Brimacombe",1,net,DRB,2,,
12471914,4/20/2018,2018-04-20 21:20:00 UTC,384451,https://static.inaturalist.org/photos/17996864/medium.jpg?1526356311,"Oregon, Aurora, NWREC",45.281278,-122.749645,7,,Clackamas,Oregon,Oregon,Clackamas,Taraxacum officinale,,"Oregon, Aurora, NWREC",1,net,DRB,3,,
12472000,4/21/2018,,384451,https://static.inaturalist.org/photos/17997050/medium.jpg?1526356661,"Oregon, Multnomah Village, Maplewood School",45.471311,-122.729909,10,Portland,Multnomah,Oregon,Oregon,Multnomah,,,"Oregon, Multnomah Village, Maplewood School",1,net,DRB,4,,
12472128,4/21/2018,2018-04-22 00:15:00 UTC,384451,https://static.inaturalist.org/photos/17997279/medium.jpg?1526357052,"Oregon, Scappoose, Brimacombe",45.78537,-122.886833,14,,Columbia,Oregon,Oregon,Columbia,Taraxacum,,"Oregon, Scappoose, Brimacombe",1,net,DRB,5,,
12472267,4/22/2018,2018-04-23 01:00:00 UTC,384451,,"Oregon, Scappoose, Brimacombe",45.785099,-122.887533,12,,Columbia,Oregon,Oregon,Columbia,,,"Oregon, Scappoose, Brimacombe",1,net,DRB,6,,
12472629,4/24/2018,,384451,https://static.inaturalist.org/photos/17998086/medium.jpg?1526358215,"Oregon, Scappoose, Brimacombe",45.785043,-122.885765,21,,Columbia,Oregon,Oregon,Columbia,Nomada,,"Oregon, Scappoose, Brimacombe",2,net,DRB,7,,
12504728,5/2/2018,2018-05-03 00:00:00 UTC,384451,https://static.inaturalist.org/photos/18051878/medium.jpg?1526440313,"Oregon, St. Helens, OSU Extension",45.864857,-122.818399,39,,Columbia,Oregon,Oregon,Columbia,Camassia,,"Oregon, St. Helens, OSU Extension",3,net,DRB,8,,
12505562,5/2/2018,2018-05-03 00:00:00 UTC,384451,https://static.inaturalist.org/photos/18053316/medium.jpg?1526442512,"Oregon, St. Helens, OSU Extension",45.864857,-122.818399,39,,Columbia,Oregon,Oregon,Columbia,Plectritis congesta,,"Oregon, St. Helens, OSU Extension",4,net,DRB,9,,
12505696,5/2/2018,2018-05-03 00:00:00 UTC,384451,https://static.inaturalist.org/photos/18053617/medium.jpg?1526443099,"Oregon, St. Helens, OSU Extension",45.864857,-122.818399,39,,Columbia,Oregon,Oregon,Columbia,,,"Oregon, St. Helens, OSU Extension",6,net,DRB,10,,
12505795,5/2/2018,2018-05-03 00:00:00 UTC,384451,https://static.inaturalist.org/photos/18053795/medium.jpg?1526443485,"Oregon, St. Helens, OSU Extension",45.864857,-122.818399,39,,Columbia,Oregon,Oregon,Columbia,Erythranthe guttata,,"Oregon, St. Helens, OSU Extension",2,net,DRB,11,,
12506047,5/10/2018,2018-05-10 22:15:00 UTC,384451,https://static.inaturalist.org/photos/18054217/medium.jpg?1526444623,"Oregon, St. Helens, OSU Extension",45.864857,-122.818399,39,,Columbia,Oregon,Oregon,Columbia,Plagiobothrys,,"Oregon, St. Helens, OSU Extension",1,net,DRB,12,,
12729757,5/14/2018,2018-05-14 22:38:00 UTC,384451,,"Oregon, Scappoose, Community Center Garden",45.74953,-122.880649,4,,Columbia,Oregon,Oregon,Columbia,,,"Oregon, Scappoose, Community center Garden",3,net,DRB,13,,
12729845,5/14/2018,2018-05-14 22:38:00 UTC,384451,https://static.inaturalist.org/photos/18437716/medium.jpg?1527044762,"Oregon, Scappoose, Community Center Garden",45.749503,-122.880446,4,,Columbia,Oregon,Oregon,Columbia,Eschscholzia californica,,"Oregon, Scappoose, Community center Garden",2,net,DRB,14,,
12729945,5/14/2018,2018-05-14 23:00:00 UTC,384451,,"Oregon, Scappoose, Community Center Garden",45.749458,-122.880453,3,,Columbia,Oregon,Oregon,Columbia,,,"Oregon, Scappoose, Community center Garden",1,net,DRB,15,,
12730179,5/17/2018,2018-05-17 22:00:00 UTC,384451,https://static.inaturalist.org/photos/18438267/medium.jpg?1527045735,"Columbia County, US-OR, US",45.864646,-122.818721,10,,Columbia,Oregon,Oregon,Columbia,Plectritis congesta congesta,,"Oregon, St. Helens, OSU Extension",1,net,DRB,16,,
12911733,5/23/2018,2018-05-23 19:00:00 UTC,384451,https://static.inaturalist.org/photos/18754717/medium.jpeg?1527555094,"Oregon, Scappoose, Community Center Garden",45.749528,-122.880446,10,,Columbia,Oregon,Oregon,Columbia,Eschscholzia californica,,"Oregon, Scappoose, Community center Garden",7,net,DRB,17,,
12911299,5/23/2018,2018-05-23 19:15:00 UTC,384451,https://static.inaturalist.org/photos/18753640/medium.jpeg?1527554121,"Oregon, Scappoose, Community Center Garden",45.749313,-122.880638,10,,Columbia,Oregon,Oregon,Columbia,Bellis perennis,,"Oregon, Scappoose, Community center Garden",3,net,DRB,18,,
14060855,6/1/2018,2018-06-01 19:15:00 UTC,384451,,"Oregon, Aurora, NWREC",45.282222,-122.750092,10,,Clackamas,Oregon,Oregon,Clackamas,Taraxacum officinale,,"Oregon, Aurora, NWREC",1,net,DRB,19,,
14060894,6/1/2018,2018-06-01 22:15:00 UTC,384451,,"Oregon, Aurora, NWREC",45.282222,-122.750092,10,,Clackamas,Oregon,Oregon,Clackamas,Bellis perennis,,"Oregon, Aurora, NWREC",1,net,DRB,20,,
14061458,6/1/2018,2018-06-01 19:15:00 UTC,384451,https://static.inaturalist.org/photos/20810511/medium.jpg?1530755542,"Clackamas County, US-OR, US",45.282222,-122.75013,10,,Clackamas,Oregon,Oregon,Clackamas,Cistus,,"Oregon, Aurora, NWREC",1,net,DRB,21,,
14061839,6/16/2018,2018-06-16 17:00:00 UTC,384451,https://static.inaturalist.org/photos/20811050/medium.jpg?1530756298,"Oregon, Gresham, Headwater Farm",45.464972,-122.367553,5,,Multnomah,Oregon,Oregon,Multnomah,Eriophyllum confertiflorum,,"Oregon, Gresham, Headwater Farm",2,net,DRB,22,,
14062219,6/19/2018,2018-06-19 17:00:00 UTC,384451,https://static.inaturalist.org/photos/20811747/medium.jpg?1530757266,"Oregon, Clatsop County, Warrenton, Camp Kiwanilong",46.160038,-123.951226,5,,Clatsop,Oregon,Oregon,Clatsop,Stachys chamissonis,,"Oregon, Clatsop Co, Warrenton, Camp Kiwanilong",3,net,DRB,23,,
14062277,6/19/2018,2018-06-19 20:45:00 UTC,384451,,"Oregon, Clatsop County, Warrenton, Camp Kiwanilong",46.159849,-123.951671,45,,Clatsop,Oregon,Oregon,Clatsop,,,"Oregon, Clatsop Co, Warrenton, Camp Kiwanilong",2,net,DRB,24,,
14062343,6/19/2018,2018-06-19 20:45:00 UTC,384451,,"Oregon, Clatsop County, Warrenton, Camp Kiwanilong",46.159849,-123.951671,45,,Clatsop,Oregon,Oregon,Clatsop,,,"Oregon, Clatsop Co, Warrenton, Camp Kiwanilong",5,net,DRB,25,,
14062583,6/19/2018,2018-06-19 21:30:00 UTC,384451,,"Oregon, Clatsop County, Warrenton, Camp Kiwanilong",46.159849,-123.951671,45,,Clatsop,Oregon,Oregon,Clatsop,,,"Oregon, Clatsop Co, Warrenton, Camp Kiwanilong",8,net,DRB,26,,
14062642,6/19/2018,2018-06-19 23:00:00 UTC,384451,,"Oregon, Clatsop County, Warrenton, Camp Kiwanilong",46.159849,-123.951671,45,,Clatsop,Oregon,Oregon,Clatsop,,,"Oregon, Clatsop Co, Warrenton, Camp Kiwanilong",2,net,DRB,27,,
14062718,6/19/2018,2018-06-19 23:45:00 UTC,384451,,"Oregon, Clatsop County, Warrenton, Camp Kiwanilong",46.159849,-123.951671,45,,Clatsop,Oregon,Oregon,Clatsop,,,"Oregon, Clatsop Co, Warrenton, Camp Kiwanilong",1,net,DRB,28,,
14062771,6/19/2018,2018-06-19 23:45:00 UTC,384451,,"Oregon, Clatsop County, Warrenton, Camp Kiwanilong",46.159849,-123.951671,45,,Clatsop,Oregon,Oregon,Clatsop,,,"Oregon, Clatsop Co, Warrenton, Camp Kiwanilong",2,net,DRB,29,,
14062851,6/19/2018,2018-06-19 23:45:00 UTC,384451,,"Oregon, Clatsop County, Warrenton, Camp Kiwanilong",46.159849,-123.951671,45,,Clatsop,Oregon,Oregon,Clatsop,,,"Oregon, Clatsop Co, Warrenton, Camp Kiwanilong",1,net,DRB,30,,
14063089,6/26/2018,2018-06-26 21:40:00 UTC,384451,,"Oregon, St Helens, Fairgrounds, Demo Garden",45.848991,-122.869367,19,,Columbia,Oregon,Oregon,Columbia,Lavandula angustifolia,,"Oregon, St. Helens, Fairgrounds, Demo Garden",1,net,DRB,31,,
14063144,6/26/2018,2018-06-26 21:44:00 UTC,384451,,"Oregon, St Helens, Fairgrounds, Demo Garden",45.848991,-122.869367,19,,Columbia,Oregon,Oregon,Columbia,Pseudoveronica,,"Oregon, St. Helens, Fairgrounds, Demo Garden",1,net,DRB,32,,
14063182,6/26/2018,2018-06-26 21:46:00 UTC,384451,,"Oregon, St Helens, Fairgrounds, Demo Garden",45.848991,-122.869367,19,,Columbia,Oregon,Oregon,Columbia,Tanacetum parthenium,,"Oregon, St. Helens, Fairgrounds, Demo Garden",1,net,DRB,33,,
14063220,6/26/2018,2018-06-26 21:46:00 UTC,384451,,"Oregon, St Helens, Fairgrounds, Demo Garden",45.848991,-122.869367,19,,Columbia,Oregon,Oregon,Columbia,Lobularia maritima,,"Oregon, St. Helens, Fairgrounds, Demo Garden",2,net,DRB,34,,
14063249,6/26/2018,2018-06-26 21:51:00 UTC,384451,,"Oregon, St Helens, Fairgrounds, Demo Garden",45.848991,-122.869367,19,,Columbia,Oregon,Oregon,Columbia,,,"Oregon, St. Helens, Fairgrounds, Demo Garden",3,net,DRB,35,,
14063300,6/26/2018,2018-06-26 21:55:00 UTC,384451,,"Oregon, St Helens, Fairgrounds, Demo Garden",45.848991,-122.869367,19,,Columbia,Oregon,Oregon,Columbia,,,"Oregon, St. Helens, Fairgrounds, Demo Garden",1,net,DRB,36,,
14063329,6/26/2018,2018-06-26 22:01:00 UTC,384451,,"Oregon, St Helens, Fairgrounds, Demo Garden",45.848991,-122.869367,19,,Columbia,Oregon,Oregon,Columbia,Rubus fruticosus,,"Oregon, St. Helens, Fairgrounds, Demo Garden",4,net,DRB,37,,
14063365,6/26/2018,2018-06-26 22:06:00 UTC,384451,,"Oregon, St Helens, Fairgrounds, Demo Garden",45.848991,-122.869367,19,,Columbia,Oregon,Oregon,Columbia,Bidens ferulifolia,,"Oregon, St. Helens, Fairgrounds, Demo Garden",1,net,DRB,38,,
14063381,6/26/2018,2018-06-26 22:06:00 UTC,384451,,"Oregon, St Helens, Fairgrounds, Demo Garden",45.848991,-122.869367,19,,Columbia,Oregon,Oregon,Columbia,,,"Oregon, St. Helens, Fairgrounds, Demo Garden",1,net,DRB,39,,
12712562,5/22/2018,2018-05-22 17:05:46 UTC,792468,https://static.inaturalist.org/photos/18408199/medium.jpg?1527008898,"Oregon, US",45.14469871,-123.2667321,165,,Yamhill,Oregon,Oregon,Yamhill,Lupinus rivularis,,"McMinnville, Gopher Valley",1,net,Dto,16,,
12712759,5/22/2018,2018-05-22 17:15:03 UTC,792468,https://static.inaturalist.org/photos/18408620/medium.jpg?1527009463,"17701 SW Gopher Valley Rd, Sheridan, OR, US",45.13370551,-123.3739013,24,,Yamhill,Oregon,Oregon,Yamhill,Bellis perennis,,"McMinnvile, Gopher Valley",1,net,Dto,17,,
12713515,5/22/2018,2018-05-22 17:42:36 UTC,792468,https://static.inaturalist.org/photos/18410059/medium.jpg?1527011086,"17701 SW Gopher Valley Rd, Sheridan, OR, US",45.13520242,-123.3736532,16,,Yamhill,Oregon,Oregon,Yamhill,Crepis capillaris,,"McMinnville, Gopher Valley",3,net,Dto,18,,
12714446,5/22/2018,2018-05-22 18:13:48 UTC,792468,https://static.inaturalist.org/photos/18411597/medium.jpg?1527012902,"17701 SW Gopher Valley Rd, Sheridan, OR, US",45.13370087,-123.3732506,24,,Yamhill,Oregon,Oregon,Yamhill,Eschscholzia californica,,"McMinnville, Gopher Valley",1,net,Dto,19,,
12714878,5/22/2018,2018-05-22 18:29:06 UTC,792468,https://static.inaturalist.org/photos/18412331/medium.jpg?1527013796,"17701 SW Gopher Valley Rd, Sheridan, OR, US",45.13388186,-123.373059,24,,Yamhill,Oregon,Oregon,Yamhill,Cerastium tomentosum,,"McMinnville, Gopher Valley",2,net,Dto,20,,
12275259,5/8/2018,2018-05-08 19:19:27 UTC,792775,https://static.inaturalist.org/photos/17653596/medium.jpeg?1525813171,"17701 Gopher Valley Rd, Sheridan, OR 97378, USA",45.1338088,-123.3729494,20,,Yamhill,Oregon,Oregon,Yamhill,Acer circinatum,,Jeanie Taylor farm,7,net,dto,dto10,,
12336550,5/10/2018,2018-05-10 22:26:44 UTC,792775,https://static.inaturalist.org/photos/17762033/medium.jpeg?1525993707,"12439-12533 SE Burns Rd, McMinnville, OR 97128, USA",45.1706285,-123.1860995,116,,Yamhill,Oregon,Oregon,Yamhill,Phacelia tanacetifolia,,O'Loughlin farms,14,net,dto,dto11,,
12459491,5/14/2018,2018-05-14 19:13:17 UTC,792775,https://static.inaturalist.org/photos/17975634/medium.jpeg?1526329898,"Yamhill County, US-OR, US",45.25876419,-123.0742189,10,,Yamhill,Oregon,Oregon,Yamhill,Sidalcea campestris,,winter's hill estate,11,net,dto,dto12,,
12459504,5/14/2018,2018-05-14 19:48:35 UTC,792775,https://static.inaturalist.org/photos/17975661/medium.jpeg?1526329942,"Oregon, US",45.28225708,-123.0055577,16,,Yamhill,Oregon,Oregon,Yamhill,Lupinus rivularis,,winter's hill eatate,16,net,dto,dto13,,
12459512,5/14/2018,2018-05-14 20:13:16 UTC,792775,https://static.inaturalist.org/photos/17975678/medium.jpeg?1526329979,"6600 NE Breyman Orchards Rd, Dayton, OR 97114, USA",45.2645699,-123.0594082,110,,Yamhill,Oregon,Oregon,Yamhill,Eschscholzia californica,,winter's hill estate,5,net,dto,dto14,,
12459524,5/14/2018,2018-05-14 20:17:31 UTC,792775,https://static.inaturalist.org/photos/17975696/medium.jpeg?1526330016,"6451 NE Hilltop Ln, Dayton, OR 97114, USA",45.25843189,-123.0747473,10,,Yamhill,Oregon,Oregon,Yamhill,Aquilegia,,winter's hill estate,1,net,dto,dto15,,
10736630,4/9/2018,2018-04-09 18:15:41 UTC,792775,https://static.inaturalist.org/photos/15004027/medium.jpeg?1523305826,"Yamhill County, US-OR, US",45.1706325,-123.186087,87,,Yamhill,Oregon,Oregon,Yamhill,Ribes rubrum,,O'Loughlin farms,5,net,dto,dto2,,
13016216,5/23/2018,2018-05-23 22:33:49 UTC,792775,https://static.inaturalist.org/photos/18938571/medium.jpeg?1527878577,"12439-12533 SE Burns Rd, McMinnville, OR 97128, USA",45.1706285,-123.1860995,110,,Yamhill,Oregon,Oregon,Yamhill,Heracleum maximum,,oloughlin farms,1,net,dto,dto23,,
13016247,5/31/2018,2018-05-31 18:05:40 UTC,792775,https://static.inaturalist.org/photos/18938640/medium.jpeg?1527878649,"Yamhill County, US-OR, US",45.2459917,-123.1107874,2599,,Yamhill,Oregon,Oregon,Yamhill,Eriophyllum,,winter's hill,13,net,dto,dto24,,
13016307,5/31/2018,2018-05-31 18:47:56 UTC,792775,https://static.inaturalist.org/photos/18938698/medium.jpeg?1527878727,"6451 NE Hilltop Ln, Dayton, OR 97114, USA",45.2577661,-123.0745656,122,,Yamhill,Oregon,Oregon,Yamhill,Physocarpus capitatus,,winter's hill,6,net,dto,dto25,,
13016366,5/31/2018,2018-05-31 19:00:21 UTC,792775,https://static.inaturalist.org/photos/18938743/medium.jpeg?1527878786,"6451 NE Hilltop Ln, Dayton, OR 97114, USA",45.25790623,-123.0742633,9,,Yamhill,Oregon,Oregon,Yamhill,Ceanothus,,winter's hill,4,net,dto,dto26,,
13016388,5/31/2018,2018-05-31 19:32:30 UTC,792775,https://static.inaturalist.org/photos/18938794/medium.jpeg?1527878836,"6451 NE Hilltop Ln, Dayton, OR 97114, USA",45.25818919,-123.0740833,18,,Yamhill,Oregon,Oregon,Yamhill,Eschscholzia californica,,winter's hill,3,net,dto,dto27,,
13016402,5/31/2018,2018-05-31 19:56:21 UTC,792775,https://static.inaturalist.org/photos/18938824/medium.jpeg?1527878884,"451 12th St, Lafayette, OR 97127, USA",45.2495624,-123.1108966,2799,,Yamhill,Oregon,Oregon,Yamhill,Sidalcea,,winter's hill,1,net,dto,dto28,,
13016448,5/31/2018,2018-05-31 20:07:37 UTC,792775,https://static.inaturalist.org/photos/18938872/medium.jpeg?1527878944,"891 S Park St, Carlton, OR 97111, USA",45.2884413,-123.1827411,3000,,Yamhill,Oregon,Oregon,Yamhill,Vicia cracca,,winter's hill,8,net,dto,dto29,,
10736638,4/9/2018,2018-04-09 19:04:59 UTC,792775,https://static.inaturalist.org/photos/15004058/medium.jpeg?1523305882,"12125 SE Burns Rd, McMinnville, OR 97128, USA",45.17243634,-123.1853743,3,,Yamhill,Oregon,Oregon,Yamhill,Salix,,oloughlin farms,11,net,dto,dto3,,
13016458,5/31/2018,2018-05-31 20:16:34 UTC,792775,https://static.inaturalist.org/photos/18938891/medium.jpeg?1527878971,"6451 NE Hilltop Ln, Dayton, OR 97114, USA",45.258212,-123.074132,17,,Yamhill,Oregon,Oregon,Yamhill,Heracleum maximum,,winter's hill,6,net,dto,dto30,,
13016484,5/31/2018,2018-05-31 22:41:29 UTC,792775,https://static.inaturalist.org/photos/18938943/medium.jpeg?1527879023,"NE Heather Dr, McMinnville, OR 97128, USA",45.2022103,-123.1354984,2200,,Yamhill,Oregon,Oregon,Yamhill,Fragaria,,winter's hill,5,net,dto,dto31,,
13607726,6/11/2018,2018-06-11 19:45:13 UTC,792775,https://static.inaturalist.org/photos/20022247/medium.jpeg?1529502196,"6451 NE Hilltop Ln, Dayton, OR 97114, USA",45.2577765,-123.0745968,142,,Yamhill,Oregon,Oregon,Yamhill,Achillea millefolium,,winter's hill,1,net,dto,dto32,,
13607733,6/19/2018,2018-06-19 17:25:27 UTC,792775,https://static.inaturalist.org/photos/20022260/medium.jpeg?1529502220,"17701 Gopher Valley Rd, Sheridan, OR 97378, USA",45.1338823,-123.372975,68,,Yamhill,Oregon,Oregon,Yamhill,Eriophyllum lanatum integrifolium,,Jeanie Taylor farm,1,net,dto,dto33,,
13607742,6/19/2018,2018-06-19 17:47:45 UTC,792775,https://static.inaturalist.org/photos/20022271/medium.jpeg?1529502239,"17701 Gopher Valley Rd, Sheridan, OR 97378, USA",45.133817,-123.3729245,92,,Yamhill,Oregon,Oregon,Yamhill,Escallonia,,Jeanie Taylor farm,1,net,dto,dto34,,
13607750,6/19/2018,2018-06-19 17:58:53 UTC,792775,https://static.inaturalist.org/photos/20022282/medium.jpeg?1529502265,"17701 Gopher Valley Rd, Sheridan, OR 97378, USA",45.1338823,-123.372975,104,,Yamhill,Oregon,Oregon,Yamhill,Eschscholzia californica,,Jeanie Taylor farm,1,net,dto,dto35,,
13607752,6/19/2018,2018-06-19 18:25:57 UTC,792775,https://static.inaturalist.org/photos/20022296/medium.jpeg?1529502278,"17701 Gopher Valley Rd, Sheridan, OR 97378, USA",45.133817,-123.3729245,104,,Yamhill,Oregon,Oregon,Yamhill,Sidalcea campestris,,Jeanie Taylor farm,1,net,dto,dto36,,
10736653,4/9/2018,2018-04-09 20:27:53 UTC,792775,https://static.inaturalist.org/photos/15004085/medium.jpeg?1523305924,"12125 SE Burns Rd, McMinnville, OR 97128, USA",45.17102894,-123.1859547,5,,Yamhill,Oregon,Oregon,Yamhill,Hydrangea macrophylla,,O'Loughlin farms,1,net,dto,dto4,,
14250234,7/10/2018,2018-07-11 00:25:36 UTC,792775,https://static.inaturalist.org/photos/21150072/medium.jpeg?1531280337,"Yamhill County, US-OR, US",45.1691735,-123.1833599,41,,Yamhill,Oregon,Oregon,Yamhill,Kickxia spuria,,O'Loughlin farms,7,net,dto,dto40,,
14250242,7/10/2018,2018-07-11 00:36:17 UTC,792775,,"7360 SE Lafayette Hwy, Dayton, OR 97114, USA",45.2058432,-123.1072909,2700,,Yamhill,Oregon,Oregon,Yamhill,Solidago canadensis,,O'Loughlin Farms,61,net,dto,dto41,,
14280225,7/11/2018,2018-07-12 00:54:51 UTC,792775,https://static.inaturalist.org/photos/21202616/medium.jpeg?1531368080,"12700 SE Burns Rd, McMinnville, OR 97128, USA",45.16763345,-123.1843196,22,,Yamhill,Oregon,Oregon,Yamhill,Dipsacus fullonum,,O'Loughlin farms,1,net,dto,dto42,,
14422375,7/16/2018,2018-07-16 17:42:23 UTC,792775,https://static.inaturalist.org/photos/21459010/medium.jpeg?1531768390,"5510 NE Breyman Orchards Rd, Dayton, OR 97114, USA",45.2572098,-123.0601778,104,,Yamhill,Oregon,Oregon,Yamhill,Anaphalis margaritacea,,winter's hill,4,net,dto,dto44,,
14422388,7/16/2018,2018-07-16 18:19:36 UTC,792775,https://static.inaturalist.org/photos/21459037/medium.jpeg?1531768456,"5510 NE Breyman Orchards Rd, Dayton, OR 97114, USA",45.2572098,-123.0601778,104,,Yamhill,Oregon,Oregon,Yamhill,Crepis,,winter's hill,3,net,dto,dto45,,
14913528,7/29/2018,2018-07-29 20:42:05 UTC,792775,https://static.inaturalist.org/photos/22261509/medium.jpeg?1532910322,"7360 SE Lafayette Hwy, Dayton, OR 97114, USA",45.2058432,-123.1072909,2700,,Yamhill,Oregon,Oregon,Yamhill,Cosmos bipinnatus,,O'Loughlin farms,28,net,dto,dto46,,
14913543,7/29/2018,2018-07-29 20:43:42 UTC,792775,https://static.inaturalist.org/photos/22261532/medium.jpeg?1532910345,"7360 SE Lafayette Hwy, Dayton, OR 97114, USA",45.2058432,-123.1072909,2700,,Yamhill,Oregon,Oregon,Yamhill,Zinnia elegans,,O'Loughlin farms,5,net,dto,dto47,,
14913576,7/29/2018,2018-07-29 20:45:09 UTC,792775,https://static.inaturalist.org/photos/22261557/medium.jpeg?1532910367,"12439 SE Burns Rd, McMinnville, OR 97128, USA",45.1706356,-123.1861088,128,,Yamhill,Oregon,Oregon,Yamhill,,,O'Loughlin farms,20,vane trap,dto,dto48,2018-07-29T13:46:00-07:00,2018-08-02T19:33:00-07:00
14913615,7/29/2018,2018-07-29 20:47:22 UTC,792775,https://static.inaturalist.org/photos/22261577/medium.jpeg?1532910388,"12125 SE Burns Rd, McMinnville, OR 97128, USA",45.17106573,-123.1856562,11,,Yamhill,Oregon,Oregon,Yamhill,,,O'Loughlin farms,11,pan trap,dto,dto49,2018-07-29T13:49:00-07:00,2018-07-30T12:00:00-07:00
12275168,5/8/2018,2018-05-08 17:15:03 UTC,792775,https://static.inaturalist.org/photos/17653476/medium.jpeg?1525812991,"17701 Gopher Valley Rd, Sheridan, OR 97378, USA",45.13380477,-123.3729962,10,,Yamhill,Oregon,Oregon,Yamhill,Rubus ursinus,,Jeanie Taylor farm,1,net,dto,dto5,,
14964059,7/30/2018,2018-07-30 16:52:50 UTC,792775,https://static.inaturalist.org/photos/22320967/medium.jpeg?1532985601,"6451 NE Hilltop Ln, Dayton, OR 97114, USA",45.25873915,-123.0743085,21,,Yamhill,Oregon,Oregon,Yamhill,Oenothera,,w,1,net,dto,dto50,,
14964141,7/30/2018,2018-07-30 16:57:41 UTC,792775,https://static.inaturalist.org/photos/22321017/medium.jpeg?1532985647,"17350 NE Timmons Ln, Dayton, OR 97114, USA",45.267291,-123.0589019,135,,Yamhill,Oregon,Oregon,Yamhill,Asteroideae,,winter's hill,25,net,dto,dto51,,
13607665,6/11/2018,2018-06-11 17:35:09 UTC,792775,https://static.inaturalist.org/photos/20022149/medium.jpeg?1529502032,"6451 NE Hilltop Ln, Dayton, OR 97114, USA",45.25849321,-123.0744503,11,,Yamhill,Oregon,Oregon,Yamhill,Ceanothus thyrsiflorus,,winter's hill,1,net,dto,dto52,,
13607676,6/11/2018,2018-06-11 17:51:51 UTC,792775,https://static.inaturalist.org/photos/20022160/medium.jpeg?1529502047,"6451 NE Hilltop Ln, Dayton, OR 97114, USA",45.258678,-123.0742717,8,,Yamhill,Oregon,Oregon,Yamhill,Lupinus,,winter's hill,1,net,dto,dto53,,
13607680,6/11/2018,2018-06-11 17:52:59 UTC,792775,https://static.inaturalist.org/photos/20022169/medium.jpeg?1529502060,"6451 NE Hilltop Ln, Dayton, OR 97114, USA",45.25857879,-123.0742439,16,,Yamhill,Oregon,Oregon,Yamhill,Vicia,,winter's hill,6,net,dto,dto54,,
13607682,6/11/2018,2018-06-11 18:26:25 UTC,792775,https://static.inaturalist.org/photos/20022182/medium.jpeg?1529502078,"6451 NE Hilltop Ln, Dayton, OR 97114, USA",45.25904465,-123.0737676,27,,Yamhill,Oregon,Oregon,Yamhill,Tragopogon dubius,,winter's hill,1,net,dto,dto55,,
13607696,6/11/2018,2018-06-11 18:32:35 UTC,792775,https://static.inaturalist.org/photos/20022199/medium.jpeg?1529502108,"6451 NE Hilltop Ln, Dayton, OR 97114, USA",45.25933339,-123.073741,28,,Yamhill,Oregon,Oregon,Yamhill,Eriophyllum lanatum,,winter's hill,10,net,dto,dto56,,
13607698,6/11/2018,2018-06-11 18:49:47 UTC,792775,https://static.inaturalist.org/photos/20022207/medium.jpeg?1529502126,"6451 NE Hilltop Ln, Dayton, OR 97114, USA",45.2577765,-123.0745968,128,,Yamhill,Oregon,Oregon,Yamhill,Leucanthemum vulgare,,winter's hill,3,net,dto,dto57,,
13607713,6/11/2018,2018-06-11 19:02:08 UTC,792775,https://static.inaturalist.org/photos/20022225/medium.jpeg?1529502151,"6451 NE Hilltop Ln, Dayton, OR 97114, USA",45.25960779,-123.0734904,16,,Yamhill,Oregon,Oregon,Yamhill,Crepis,,winter's hill,4,net,dto,dto58,,
13607716,6/11/2018,2018-06-11 19:13:28 UTC,792775,https://static.inaturalist.org/photos/20022234/medium.jpeg?1529502172,"6451 NE Hilltop Ln, Dayton, OR 97114, USA",45.25953924,-123.0734205,24,,Yamhill,Oregon,Oregon,Yamhill,Eschscholzia californica,,winter's hill,2,net,dto,dto59,,
12275173,5/8/2018,2018-05-08 17:33:44 UTC,792775,https://static.inaturalist.org/photos/17653491/medium.jpeg?1525813016,"17555 Gopher Valley Rd, Sheridan, OR 97378, USA",45.13339527,-123.3735727,10,,Yamhill,Oregon,Oregon,Yamhill,Scandix pecten-veneris,,Jeanie Taylor farm,8,net,dto,dto6,,
15419259,8/13/2018,2018-08-13 17:31:50 UTC,792775,https://static.inaturalist.org/photos/23119137/medium.jpeg?1534257422,"6451 NE Hilltop Ln, Dayton, OR 97114, USA",45.25830207,-123.0741795,10,,Yamhill,Oregon,Oregon,Yamhill,Anaphalis margaritacea,,winter's hill,10,net,dto,dto60,,
15419270,8/13/2018,2018-08-13 17:47:01 UTC,792775,https://static.inaturalist.org/photos/23119156/medium.jpeg?1534257445,"6451 NE Hilltop Ln, Dayton, OR 97114, USA",45.25858451,-123.0746247,13,,Yamhill,Oregon,Oregon,Yamhill,Cirsium,,winter' hill,8,net,dto,dto61,,
15419277,8/13/2018,2018-08-13 17:52:00 UTC,792775,https://static.inaturalist.org/photos/23119173/medium.jpeg?1534257463,"6451 NE Hilltop Ln, Dayton, OR 97114, USA",45.25902792,-123.07444,10,,Yamhill,Oregon,Oregon,Yamhill,Solidago,,winter's hill,27,net,dto,dto62,,
15419283,8/13/2018,2018-08-13 18:26:01 UTC,792775,https://static.inaturalist.org/photos/23119187/medium.jpeg?1534257482,"6451 NE Hilltop Ln, Dayton, OR 97114, USA",45.25952101,-123.0737043,10,,Yamhill,Oregon,Oregon,Yamhill,Raphanus sativus,,winter' hill,6,net,dto,dto63,,
15591650,8/14/2018,2018-08-14 17:54:26 UTC,792775,https://static.inaturalist.org/photos/23313285/medium.jpeg?1534545582,"17555 Gopher Valley Rd, Sheridan, OR 97378, USA",45.13381343,-123.3732808,21,,Yamhill,Oregon,Oregon,Yamhill,Cichorium,,jeanie,16,net,dto,dto66,,
15591669,8/14/2018,2018-08-14 18:40:50 UTC,792775,https://static.inaturalist.org/photos/23313311/medium.jpeg?1534545612,"17555 Gopher Valley Rd, Sheridan, OR 97378, USA",45.13379053,-123.3738836,3,,Yamhill,Oregon,Oregon,Yamhill,Daucus carota,,jeanie,74,net,dto,dto67,,
15591686,8/14/2018,2018-08-14 19:21:50 UTC,792775,https://static.inaturalist.org/photos/23313349/medium.jpeg?1534545644,"17701 Gopher Valley Rd, Sheridan, OR 97378, USA",45.13374973,-123.3727796,3,,Yamhill,Oregon,Oregon,Yamhill,Eschscholzia californica,,jeanie,3,net,dto,dto68,,
12275225,5/8/2018,2018-05-08 17:48:20 UTC,792775,https://static.inaturalist.org/photos/17653533/medium.jpeg?1525813075,"19381 SW Cherry Hill Rd, Sheridan, OR 97378, USA",45.1219089,-123.3744209,1500,,Yamhill,Oregon,Oregon,Yamhill,Bellis perennis,,jeanie taylor's farm,9,net,dto,dto7,,
12275237,5/8/2018,2018-05-08 18:15:29 UTC,792775,https://static.inaturalist.org/photos/17653551/medium.jpeg?1525813112,"25601-26399 Valley View Ln, Sheridan, OR 97378, USA",45.110379,-123.3785999,3200,,Yamhill,Oregon,Oregon,Yamhill,Crepis capillaris,,Jeanie Taylor farm,10,net,dto,dto8,,
12275249,5/8/2018,2018-05-08 18:54:53 UTC,792775,https://static.inaturalist.org/photos/17653568/medium.jpeg?1525813144,"17701 Gopher Valley Rd, Sheridan, OR 97378, USA",45.1338088,-123.3729494,20,,Yamhill,Oregon,Oregon,Yamhill,Rosmarinus officinalis,,Jeanie Taylor farm,16,net,dto,dto9,,
12163348,3/28/2018,2018-03-28 20:00:00 UTC,854908,,"7144 NW Thompson Road, Portland, Oregon 97229",45.543713,-122.750923,14,,Multnomah,Oregon,Oregon,Multnomah,,,,1,net,ENR,1,,
12164082,5/5/2018,2018-05-05 16:58:46 UTC,854908,https://static.inaturalist.org/photos/17461711/medium.jpeg?1525539742,"Multnomah County, US-OR, US",45.54408732,-122.7500734,9,,Multnomah,Oregon,Oregon,Multnomah,,,"7144 NW Thompson Road, Portland, OR",0,net,ENR,2,,
18431978,4/24/2018,2018-04-24 21:52:00 UTC,854908,,"Multnomah County, US-OR, US",45.543546,-122.750914,,,Multnomah,Oregon,Oregon,Multnomah,,,"7144 NW Thompson Road, Portland Oregon 97229",1,net,ENR,3,,
18432105,4/26/2018,2018-04-27 00:47:00 UTC,854908,,"Multnomah County, US-OR, US",45.543546,-122.750914,,,Multnomah,Oregon,Oregon,Multnomah,,,"7144 NW Thompson Road, Portland Oregon 97229",1,net,ENR,5,,
18432154,5/5/2018,,854908,,"Multnomah County, US-OR, US",45.543546,-122.750914,,,Multnomah,Oregon,Oregon,Multnomah,,,"7144 NW Thompson Road, Portland Oregon 97229",1,net,ENR,6,,
12462951,5/14/2018,2018-05-14 22:22:57 UTC,854908,https://static.inaturalist.org/photos/17981389/medium.jpeg?1526336857,"Multnomah County, US-OR, US",45.54358827,-122.7507955,9,,Multnomah,Oregon,Oregon,Multnomah,Allium schoenoprasum,,7144 NW Thompson Road,1,net,ENR,8,,
12652546,5/20/2018,2018-05-20 20:40:24 UTC,854908,https://static.inaturalist.org/photos/18306037/medium.jpeg?1526849128,"Multnomah County, US-OR, US",45.54362742,-122.7507604,9,,Multnomah,Oregon,Oregon,Multnomah,Allium schoenoprasum,,7144 NW Thompson Road,1,net,ENR,9,,
12652966,5/20/2018,2018-05-20 20:52:25 UTC,854908,https://static.inaturalist.org/photos/18306476/medium.jpeg?1526849728,"6901-7201 NW Thompson Rd, Portland, OR 97229, USA",45.54354751,-122.7508022,9,,Multnomah,Oregon,Oregon,Multnomah,Allium schoenoprasum,,7144 NW Thompson Road,1,net,ENR,10,,
18432295,6/13/2018,2018-06-14 00:00:00 UTC,854908,,"Multnomah County, US-OR, US",45.543546,-122.750914,,,Multnomah,Oregon,Oregon,Multnomah,,,"7144 NW Thompson Road, Portland Oregon 97229",1,net,ENR,11,,
18432510,5/25/2018,2018-05-25 19:28:00 UTC,854908,,"Clackamas County, US-OR, US",45.408777,-122.720465,,,Clackamas,Oregon,Oregon,Clackamas,,,"16143 Nola Ct, Lake Oswego, Oregon 97035",1,net,ENR,11,,
14851613,7/28/2018,2018-07-28 21:51:55 UTC,854908,https://static.inaturalist.org/photos/22170723/medium.jpeg?1532814973,"6901 NW Thompson Rd, Portland, OR 97229, USA",45.54355287,-122.7511343,8,,Multnomah,Oregon,Oregon,Multnomah,Chamaenerion angustifolium,,7144 NWThompson Road,1,net,ENR,13,,
10496679,3/29/2018,2018-03-29 22:47:07 UTC,754260,https://static.inaturalist.org/photos/14598858/medium.jpeg?1522364061,"3334 NW Covey Run, Corvallis, OR 97330, USA",44.59890375,-123.3154306,9,,Benton,Oregon,Oregon,Benton,Arctostaphylos densiflora,,backyard,5,net,EW,1,,
10557681,4/1/2018,2018-04-01 23:37:33 UTC,754260,,"3334 NW Covey Run, Corvallis, OR 97330, USA",44.59921851,-123.3158353,9,,Benton,Oregon,Oregon,Benton,,,backyard,1,net,EW,2,,
10644098,4/5/2018,2018-04-05 21:06:45 UTC,754260,https://static.inaturalist.org/photos/14851764/medium.jpeg?1522962755,"3334 NW Covey Run, Corvallis, OR 97330, USA",44.59915206,-123.3150268,21,,Benton,Oregon,Oregon,Benton,,,backyard,2,net,EW,3,,
10666518,4/6/2018,2018-04-06 22:36:21 UTC,754260,https://static.inaturalist.org/photos/14889362/medium.jpeg?1523054455,"3334 NW Covey Run, Corvallis, OR 97330, USA",44.5989316,-123.3152746,7,,Benton,Oregon,Oregon,Benton,Berberis repens,,backyard,4,net,EW,4,,
10739111,4/9/2018,2018-04-09 22:33:50 UTC,754260,https://static.inaturalist.org/photos/15008669/medium.jpeg?1523313473,"3334 NW Covey Run, Corvallis, OR 97330, USA",44.59941624,-123.3156766,9,,Benton,Oregon,Oregon,Benton,Fragaria virginiana,,backyard,1,net,EW,5,,
10739684,4/9/2018,2018-04-09 22:59:15 UTC,754260,https://static.inaturalist.org/photos/15009717/medium.jpeg?1523315028,"3334 NW Covey Run, Corvallis, OR 97330, USA",44.59899064,-123.3157444,7,,Benton,Oregon,Oregon,Benton,Pyrus communis,,backyard,3,net,EW,6,,
11187297,4/19/2018,2018-04-19 23:31:23 UTC,754260,https://static.inaturalist.org/photos/15851919/medium.jpeg?1524180866,"3334 NW Covey Run, Corvallis, OR 97330, USA",44.59931842,-123.3148512,15,,Benton,Oregon,Oregon,Benton,Ribes sanguineum,,backyard,4,net,EW,7,,
11187966,4/19/2018,2018-04-19 23:50:54 UTC,754260,https://static.inaturalist.org/photos/15854563/medium.jpeg?1524183059,"3334 NW Covey Run, Corvallis, OR 97330, USA",44.59907683,-123.3155583,9,,Benton,Oregon,Oregon,Benton,Arctostaphylos glauca,,backyard,1,net,EW,8,,
11189379,4/19/2018,2018-04-20 00:27:45 UTC,754260,https://static.inaturalist.org/photos/15855823/medium.jpeg?1524184231,"3334 NW Covey Run, Corvallis, OR 97330, USA",44.59897829,-123.3154386,13,,Benton,Oregon,Oregon,Benton,Arctostaphylos densiflora,,backyard,1,net,EW,9,,
11583628,4/21/2018,2018-04-21 20:00:00 UTC,754260,,"Benton County, US-OR, US",44.59912414,-123.3152924,33,,Benton,Oregon,Oregon,Benton,,,backyard,1,net,EW,10,,
11336527,4/22/2018,2018-04-22 21:20:44 UTC,754260,https://static.inaturalist.org/photos/16145615/medium.jpeg?1524432286,"3334 NW Covey Run, Corvallis, OR 97330, USA",44.59892746,-123.3154221,9,,Benton,Oregon,Oregon,Benton,Eschscholzia lobbii,,backyard,2,net,EW,11,,
11337882,4/22/2018,2018-04-22 21:49:21 UTC,754260,,"3334 NW Covey Run, Corvallis, OR 97330, USA",44.59896011,-123.3153149,9,,Benton,Oregon,Oregon,Benton,,,backyard,3,net,EW,12,,
12051501,5/2/2018,2018-05-02 18:09:27 UTC,754260,https://static.inaturalist.org/photos/17278689/medium.jpeg?1525284844,"6364-6638 Historic Columbia River Hwy, Mosier, OR 97040, USA",45.67595904,-121.2949945,19,,Wasco,Oregon,Oregon,Wasco,Lupinus,,Old Columbia River Highway roadside,6,net,EW,13,,
12053756,5/2/2018,2018-05-02 18:35:25 UTC,754260,https://static.inaturalist.org/photos/17282352/medium.jpeg?1525287590,"6364-6638 Historic Columbia River Hwy, Mosier, OR 97040, USA",45.67584018,-121.2950667,25,,Wasco,Oregon,Oregon,Wasco,Senecio integerrimus,,Old Columbia River Highway roadside,1,net,EW,14,,
12053781,5/2/2018,2018-05-02 18:53:08 UTC,754260,https://static.inaturalist.org/photos/17282440/medium.jpeg?1525287660,"6364-6638 Historic Columbia River Hwy, Mosier, OR 97040, USA",45.67582692,-121.2950952,7,,Wasco,Oregon,Oregon,Wasco,Lomatium triternatum,,Old Columbia River Highway roadside,8,net,EW,15,,
12055405,5/2/2018,2018-05-02 19:32:48 UTC,754260,https://static.inaturalist.org/photos/17285587/medium.jpeg?1525289862,"6364-6638 Historic Columbia River Hwy, Mosier, OR 97040, USA",45.67555202,-121.2953814,6,,Wasco,Oregon,Oregon,Wasco,Lomatium nudicaule,,Old Columbia River Highway roadside,9,net,EW,16,,
12056847,5/2/2018,2018-05-02 20:05:56 UTC,754260,https://static.inaturalist.org/photos/17287750/medium.jpeg?1525291787,"Vietnam Veterans Memorial Highway, Mosier, OR 97040, USA",45.68757202,-121.4278109,9,,Wasco,Oregon,Oregon,Wasco,Penstemon barrettiae,,"Russ Jolley wayside, Hwy 84 westbound, milepost 68",3,net,EW,17,,
12362330,5/11/2018,2018-05-11 21:17:06 UTC,754260,https://static.inaturalist.org/photos/17807464/medium.jpeg?1526074071,"Benton County, US-OR, US",44.54734249,-123.301326,9,,Benton,Oregon,Oregon,Benton,Rosa nutkana,,Sunset Park,1,net,EW,18,,
12363804,5/11/2018,2018-05-11 22:21:51 UTC,754260,https://static.inaturalist.org/photos/17810000/medium.jpeg?1526077490,"Sunset Park, 4567 SW Country Club Drive, Corvallis, OR 97333, USA",44.5477,-123.305,,,Benton,Oregon,Oregon,Benton,Crataegus monogyna,,Sunset Park,1,net,EW,19,,
12394225,5/12/2018,2018-05-12 21:28:13 UTC,754260,https://static.inaturalist.org/photos/17862520/medium.jpeg?1526161015,"3334 NW Covey Run, Corvallis, OR 97330, USA",44.59910888,-123.3151962,9,,Benton,Oregon,Oregon,Benton,Limnanthes douglasii,,backyard,4,net,EW,20,,
12396280,5/12/2018,2018-05-12 22:38:16 UTC,754260,https://static.inaturalist.org/photos/17866593/medium.jpeg?1526165066,"3334 NW Covey Run, Corvallis, OR 97330, USA",44.59880615,-123.3153396,9,,Benton,Oregon,Oregon,Benton,Plectritis congesta,,backyard,6,net,EW,21,,
12460112,5/14/2018,2018-05-14 20:55:01 UTC,754260,https://static.inaturalist.org/photos/17976689/medium.jpeg?1526331476,"3334 NW Covey Run, Corvallis, OR 97330, USA",44.598907,-123.315119,3,,Benton,Oregon,Oregon,Benton,Cornus sericea,,backyard,6,net,EW,22,,
12461356,5/14/2018,2018-05-14 21:30:09 UTC,754260,https://static.inaturalist.org/photos/17978623/medium.jpeg?1526333619,"3334 NW Covey Run, Corvallis, OR 97330, USA",44.59894687,-123.3151859,9,,Benton,Oregon,Oregon,Benton,Gilia tricolor,,backyard,5,net,EW,23,,
12473693,5/14/2018,2018-05-14 21:58:27 UTC,754260,https://static.inaturalist.org/photos/18000061/medium.jpeg?1526363170,"3334 NW Covey Run, Corvallis, OR 97330, USA",44.59890524,-123.3155276,15,,Benton,Oregon,Oregon,Benton,Lupinus oreganus,,backyard,1,net,EW,24,,
12473700,5/14/2018,2018-05-14 22:08:49 UTC,754260,https://static.inaturalist.org/photos/18000075/medium.jpeg?1526363192,"3334 NW Covey Run, Corvallis, OR 97330, USA",44.59877449,-123.3152322,7,,Benton,Oregon,Oregon,Benton,Sidalcea malviflora,,backyard,5,net,EW,25,,
12495926,5/15/2018,2018-05-15 21:56:24 UTC,754260,https://static.inaturalist.org/photos/18037524/medium.jpeg?1526421849,"Benton County, US-OR, US",44.59468634,-123.302924,13,,Benton,Oregon,Oregon,Benton,Prunus virginiana,,"City owned riparian habitat on west side of Glenridge Dr, opposite 2867 Glenridge Dr.",4,net,EW,26,,
12586378,5/18/2018,2018-05-18 21:02:33 UTC,754260,https://static.inaturalist.org/photos/18190495/medium.jpeg?1526677562,"3334 NW Covey Run, Corvallis, OR 97330, USA",44.59915218,-123.3151961,21,,Benton,Oregon,Oregon,Benton,Eschscholzia californica,,backyard,2,net,EW,27,,
12588824,5/18/2018,2018-05-18 22:46:03 UTC,754260,https://static.inaturalist.org/photos/18194837/medium.jpeg?1526683786,"3334 NW Covey Run, Corvallis, OR 97330, USA",44.59905219,-123.3151452,18,,Benton,Oregon,Oregon,Benton,Spiraea betulifolia,,backyard,7,net,EW,28,,
12752929,5/23/2018,2018-05-23 22:48:46 UTC,754260,https://static.inaturalist.org/photos/18477084/medium.jpeg?1527115873,"3334 NW Covey Run, Corvallis, OR 97330, USA",44.6003635,-123.3176243,110,,Benton,Oregon,Oregon,Benton,Geranium oreganum,,backyard,4,net,EW,29,,
12753662,5/23/2018,2018-05-23 23:13:20 UTC,754260,https://static.inaturalist.org/photos/18478413/medium.jpeg?1527117350,"3334 NW Covey Run, Corvallis, OR 97330, USA",44.59936994,-123.3153136,27,,Benton,Oregon,Oregon,Benton,Wyethia angustifolia,,backyard,1,net,EW,30,,
12754470,5/23/2018,2018-05-23 23:49:28 UTC,754260,https://static.inaturalist.org/photos/18479898/medium.jpeg?1527119490,"3334 NW Covey Run, Corvallis, OR 97330, USA",44.59901266,-123.3156872,13,,Benton,Oregon,Oregon,Benton,Dichelostemma congestum,,backyard,2,net,EW,31,,
12859708,5/26/2018,2018-05-26 19:46:34 UTC,754260,https://static.inaturalist.org/photos/18663704/medium.jpeg?1527436328,"Benton County, US-OR, US",44.56748629,-123.283785,18,,Benton,Oregon,Oregon,Benton,Ceanothus thyrsiflorus,,OSU Cordley parking lot,11,net,EW,32,,
12834094,5/26/2018,2018-05-26 18:59:33 UTC,754260,https://static.inaturalist.org/photos/18619053/medium.jpeg?1527361353,"735-751 SW 35th St, Corvallis, OR 97333, USA",44.56036937,-123.2888207,9,,Benton,Oregon,Oregon,Benton,Physocarpus capitatus,,OSU,2,net,EW,33,,
12908039,5/28/2018,2018-05-28 20:18:37 UTC,754260,https://static.inaturalist.org/photos/18747984/medium.jpeg?1527548117,"Lake County, US-OR, US",43.214115,-121.201884,96,,Lake,Oregon,Oregon,Lake,Boechera sparsiflora,,Connie's Canyon,2,net,EW,34,,
12908168,5/28/2018,2018-05-28 21:12:50 UTC,754260,https://static.inaturalist.org/photos/18748155/medium.jpeg?1527548297,"Lake County, US-OR, US",43.214365,-121.198772,,,Lake,Oregon,Oregon,Lake,Drymocallis lactea lactea,,Connie's Canyon,1,net,EW,35,,
12910694,5/28/2018,2018-05-28 22:53:46 UTC,754260,https://static.inaturalist.org/photos/18753137/medium.jpeg?1527553760,"Lake County, Silver Lake, OR 97638, RimRock Ranch, USA",43.222267,-121.171846,24,,Lake,Oregon,Oregon,Lake,Lupinus lepidus,,"RimRock Ranch, Connie's Ranch, SE corner",1,net,EW,36,,
12919022,5/28/2018,2018-05-29 00:10:46 UTC,754260,https://static.inaturalist.org/photos/18767320/medium.jpeg?1527574467,"Lake County, US-OR, US, Silver Lake, 77669 Mahogany St",43.12430448,-121.0417438,12,,Lake,Oregon,Oregon,Lake,Lupinus,,Latham bunkhouse,1,net,EW,37,,
12934220,5/29/2018,2018-05-29 20:28:46 UTC,754260,https://static.inaturalist.org/photos/18794578/medium.jpeg?1527626107,"Lake County, Silver Lake, OR 97638, RimRock Ranch, USA",43.22571515,-121.1871748,25,,Lake,Oregon,Oregon,Lake,Hemizonella minima,,"RimRock Ranch, mezzanine",3,net,EW,38,,
12936667,5/29/2018,2018-05-29 22:03:51 UTC,754260,https://static.inaturalist.org/photos/18798969/medium.jpeg?1527631620,"Lake County, Silver Lake, OR 97638, RimRock Ranch, USA",43.223265,-121.190666,12,,Lake,Oregon,Oregon,Lake,Balsamorhiza sagittata,,"RimRock Ranch, Chateau Bob",2,net,EW,39,,
12965658,5/30/2018,2018-05-30 21:49:53 UTC,754260,https://static.inaturalist.org/photos/18849361/medium.jpeg?1527717963,"3334 NW Covey Run, Corvallis, OR 97330, USA",44.59904199,-123.3150669,10,,Benton,Oregon,Oregon,Benton,Spiraea splendens,,backyard,1,net,EW,40,,
12966349,5/30/2018,2018-05-30 22:28:53 UTC,754260,https://static.inaturalist.org/photos/18850565/medium.jpeg?1527719763,"3334 NW Covey Run, Corvallis, OR 97330, USA",44.5991464,-123.3154421,13,,Benton,Oregon,Oregon,Benton,Penstemon ovatus,,backyard,1,net,EW,41,,
12967326,5/30/2018,2018-05-30 23:17:36 UTC,754260,https://static.inaturalist.org/photos/18852649/medium.jpeg?1527722447,"3334 NW Covey Run, Corvallis, OR 97330, USA",44.59896526,-123.3151169,18,,Benton,Oregon,Oregon,Benton,Spiraea betulifolia,,backyard,2,net,EW,42,,
12976115,5/30/2018,2018-05-30 19:00:00 UTC,754260,,"6613 SW West Hills Road, Corvallis, OR  97333",44.558064,-123.326855,2,,Benton,Oregon,Oregon,Benton,,,Barb's driveway,1,net,EW,43,,
13124528,6/3/2018,2018-06-03 20:19:24 UTC,754260,https://static.inaturalist.org/photos/19134241/medium.jpeg?1528148040,"Crook County, US-OR, US",44.09940439,-120.3201015,9,,Crook,Oregon,Oregon,Crook,Astragalus filipes,,"Maury Mtns, SE Drake Ck Rd",8,net,EW,44,,
13124549,6/3/2018,2018-06-03 20:38:58 UTC,754260,https://static.inaturalist.org/photos/19134303/medium.jpeg?1528148088,"Crook County, US-OR, US",44.09955917,-120.3200904,10,,Crook,Oregon,Oregon,Crook,Penstemon roezlii,,"Maury Mtns, SE Drake Ck Rd",1,net,EW,45,,
13124596,6/3/2018,2018-06-03 21:49:28 UTC,754260,https://static.inaturalist.org/photos/19134376/medium.jpeg?1528148151,"Crook County, US-OR, US",44.07373,-120.2981005,51,,Crook,Oregon,Oregon,Crook,Delphinium nuttallianum,,"Maury Mtns, Ochoco NF, FS road 16, 7 mi S of OR 380",2,net,EW,46,,
13124618,6/3/2018,2018-06-03 22:14:01 UTC,754260,,"Crook County, US-OR, US",44.07442729,-120.2977292,18,,Crook,Oregon,Oregon,Crook,,,"Maury Mtns, Ochoco NF, FS road 16, 7 mi S of OR 380",1,net,EW,47,,
13124621,6/3/2018,2018-06-03 22:23:05 UTC,754260,https://static.inaturalist.org/photos/19134414/medium.jpeg?1528148197,"Crook County, US-OR, US",44.07454711,-120.2978354,12,,Crook,Oregon,Oregon,Crook,Lupinus argenteus argenteus,,"Maury Mtns, Ochoco NF, FS road 16, 7 mi S of OR 380",1,net,EW,48,,
13124633,6/3/2018,2018-06-03 22:38:11 UTC,754260,https://static.inaturalist.org/photos/19134433/medium.jpeg?1528148228,"Crook County, US-OR, US",44.0766808,-120.2990937,24,,Crook,Oregon,Oregon,Crook,Eriogonum umbellatum,,"Maury Mtns, Ochoco NF, FS road 16, 7 mi S of OR 380",2,net,EW,49,,
13124648,6/3/2018,2018-06-03 22:53:03 UTC,754260,https://static.inaturalist.org/photos/19134454/medium.jpeg?1528148261,"Crook County, US-OR, US",44.07696795,-120.2990542,22,,Crook,Oregon,Oregon,Crook,Penstemon humilis,,"Maury Mtns, Ochoco NF, FS road 16, 7 mi S of OR 380",2,net,EW,50,,
13124676,6/3/2018,2018-06-03 23:23:00 UTC,754260,https://static.inaturalist.org/photos/19134498/medium.jpeg?1528148302,"Crook County, US-OR, US",44.07750258,-120.2994113,10,,Crook,Oregon,Oregon,Crook,Lithospermum ruderale,,"Maury Mtns, Ochoco NF, FS road 16, 7 mi S of OR 380",1,net,EW,51,,
13124690,6/3/2018,2018-06-03 23:33:25 UTC,754260,https://static.inaturalist.org/photos/19134538/medium.jpeg?1528148342,"Crook County, US-OR, US",44.07753373,-120.29918,16,,Crook,Oregon,Oregon,Crook,Toxicoscordion paniculatum,,"Maury Mtns, Ochoco NF, FS road 16, 7 mi S of OR 380",1,net,EW,52,,
13135171,6/4/2018,2018-06-04 19:00:00 UTC,754260,,"6613 SW West Hills Rd, Corvallis, OR 97333, USA",44.558056,-123.326945,2,,Benton,Oregon,Oregon,Benton,,,Barb's front yard,1,net,EW,53,,
13158089,6/5/2018,2018-06-05 22:41:02 UTC,754260,https://static.inaturalist.org/photos/19200285/medium.jpeg?1528238656,"3334 NW Covey Run, Corvallis, OR 97330, USA",44.59912095,-123.3150882,9,,Benton,Oregon,Oregon,Benton,Eriophyllum lanatum,,backyard,2,net,EW,54,,
13158948,6/5/2018,2018-06-05 23:12:13 UTC,754260,https://static.inaturalist.org/photos/19202489/medium.jpeg?1528240551,"3334 NW Covey Run, Corvallis, OR 97330, USA",44.59922125,-123.3148872,10,,Benton,Oregon,Oregon,Benton,Penstemon euglaucus,,backyard,2,net,EW,55,,
13186912,6/6/2018,2018-06-06 21:27:38 UTC,754260,https://static.inaturalist.org/photos/19275037/medium.jpeg?1528320683,"Oregon, US",44.58772343,-123.3646406,9,,Benton,Oregon,Oregon,Benton,Erigeron decumbens,,backyard,1,net,EW,56,,
13187267,6/6/2018,2018-06-06 21:36:14 UTC,754260,https://static.inaturalist.org/photos/19275588/medium.jpeg?1528321275,"3334 NW Covey Run, Corvallis, OR 97330, USA",44.59883232,-123.3149787,9,,Benton,Oregon,Oregon,Benton,Erigeron speciosus,,backyard,1,net,EW,57,,
13187562,6/6/2018,2018-06-06 21:49:25 UTC,754260,https://static.inaturalist.org/photos/19276196/medium.jpeg?1528321990,"3334 NW Covey Run, Corvallis, OR 97330, USA",44.59898308,-123.3150869,27,,Benton,Oregon,Oregon,Benton,Allium amplectens,,backyard,4,net,EW,58,,
13187870,6/6/2018,2018-06-06 22:04:20 UTC,754260,https://static.inaturalist.org/photos/19276763/medium.jpeg?1528322763,"3334 NW Covey Run, Corvallis, OR 97330, USA",44.59880174,-123.3151842,4,,Benton,Oregon,Oregon,Benton,Eriophyllum lanatum,,backyard,3,net,EW,59,,
13237759,6/8/2018,2018-06-08 18:36:41 UTC,754260,https://static.inaturalist.org/photos/19365660/medium.jpeg?1528483211,"2800 NW 29th St, Corvallis, OR 97330, USA",44.59405253,-123.286605,13,,Benton,Oregon,Oregon,Benton,Spiraea japonica,,Hidden Creek Unit 21,2,net,EW,60,,
13270120,6/9/2018,2018-06-09 19:41:36 UTC,754260,https://static.inaturalist.org/photos/19461106/medium.jpeg?1528624700,"3334 NW Covey Run, Corvallis, OR 97330, USA",44.59918948,-123.3147578,13,,Benton,Oregon,Oregon,Benton,Eriophyllum lanatum,,backyard,1,net,EW,61,,
13271889,6/9/2018,2018-06-09 20:20:06 UTC,754260,https://static.inaturalist.org/photos/19426558/medium.jpeg?1528576244,"3334 NW Covey Run, Corvallis, OR 97330, USA",44.59924763,-123.3149867,13,,Benton,Oregon,Oregon,Benton,Triteleia hyacinthina,,backyard,1,net,EW,62,,
13276946,6/9/2018,2018-06-09 22:37:27 UTC,754260,https://static.inaturalist.org/photos/19435801/medium.jpeg?1528584102,"3334 NW Covey Run, Corvallis, OR 97330, USA",44.5992795,-123.3151627,6,,Benton,Oregon,Oregon,Benton,Gaillardia aristata,,backyard,1,net,EW,63,,
13291164,6/9/2018,2018-06-09 19:00:00 UTC,754260,,"6613 SW West Hills Rd, Corvallis, OR 97333, USA",44.558028,-123.326839,,,Benton,Oregon,Oregon,Benton,,,Barb's garage floor,1,net,EW,64,,
13343138,6/11/2018,2018-06-11 20:12:05 UTC,754260,https://static.inaturalist.org/photos/19553336/medium.jpeg?1528748031,"3334 NW Covey Run, Corvallis, OR 97330, USA",44.5990728,-123.315297,13,,Benton,Oregon,Oregon,Benton,Eriophyllum lanatum,,backyard,3,net,EW,65,,
13343690,6/11/2018,2018-06-11 20:14:06 UTC,754260,https://static.inaturalist.org/photos/19554389/medium.jpeg?1528749121,"3334 NW Covey Run, Corvallis, OR 97330, USA",44.59915546,-123.3154257,24,,Benton,Oregon,Oregon,Benton,Erigeron glaucus,,backyard,1,net,EW,66,,
13343717,6/11/2018,2018-06-11 20:28:51 UTC,754260,https://static.inaturalist.org/photos/19554432/medium.jpeg?1528749191,"3334 NW Covey Run, Corvallis, OR 97330, USA",44.59926343,-123.3152918,9,,Benton,Oregon,Oregon,Benton,Geranium oreganum,,backyard,1,net,EW,67,,
13345835,6/11/2018,2018-06-11 21:32:51 UTC,754260,https://static.inaturalist.org/photos/19558332/medium.jpeg?1528753012,"3334 NW Covey Run, Corvallis, OR 97330, USA",44.59945797,-123.3158585,9,,Benton,Oregon,Oregon,Benton,Triteleia hyacinthina,,backyard,1,net,EW,68,,
13346081,6/11/2018,2018-06-11 21:44:01 UTC,754260,https://static.inaturalist.org/photos/19558909/medium.jpeg?1528753605,"3334 NW Covey Run, Corvallis, OR 97330, USA",44.59916137,-123.3149753,16,,Benton,Oregon,Oregon,Benton,Sidalcea campestris,,backyard,1,net,EW,69,,
13360856,6/11/2018,2018-06-11 19:00:00 UTC,754260,,"6613 SW West Hills Rd, Corvallis, OR 97333, USA",44.558033,-123.326956,5,,Benton,Oregon,Oregon,Benton,,,Barb's front sidewalk,1,net,EW,70,,
13409117,6/13/2018,2018-06-14 00:02:29 UTC,754260,https://static.inaturalist.org/photos/19670927/medium.jpeg?1528934647,"3334 NW Covey Run, Corvallis, OR 97330, US",44.59944426,-123.3156,9,,Benton,Oregon,Oregon,Benton,,,backyard,1,net,EW,71,,
13418412,6/13/2018,2018-06-13 19:00:00 UTC,754260,,"6613 SW West Hills Rd, Corvallis, OR 97333, USA",44.558053,-123.327448,,,Benton,Oregon,Oregon,Benton,,,Barb's garage,6,net,EW,72,,
13525467,6/17/2018,2018-06-17 19:30:15 UTC,754260,https://static.inaturalist.org/photos/19875023/medium.jpeg?1529264040,"33-5-10 Rd, Wolf Creek, OR 97497, USA",42.69140378,-123.2612434,8,,Josephine,Oregon,Oregon,Josephine,Senecio integerrimus,,"King Mtn, Speaker Rd 9 mi east of intersection with I5",1,net,EW,73,,
13525667,6/17/2018,2018-06-17 19:39:02 UTC,754260,https://static.inaturalist.org/photos/19875472/medium.jpeg?1529264421,"33-5-10 Rd, Wolf Creek, OR 97497, USA",42.69135409,-123.261503,6,,Josephine,Oregon,Oregon,Josephine,Leucanthemum vulgare,,"King Mtn, Speaker Rd 9 mi east of intersection with I5",1,net,EW,74,,
13563197,6/18/2018,2018-06-18 22:18:25 UTC,754260,https://static.inaturalist.org/photos/19943019/medium.jpeg?1529360698,"3334 NW Covey Run, Corvallis, OR 97330, USA",44.59931472,-123.3159857,8,,Benton,Oregon,Oregon,Benton,Prunella vulgaris lanceolata,,backyard,4,net,EW,75,,
13592550,6/19/2018,2018-06-19 22:04:21 UTC,754260,https://static.inaturalist.org/photos/19994572/medium.jpeg?1529446035,"Oregon, US",44.44101218,-123.2048679,9,,Benton,Oregon,Oregon,Benton,Erigeron decumbens,,backyard,6,net,EW,76,,
13595957,6/19/2018,2018-06-20 00:28:06 UTC,754260,https://static.inaturalist.org/photos/20000882/medium.jpeg?1529454661,"3334 NW Covey Run, Corvallis, OR 97330, USA",44.59893408,-123.3155327,8,,Benton,Oregon,Oregon,Benton,Gilia capitata,,backyard,10,net,EW,77,,
13649964,6/21/2018,2018-06-21 21:32:49 UTC,754260,https://static.inaturalist.org/photos/20095688/medium.jpeg?1529616965,"3334 NW Covey Run, Corvallis, OR 97330, USA",44.59916879,-123.3147497,7,,Benton,Oregon,Oregon,Benton,Philadelphus lewisii,,backyard,6,net,EW,78,,
13725166,6/23/2018,2018-06-24 03:16:11 UTC,754260,https://static.inaturalist.org/photos/20223222/medium.jpeg?1529810466,"3334 NW Covey Run, Corvallis, OR 97330, USA",44.59936554,-123.3160518,7,,Benton,Oregon,Oregon,Benton,Festuca arundinacea,,backyard,1,net,EW,79,,
13726902,6/23/2018,2018-06-23 16:00:00 UTC,754260,,"3334 NW Covey Run, Corvallis, OR 97330, USA",44.599179,-123.315023,11,,Benton,Oregon,Oregon,Benton,,,backyard,1,net,EW,80,,
13808612,6/26/2018,2018-06-26 18:48:23 UTC,754260,https://static.inaturalist.org/photos/20369784/medium.jpeg?1530039032,"2800 NW 29th St, Corvallis, OR 97330, USA",44.59367993,-123.2865935,8,,Benton,Oregon,Oregon,Benton,Solanum lycopersicum,,"Hidden Creek, Unit 21",1,net,EW,81,,
13823897,6/26/2018,2018-06-26 19:33:00 UTC,754260,https://static.inaturalist.org/photos/20397150/medium.jpeg?1530075038,"3334 NW Covey Run, Corvallis, OR 97330, USA",44.59925785,-123.3150099,8,,Benton,Oregon,Oregon,Benton,Gaillardia aristata,,backyard,6,net,EW,82,,
13823900,6/26/2018,2018-06-26 19:54:35 UTC,754260,https://static.inaturalist.org/photos/20397169/medium.jpeg?1530075073,"3334 NW Covey Run, Corvallis, OR 97330, USA",44.59927595,-123.3150166,9,,Benton,Oregon,Oregon,Benton,Brodiaea elegans,,backyard,6,net,EW,83,,
13841502,6/27/2018,2018-06-27 21:46:21 UTC,754260,https://static.inaturalist.org/photos/20427651/medium.jpeg?1530136115,"Oregon, US",44.41367541,-123.2868069,12,,Benton,Oregon,Oregon,Benton,Erigeron decumbens,,backyard,4,net,EW,84,,
13843602,6/27/2018,2018-06-27 22:44:17 UTC,754260,https://static.inaturalist.org/photos/20448958/medium.jpeg?1530176827,"3334 NW Covey Run, Corvallis, OR 97330, USA",44.59888543,-123.3150059,9,,Benton,Oregon,Oregon,Benton,Lepechinia fragrans,,backyard,1,net,EW,85,,
13854812,6/27/2018,2018-06-27 22:52:40 UTC,754260,https://static.inaturalist.org/photos/20448976/medium.jpeg?1530176859,"3334 NW Covey Run, Corvallis, OR 97330, USA",44.59891774,-123.3148811,11,,Benton,Oregon,Oregon,Benton,Sidalcea campestris,,backyard,6,net,EW,86,,
13870056,6/28/2018,2018-06-28 21:48:00 UTC,754260,https://static.inaturalist.org/photos/20475719/medium.jpeg?1530222625,"3334 NW Covey Run, Corvallis, OR 97330, USA",44.59924684,-123.3150425,8,,Benton,Oregon,Oregon,Benton,Asclepias fascicularis,,backyard,4,net,EW,87,,
13880594,6/28/2018,2018-06-28 22:08:37 UTC,754260,https://static.inaturalist.org/photos/20495427/medium.jpeg?1530261314,"3334 NW Covey Run, Corvallis, OR 97330, USA",44.59916455,-123.3152644,9,,Benton,Oregon,Oregon,Benton,Romneya coulteri,,backyard,1,net,EW,88,,
13968156,7/1/2018,2018-07-02 00:26:12 UTC,754260,https://static.inaturalist.org/photos/20676322/medium.jpeg?1530547452,"Hart Mountain National Antelope Refuge, Lake County, US-OR, US",42.57709808,-119.7175222,11,,Lake,Oregon,Oregon,Lake,Calochortus macrocarpus,,"Warner Valley Overlook, Hart Mtn Rd",8,net,EW,89,,
13982749,7/1/2018,2018-07-02 02:20:06 UTC,754260,https://static.inaturalist.org/photos/20676353/medium.jpeg?1530547483,"Hart Mountain National Antelope Refuge, Lake County, US-OR, US",42.63981159,-119.5008373,7,,Lake,Oregon,Oregon,Lake,Chrysothamnus viscidiflorus,,"Hart Mt-Frenchglen Rd, 1.5 mi NE of intersection with Flook Knoll Rd",4,net,EW,90,,
13990073,7/2/2018,2018-07-02 12:39:48 UTC,754260,https://static.inaturalist.org/photos/20689418/medium.jpeg?1530561214,"14860 McKenzie Hwy, Sisters, OR 97759, USA",44.30207556,-121.6030209,,,Deschutes,Oregon,Oregon,Deschutes,Achillea millefolium,,"McKenzie Hwy 242, 2.2 mi W of intersection with Hwy 20",2,net,EW,91,,
13991366,7/2/2018,2018-07-02 19:56:24 UTC,754260,https://static.inaturalist.org/photos/20691718/medium.jpeg?1530563737,"14860 McKenzie Hwy, Sisters, OR 97759, USA",44.30180152,-121.6036707,7,,Deschutes,Oregon,Oregon,Deschutes,Packera cana,,"McKenzie Hwy 242, 2.2 mi W of intersection with Hwy 20",1,net,EW,92,,
13991608,7/2/2018,2018-07-02 20:03:46 UTC,754260,https://static.inaturalist.org/photos/20718240/medium.jpeg?1530611004,"14860 McKenzie Hwy, Sisters, OR 97759, USA",44.30173097,-121.6035866,8,,Deschutes,Oregon,Oregon,Deschutes,Clarkia rhomboidea,,"McKenzie Hwy 242, 2.2 mi W of intersection with Hwy 20",1,net,EW,93,,
14006710,7/2/2018,2018-07-02 21:01:25 UTC,754260,https://static.inaturalist.org/photos/20718252/medium.jpeg?1530611045,"Linn County, US-OR, US",44.25896675,-121.8120922,5,,Linn,Oregon,Oregon,Linn,Penstemon davidsonii,,"McKenzie Hwy 242, .7 mi west of McKenzie Summit",4,net,EW,94,,
14006715,7/2/2018,2018-07-02 21:34:19 UTC,754260,https://static.inaturalist.org/photos/20718262/medium.jpeg?1530611095,"Linn County, US-OR, US",44.25902121,-121.8119644,9,,Linn,Oregon,Oregon,Linn,,,"McKenzie Hwy 242, .7 mi west of McKenzie Summit",3,net,EW,95,,
14006722,7/2/2018,2018-07-02 23:09:26 UTC,754260,https://static.inaturalist.org/photos/20718271/medium.jpeg?1530611125,"NF-2676, Sisters, OR 97759, USA",44.43221466,-121.9590762,7,,Linn,Oregon,Oregon,Linn,Phacelia hastata,,"Little Nash Sno-Park, intersection of Santiam Hwy 20 and forest road 2676",1,net,EW,96,,
14006730,7/2/2018,2018-07-02 23:45:57 UTC,754260,https://static.inaturalist.org/photos/20718287/medium.jpeg?1530611184,"Linn County, US-OR, US",44.40445943,-122.0747542,11,,Linn,Oregon,Oregon,Linn,Horkelia fusca,,"Lost Prairie on Santiam Hwy 20, 4.1 mi W of intersection with OR-126",4,net,EW,97,,
14113501,7/6/2018,2018-07-06 20:34:31 UTC,754260,https://static.inaturalist.org/photos/20904249/medium.jpeg?1530909824,"NE Smith Ln, Corvallis, OR 97333, USA",44.56567009,-123.2406255,6,,Linn,Oregon,Oregon,Linn,Helenium,,ORGS student farm,3,net,EW,98,,
14113834,7/6/2018,2018-07-06 20:53:16 UTC,754260,https://static.inaturalist.org/photos/20904773/medium.jpeg?1530910571,"NE Smith Ln, Corvallis, OR 97333, USA",44.5656917,-123.2406644,3,,Linn,Oregon,Oregon,Linn,Lavandula,,ORGS student farm,2,net,EW,99,,
14113996,7/6/2018,2018-07-06 21:01:44 UTC,754260,https://static.inaturalist.org/photos/20905084/medium.jpeg?1530911081,"NE Smith Ln, Corvallis, OR 97333, USA",44.56559808,-123.2406259,13,,Linn,Oregon,Oregon,Linn,Silene coronaria,,ORGS student farm,1,net,EW,100,,
14116594,7/6/2018,2018-07-06 21:33:46 UTC,754260,https://static.inaturalist.org/photos/20909572/medium.jpeg?1530916866,"NE Smith Ln, Corvallis, OR 97333, USA",44.56563303,-123.2407552,8,,Linn,Oregon,Oregon,Linn,Echinacea purpurea,,ORGS student farm,1,net,EW,101,,
14116700,7/6/2018,2018-07-06 21:41:50 UTC,754260,https://static.inaturalist.org/photos/20909697/medium.jpeg?1530917015,"NE Smith Ln, Corvallis, OR 97333, USA",44.56572623,-123.2407623,7,,Linn,Oregon,Oregon,Linn,Achillea millefolium,,ORGS student farm,5,net,EW,102,,
14116721,7/6/2018,2018-07-06 22:02:56 UTC,754260,https://static.inaturalist.org/photos/20909741/medium.jpeg?1530917055,"NE Smith Ln, Corvallis, OR 97333, USA",44.56575224,-123.2407603,4,,Linn,Oregon,Oregon,Linn,Foeniculum vulgare,,ORGS student farm,5,net,EW,103,,
14119034,7/6/2018,2018-07-06 22:41:07 UTC,754260,https://static.inaturalist.org/photos/20914627/medium.jpeg?1530923481,"NE Smith Ln, Corvallis, OR 97333, USA",44.56579431,-123.2410911,7,,Linn,Oregon,Oregon,Linn,Anethum graveolens,,ORGS student farm,1,net,EW,104,,
14146448,7/7/2018,2018-07-07 22:17:04 UTC,754260,https://static.inaturalist.org/photos/20964289/medium.jpeg?1531002005,"3334 NW Covey Run, Corvallis, OR 97330, USA",44.59934006,-123.3149395,9,,Benton,Oregon,Oregon,Benton,Penstemon richardsonii,,backyard,2,net,EW,105,,
14147216,7/7/2018,2018-07-07 22:39:16 UTC,754260,https://static.inaturalist.org/photos/20965564/medium.jpeg?1531003258,"3334 NW Covey Run, Corvallis, OR 97330, USA",44.59946374,-123.3152593,9,,Benton,Oregon,Oregon,Benton,Clarkia amoena,,backyard,8,net,EW,106,,
14148296,7/7/2018,2018-07-07 23:06:14 UTC,754260,https://static.inaturalist.org/photos/20967582/medium.jpeg?1531005520,"3334 NW Covey Run, Corvallis, OR 97330, USA",44.59937253,-123.3156018,8,,Benton,Oregon,Oregon,Benton,Apocynum androsaemifolium,,backyard,1,net,EW,107,,
14149346,7/7/2018,2018-07-07 23:47:51 UTC,754260,https://static.inaturalist.org/photos/20969477/medium.jpeg?1531007392,"3334 NW Covey Run, Corvallis, OR 97330, USA",44.59901748,-123.3154593,7,,Benton,Oregon,Oregon,Benton,Gilia capitata,,backyard,2,net,EW,108,,
14169493,7/7/2018,2018-07-08 00:23:04 UTC,754260,https://static.inaturalist.org/photos/21006897/medium.jpeg?1531067285,"3334 NW Covey Run, Corvallis, OR 97330, USA",44.59880096,-123.3152306,5,,Benton,Oregon,Oregon,Benton,Sidalcea campestris,,backyard,3,net,EW,109,,
14169514,7/7/2018,2018-07-08 00:55:54 UTC,754260,https://static.inaturalist.org/photos/21006928/medium.jpeg?1531067319,"3334 NW Covey Run, Corvallis, OR 97330, USA",44.59886031,-123.315856,13,,Benton,Oregon,Oregon,Benton,Anaphalis margaritacea,,backyard,1,net,EW,110,,
14179282,7/8/2018,2018-07-08 21:19:44 UTC,754260,https://static.inaturalist.org/photos/21023920/medium.jpeg?1531084946,"3226 NW Covey Run, Corvallis, OR 97330, USA",44.59909986,-123.3148815,7,,Benton,Oregon,Oregon,Benton,Penstemon richardsonii,,backyard,1,net,EW,111,,
14180498,7/8/2018,2018-07-08 21:57:20 UTC,754260,https://static.inaturalist.org/photos/21025911/medium.jpeg?1531087258,"3334 NW Covey Run, Corvallis, OR 97330, USA",44.59920709,-123.3156414,9,,Benton,Oregon,Oregon,Benton,Clarkia amoena,,backyard,1,net,EW,112,,
14495551,7/18/2018,2018-07-18 21:45:01 UTC,754260,https://static.inaturalist.org/photos/21601208/medium.jpeg?1531991236,"3334 NW Covey Run, Corvallis, OR 97330, USA",44.59939465,-123.3159414,8,,Benton,Oregon,Oregon,Benton,Clarkia amoena,,backyard,4,net,EW,113,,
14509502,7/18/2018,2018-07-18 21:51:05 UTC,754260,https://static.inaturalist.org/photos/21601041/medium.jpeg?1531990450,"3334 NW Covey Run, Corvallis, OR 97330, USA",44.59934459,-123.3156115,9,,Benton,Oregon,Oregon,Benton,Symphyotrichum subspicatum,,backyard,9,net,EW,114,,
14509509,7/18/2018,2018-07-18 22:38:12 UTC,754260,https://static.inaturalist.org/photos/21601060/medium.jpeg?1531990482,"3334 NW Covey Run, Corvallis, OR 97330, USA",44.59930448,-123.3157167,9,,Benton,Oregon,Oregon,Benton,Solidago gigantea,,backyard,1,net,EW,115,,
14509515,7/18/2018,2018-07-18 22:55:31 UTC,754260,https://static.inaturalist.org/photos/21601073/medium.jpeg?1531990516,"3334 NW Covey Run, Corvallis, OR 97330, USA",44.59884515,-123.3158934,9,,Benton,Oregon,Oregon,Benton,Anaphalis margaritacea,,backyard,1,net,EW,116,,
14509521,7/18/2018,2018-07-18 23:06:23 UTC,754260,https://static.inaturalist.org/photos/21601086/medium.jpeg?1531990552,"3334 NW Covey Run, Corvallis, OR 97330, USA",44.59892141,-123.3158962,10,,Benton,Oregon,Oregon,Benton,Solidago lepida salebrosa,,backyard,5,net,EW,117,,
14581298,7/21/2018,2018-07-21 19:54:39 UTC,754260,https://static.inaturalist.org/photos/21729360/medium.jpeg?1532203012,"3334 NW Covey Run, Corvallis, OR 97330, USA",44.59923508,-123.3156993,8,,Benton,Oregon,Oregon,Benton,Grindelia integrifolia,,backyard,7,net,EW,118,,
14587173,7/21/2018,2018-07-21 21:04:23 UTC,754260,https://static.inaturalist.org/photos/21758191/medium.jpeg?1532234619,"Marys Peak Rd, Philomath, OR 97370, USA",44.47295088,-123.5192953,9,,Benton,Oregon,Oregon,Benton,Holodiscus discolor,,"Marys Peak Rd, 1.7 mi NW of intersection with Alsea Hwy 34",2,net,EW,119,,
14596877,7/21/2018,2018-07-21 21:36:33 UTC,754260,https://static.inaturalist.org/photos/21758232/medium.jpeg?1532234671,"31444 Marys Peak Rd, Philomath, OR 97370, USA",44.4753195,-123.5285806,30,,Benton,Oregon,Oregon,Benton,Chamaenerion angustifolium,,"Marys Peak Rd, 2.4 mi NW of intersection with Alsea Hwy 34",7,net,EW,120,,
14596902,7/21/2018,2018-07-21 22:16:05 UTC,754260,https://static.inaturalist.org/photos/21758269/medium.jpeg?1532234724,"Benton County, US-OR, US",44.51088407,-123.5709143,20,,Benton,Oregon,Oregon,Benton,Arnica lanceolata,,"NF 3010 at Parker Creek, 6.7 mi NW of Marys Peak Rd intersection with Alsea Hwy 34",2,net,EW,121,,
14596911,7/21/2018,2018-07-21 23:07:45 UTC,754260,https://static.inaturalist.org/photos/21758317/medium.jpeg?1532234778,"NF-3010, Philomath, OR 97370, USA",44.5101975,-123.5607345,4,,Benton,Oregon,Oregon,Benton,Achillea millefolium,,"Marys Peak Campground, hiker's parking lot",1,net,EW,122,,
14624235,7/22/2018,2018-07-22 23:31:10 UTC,754260,https://static.inaturalist.org/photos/21806702/medium.jpeg?1532302496,"3334 NW Covey Run, Corvallis, OR 97330, USA",44.59885877,-123.315129,8,,Benton,Oregon,Oregon,Benton,Perideridia,,backyard,8,net,EW,123,,
14653273,7/23/2018,2018-07-23 20:53:39 UTC,754260,https://static.inaturalist.org/photos/21863109/medium.jpeg?1532384780,"MLK Park, Corvallis, OR, USA",44.59364968,-123.3153912,7,,Benton,Oregon,Oregon,Benton,Grindelia integrifolia,,Martin Luther King Jr. Park,2,net,EW,124,,
14658311,7/23/2018,2018-07-23 21:14:23 UTC,754260,https://static.inaturalist.org/photos/21863133/medium.jpeg?1532384812,"MLK Park, Corvallis, OR, USA",44.59294538,-123.3139447,6,,Benton,Oregon,Oregon,Benton,Dipsacus fullonum,,Martin Luther King Jr. Park,1,net,EW,125,,
14662611,7/23/2018,2018-07-23 23:10:45 UTC,754260,https://static.inaturalist.org/photos/21884152/medium.jpeg?1532412299,"3334 NW Covey Run, Corvallis, OR 97330, USA",44.59879027,-123.3158353,7,,Benton,Oregon,Oregon,Benton,Solidago lepida salebrosa,,backyard,6,net,EW,126,,
14679871,7/23/2018,2018-07-23 23:40:47 UTC,754260,https://static.inaturalist.org/photos/21887428/medium.jpg?1532421052,"3334 NW Covey Run, Corvallis, OR 97330, USA",44.59918868,-123.315106,7,,Benton,Oregon,Oregon,Benton,Megachilidae,,backyard,3,net,EW,127,,
14780346,7/27/2018,2018-07-27 08:10:47 UTC,754260,,"3334 NW Covey Run, Corvallis, OR 97330, USA",44.599102,-123.315187,,,Benton,Oregon,Oregon,Benton,Megachilidae,,backyard,3,net,EW,128,,
14801617,7/27/2018,2018-07-27 21:19:37 UTC,754260,https://static.inaturalist.org/photos/22094777/medium.jpeg?1532726775,"3598 NE Lancaster St, Corvallis, OR 97330, USA",44.60413151,-123.2400849,9,,Benton,Oregon,Oregon,Benton,Grindelia integrifolia,,Jackson Frazier Wetland entry,19,net,EW,129,,
14837136,7/28/2018,2018-07-28 16:39:44 UTC,754260,https://static.inaturalist.org/photos/22155955/medium.jpeg?1532802446,"753 SW 35th St, Corvallis, OR 97333, USA",44.55994135,-123.2887789,17,,Benton,Oregon,Oregon,Benton,Helianthus annuus,,OSU Center for Urban Horticulture,2,net,EW,130,,
14842341,7/28/2018,2018-07-28 17:00:51 UTC,754260,https://static.inaturalist.org/photos/22156073/medium.jpeg?1532802518,"753 SW 35th St, Corvallis, OR 97333, USA",44.56009435,-123.2889071,7,,Benton,Oregon,Oregon,Benton,Helianthus tuberosus,,OSU Center for Urban Horticulture,6,net,EW,131,,
14842382,7/28/2018,2018-07-28 17:08:47 UTC,754260,https://static.inaturalist.org/photos/22156144/medium.jpeg?1532802562,"753 SW 35th St, Corvallis, OR 97333, USA",44.56004763,-123.2889259,7,,Benton,Oregon,Oregon,Benton,Origanum vulgare,,OSU Center for Urban Horticulture,7,net,EW,132,,
14842445,7/28/2018,2018-07-28 17:44:00 UTC,754260,https://static.inaturalist.org/photos/22156270/medium.jpeg?1532802637,"753 SW 35th St, Corvallis, OR 97333, USA",44.56003658,-123.2888354,8,,Benton,Oregon,Oregon,Benton,Grindelia integrifolia,,OSU Center for Urban Horticulture,5,net,EW,133,,
14876575,7/28/2018,2018-07-28 18:27:26 UTC,754260,https://static.inaturalist.org/photos/22206028/medium.jpeg?1532860085,"735 SW 35th St, Corvallis, OR 97333, USA",44.56022634,-123.2889396,9,,Benton,Oregon,Oregon,Benton,Solidago gigantea,,OSU Center for Urban Horticulture,6,net,EW,134,,
14876584,7/28/2018,2018-07-28 18:45:41 UTC,754260,https://static.inaturalist.org/photos/22206050/medium.jpeg?1532860117,"753 SW 35th St, Corvallis, OR 97333, USA",44.55987291,-123.2890143,9,,Benton,Oregon,Oregon,Benton,Helenium autumnale,,OSU Center for Urban Horticulture,8,net,EW,135,,
14876594,7/28/2018,2018-07-28 18:51:15 UTC,754260,https://static.inaturalist.org/photos/22206077/medium.jpeg?1532860155,"753 SW 35th St, Corvallis, OR 97333, USA",44.55983485,-123.2888686,9,,Benton,Oregon,Oregon,Benton,Epilobium densiflorum,,OSU Center for Urban Horticulture,6,net,EW,136,,
14903409,7/29/2018,2018-07-29 21:01:21 UTC,754260,https://static.inaturalist.org/photos/22246003/medium.jpeg?1532898261,"2800 NW 29th St, Corvallis, OR 97330, USA",44.59402207,-123.2869244,9,,Benton,Oregon,Oregon,Benton,Liatris,,Hidden Creek curb planting,3,net,EW,137,,
15129462,8/4/2018,2018-08-04 21:13:15 UTC,754260,https://static.inaturalist.org/photos/22610843/medium.jpeg?1533458326,"3546 NE Lancaster St, Corvallis, OR 97330, USA",44.60393975,-123.2404709,4,,Benton,Oregon,Oregon,Benton,Grindelia integrifolia,,Jackson-Frazier Wetland entry,14,net,EW,138,,
15129468,8/4/2018,2018-08-04 21:34:21 UTC,754260,https://static.inaturalist.org/photos/22610856/medium.jpeg?1533458353,"3546 NE Lancaster St, Corvallis, OR 97330, USA",44.60406833,-123.2404392,4,,Benton,Oregon,Oregon,Benton,Perideridia gairdneri,,Jackson-Frazier Wetland entry,9,net,EW,139,,
15154990,8/5/2018,2018-08-05 22:48:11 UTC,754260,https://static.inaturalist.org/photos/22670072/medium.jpeg?1533542604,"Lane County, US-OR, US",43.55560984,-122.359697,9,,Lane,Oregon,Oregon,Lane,Symphyotrichum foliaceum,,"NF Rd 2309, 20.5 mi S of Hwy 58 via FS 21, FS 2120",3,net,EW,140,,
15162160,8/5/2018,2018-08-05 22:57:31 UTC,754260,https://static.inaturalist.org/photos/22671025/medium.jpeg?1533544360,"Lane County, US-OR, US",43.55575695,-122.3596862,15,,Lane,Oregon,Oregon,Lane,Chamaenerion angustifolium,,"NF Rd 2309, 20.5 mi S of Hwy 58 via FS 21, FS 2120",1,net,EW,141,,
15162168,8/5/2018,2018-08-05 23:26:50 UTC,754260,https://static.inaturalist.org/photos/22670132/medium.jpeg?1533542681,"Lane County, US-OR, US",43.56605387,-122.3600565,12,,Lane,Oregon,Oregon,Lane,Symphyotrichum foliaceum,,"NF Rd 2309, 21.4 mi S of Hwy 58 via FS 21, FS 2120",3,net,EW,142,,
15162175,8/5/2018,2018-08-06 00:02:23 UTC,754260,https://static.inaturalist.org/photos/22670154/medium.jpeg?1533542711,"Lane County, US-OR, US",43.56773423,-122.3375682,16,,Lane,Oregon,Oregon,Lane,Rudbeckia occidentalis,,"NF Rd 2309, 22.7 mi S of Hwy 58 via FS 21, FS 2120",6,net,EW,143,,
15162399,8/5/2018,2018-08-06 00:04:28 UTC,754260,https://static.inaturalist.org/photos/22670671/medium.jpeg?1533543654,"Lane County, US-OR, US",43.56757429,-122.3374669,16,,Lane,Oregon,Oregon,Lane,Cirsium remotifolium,,"NF Rd 2309, 22.7 mi S of Hwy 58 via FS 21, FS 2120",2,net,EW,144,,
15162410,8/5/2018,2018-08-06 01:05:35 UTC,754260,https://static.inaturalist.org/photos/22670732/medium.jpeg?1533543720,"Lane County, US-OR, US",43.58015529,-122.3290668,9,,Lane,Oregon,Oregon,Lane,Eriogonum nudum,,"NF Rd 452, 24 mi S of Hwy 58 via FS 21, FS 2120, FS 2309",2,net,EW,145,,
15191795,8/6/2018,2018-08-06 20:23:59 UTC,754260,https://static.inaturalist.org/photos/22722793/medium.jpeg?1533629633,"3334 NW Covey Run, Corvallis, OR 97330, USA",44.59881641,-123.3159097,6,,Benton,Oregon,Oregon,Benton,Solidago lepida salebrosa,,backyard,8,net,EW,146,,
15191800,8/6/2018,2018-08-06 20:27:19 UTC,754260,https://static.inaturalist.org/photos/22722809/medium.jpeg?1533629677,"3334 NW Covey Run, Corvallis, OR 97330, USA",44.59884286,-123.3158823,9,,Benton,Oregon,Oregon,Benton,Anaphalis margaritacea,,backyard,4,net,EW,147,,
15328669,8/11/2018,2018-08-11 20:47:18 UTC,754260,https://static.inaturalist.org/photos/22957524/medium.jpeg?1534020888,"3546 NE Lancaster St, Corvallis, OR 97330, USA",44.60392045,-123.2406103,7,,Benton,Oregon,Oregon,Benton,Grindelia integrifolia,,Jackson-Frazier Wetland entry,13,net,EW,148,,
15332546,8/11/2018,2018-08-11 21:44:39 UTC,754260,https://static.inaturalist.org/photos/22963766/medium.jpeg?1534028408,"3546 NE Lancaster St, Corvallis, OR 97330, USA",44.60411381,-123.2403155,7,,Benton,Oregon,Oregon,Benton,Perideridia gairdneri,,Jackson-Frazier Wetland entry,13,net,EW,149,,
15649639,8/18/2018,2018-08-18 22:59:01 UTC,754260,https://static.inaturalist.org/photos/23376650/medium.jpeg?1534633319,"3334 NW Covey Run, Corvallis, OR 97330, USA",44.59928003,-123.3150632,19,,Benton,Oregon,Oregon,Benton,Asclepias fascicularis,,backyard,15,net,EW,150,,
15737881,8/20/2018,2018-08-20 22:46:52 UTC,754260,https://static.inaturalist.org/photos/23500052/medium.jpeg?1534805516,"3334 NW Covey Run, Corvallis, OR 97330, USA",44.59921553,-123.3150438,7,,Benton,Oregon,Oregon,Benton,Bombus vosnesenskii,,backyard,1,net,EW,151,,
15864085,8/24/2018,2018-08-25 00:45:39 UTC,754260,https://static.inaturalist.org/photos/23718370/medium.jpeg?1535161752,"3598 NE Lancaster St, Corvallis, OR 97330, USA",44.60414936,-123.2403503,6,,Benton,Oregon,Oregon,Benton,Perideridia gairdneri,,Jackson-Frazier Wetland entry,1,net,EW,152,,
15892302,8/25/2018,2018-08-25 22:43:45 UTC,754260,https://static.inaturalist.org/photos/23764211/medium.jpeg?1535237178,"3334 NW Covey Run, Corvallis, OR 97330, USA",44.59934833,-123.3150069,9,,Benton,Oregon,Oregon,Benton,Asclepias fascicularis,,backyard,5,net,EW,153,,
15903786,8/25/2018,2018-08-25 22:46:08 UTC,754260,https://static.inaturalist.org/photos/23785053/medium.jpeg?1535271893,"3334 NW Covey Run, Corvallis, OR 97330, USA",44.59925263,-123.3150127,7,,Benton,Oregon,Oregon,Benton,Gaillardia aristata,,backyard,6,net,EW,154,,
15924898,8/26/2018,2018-08-26 21:59:02 UTC,754260,https://static.inaturalist.org/photos/23822517/medium.jpeg?1535320899,"NE Smith Ln, Corvallis, OR 97333, USA",44.56576156,-123.2406885,9,,Linn,Oregon,Oregon,Linn,Monarda fistulosa,,OSU organic student farm,3,net,EW,155,,
15926086,8/26/2018,2018-08-26 22:35:54 UTC,754260,https://static.inaturalist.org/photos/23824688/medium.jpeg?1535323118,"NE Smith Ln, Corvallis, OR 97333, USA",44.56567135,-123.2405946,5,,Linn,Oregon,Oregon,Linn,Symphyotrichum hallii,,OSU organic student farm,1,net,EW,156,,
15927247,8/26/2018,2018-08-26 23:06:24 UTC,754260,https://static.inaturalist.org/photos/23826563/medium.jpeg?1535325008,"2820 NW Orchard Ave, Corvallis, OR 97330, USA",44.56774993,-123.2820466,9,,Benton,Oregon,Oregon,Benton,Helenium autumnale,,"OSU, Cordley Hall pollinator garden, west entrance",13,net,EW,157,,
15963803,8/27/2018,2018-08-28 01:51:45 UTC,754260,https://static.inaturalist.org/photos/23894513/medium.jpeg?1535421526,"3334 NW Covey Run, Corvallis, OR 97330, USA",44.5992508,-123.3153317,8,,Benton,Oregon,Oregon,Benton,Romneya coulteri,,backyard,2,net,EW,158,,
15964648,8/27/2018,2018-08-28 02:22:08 UTC,754260,https://static.inaturalist.org/photos/23895824/medium.jpeg?1535423253,"3334 NW Covey Run, Corvallis, OR 97330, USA",44.59902633,-123.3150688,5,,Benton,Oregon,Oregon,Benton,Spiraea betulifolia,,backyard,7,net,EW,159,,
15986829,8/28/2018,2018-08-28 23:26:15 UTC,754260,https://static.inaturalist.org/photos/23935685/medium.jpeg?1535499075,"27901 W Leg Rd, Government Camp, OR 97028, USA",45.32559445,-121.7120815,7,,Clackamas,Oregon,Oregon,Clackamas,Eucephalus ledophyllus,,W Leg Rd at Timberline Hwy,2,net,EW,160,,
15987614,8/28/2018,2018-08-28 23:57:56 UTC,754260,https://static.inaturalist.org/photos/23937354/medium.jpeg?1535501216,"27901 W Leg Rd, Government Camp, OR 97028, USA",45.3194532,-121.7155552,12,,Clackamas,Oregon,Oregon,Clackamas,Anaphalis margaritacea,,"W Leg Rd, 1 mi SW of Timberline Hwy",2,net,EW,161,,
15987712,8/28/2018,2018-08-29 00:07:00 UTC,754260,https://static.inaturalist.org/photos/23949116/medium.jpeg?1535522393,"27901 W Leg Rd, Government Camp, OR 97028, USA",45.31984285,-121.7156054,8,,Clackamas,Oregon,Oregon,Clackamas,Eucephalus ledophyllus,,"W Leg Rd, 1 mi SW of Timberline Hwy",2,net,EW,162,,
15988312,8/28/2018,2018-08-29 00:35:36 UTC,754260,https://static.inaturalist.org/photos/23938662/medium.jpeg?1535503100,"27901 W Leg Rd, Government Camp, OR 97028, USA",45.31968022,-121.7154276,7,,Clackamas,Oregon,Oregon,Clackamas,Chamaenerion angustifolium,,"W Leg Rd, 1 mi SW of Timberline Hwy",5,net,EW,163,,
16012945,8/29/2018,2018-08-29 22:15:11 UTC,754260,https://static.inaturalist.org/photos/23982974/medium.jpeg?1535581117,"2989 NW Shooting Star Dr, Corvallis, OR 97330, USA",44.59790526,-123.284582,13,,Benton,Oregon,Oregon,Benton,Daucus carota,,Chepenefa Springs Park,9,net,EW,164,,
16013634,8/29/2018,2018-08-29 22:40:27 UTC,754260,https://static.inaturalist.org/photos/23984075/medium.jpeg?1535582614,"2989 NW Shooting Star Dr, Corvallis, OR 97330, USA",44.59762684,-123.2846239,8,,Benton,Oregon,Oregon,Benton,Grindelia integrifolia,,Chepenefa Springs Park,17,net,EW,165,,
16053103,8/30/2018,2018-08-30 22:35:24 UTC,754260,https://static.inaturalist.org/photos/24033887/medium.jpeg?1535668647,"2879 NW Daylily Ave, Corvallis, OR 97330, USA",44.59768393,-123.287297,7,,Benton,Oregon,Oregon,Benton,Grindelia integrifolia,,Chepenefa Springs Park,8,net,EW,166,,
16054624,8/30/2018,2018-08-30 23:26:48 UTC,754260,https://static.inaturalist.org/photos/24036287/medium.jpeg?1535671989,"3547 NE Lancaster St, Corvallis, OR 97330, USA",44.60388489,-123.2399675,8,,Benton,Oregon,Oregon,Benton,Grindelia integrifolia,,Jackson-Frazier Wetland entry,6,net,EW,167,,
16057779,8/30/2018,2018-08-31 01:49:59 UTC,754260,https://static.inaturalist.org/photos/24042479/medium.jpeg?1535680385,"East Greenhouse, 2801 SW Campus Way, Corvallis, OR 97331, USA",44.56690254,-123.2827893,9,,Benton,Oregon,Oregon,Benton,Grindelia integrifolia,,OSU East Greenhouse pollinator garden,3,net,EW,168,,
16148657,9/2/2018,2018-09-02 22:18:34 UTC,754260,https://static.inaturalist.org/photos/24205816/medium.jpeg?1535927055,"3334 NW Covey Run, Corvallis, OR 97330, USA",44.59934399,-123.3157027,8,,Benton,Oregon,Oregon,Benton,Symphyotrichum subspicatum,,backyard,27,net,EW,169,,
16183159,9/3/2018,2018-09-03 21:39:28 UTC,754260,https://static.inaturalist.org/photos/24270443/medium.jpeg?1536011062,"2879 NW Daylily Ave, Corvallis, OR 97330, USA",44.59778557,-123.2873178,9,,Benton,Oregon,Oregon,Benton,Baccharis pilularis,,Chepenefa Springs Park,13,net,EW,170,,
16219384,9/4/2018,2018-09-04 21:31:27 UTC,754260,https://static.inaturalist.org/photos/24338096/medium.jpeg?1536108758,"NF-038, Foster, OR 97345, USA",44.40383045,-122.1584698,8,,Linn,Oregon,Oregon,Linn,Cirsium remotifolium,,"Iron Mtn, Civil Rd 1.9 mi N of S Santiam Hwy 20.",1,net,EW,171,,
16219451,9/4/2018,2018-09-04 22:16:23 UTC,754260,https://static.inaturalist.org/photos/24338125/medium.jpeg?1536108789,"Linn County, US-OR, US",44.40183241,-122.0879021,12,,Linn,Oregon,Oregon,Linn,Chamaenerion angustifolium,,S Santiam Hwy 20 at NF-055,3,net,EW,172,,
16219459,9/4/2018,2018-09-04 23:26:55 UTC,754260,https://static.inaturalist.org/photos/24338144/medium.jpeg?1536108820,"Linn County, US-OR, US",44.41294445,-122.0816056,9,,Linn,Oregon,Oregon,Linn,Ericameria greenei,,"NF-055, about 2 mi NE of S Santiam Hwy 20",1,net,EW,173,,
16237856,9/5/2018,2018-09-05 19:53:02 UTC,754260,https://static.inaturalist.org/photos/24373054/medium.jpeg?1536177339,"66946 Sagebrush Ln, Bend, OR 97701, USA",44.22372421,-121.4441471,6,,Deschutes,Oregon,Oregon,Deschutes,Ericameria nauseosa,,Hwy 20 at Sagebrush Lane,1,net,EW,174,,
16240455,9/5/2018,2018-09-05 21:29:59 UTC,754260,https://static.inaturalist.org/photos/24377524/medium.jpeg?1536183248,"NF-1012, Sisters, OR 97759, USA",44.33090975,-121.6161895,7,,Deschutes,Oregon,Oregon,Deschutes,Ericameria nauseosa,,"Cold Springs Cutoff Rd, about 1 mi SW of S Santiam Hwy 20",19,net,EW,175,,
16335937,9/8/2018,2018-09-08 22:54:55 UTC,754260,https://static.inaturalist.org/photos/24548910/medium.jpeg?1536447533,"2879 NW Daylily Ave, Corvallis, OR 97330, USA",44.59764551,-123.2873382,9,,Benton,Oregon,Oregon,Benton,Baccharis pilularis,,Chepenefa Springs Park,5,net,EW,176,,
16336081,9/8/2018,2018-09-08 22:59:26 UTC,754260,https://static.inaturalist.org/photos/24549081/medium.jpeg?1536447686,"2879 NW Daylily Ave, Corvallis, OR 97330, USA",44.59770508,-123.287351,6,,Benton,Oregon,Oregon,Benton,Grindelia integrifolia,,Chepenefa Springs Park,15,net,EW,177,,
16371170,9/9/2018,2018-09-09 22:50:50 UTC,754260,https://static.inaturalist.org/photos/24614745/medium.jpeg?1536533578,"3334 NW Covey Run, Corvallis, OR 97330, USA",44.599209,-123.3157835,9,,Benton,Oregon,Oregon,Benton,Symphyotrichum subspicatum,,backyard,13,net,EW,178,,
16640951,9/17/2018,2018-09-17 22:18:24 UTC,754260,https://static.inaturalist.org/photos/25085097/medium.jpeg?1537222829,"3434 NE Oxford Cir, Corvallis, OR 97330, USA",44.60330326,-123.2408205,7,,Benton,Oregon,Oregon,Benton,Grindelia integrifolia,,Jackson-Frazier Wetland entry,2,net,EW,179,,
16669884,9/18/2018,2018-09-18 21:45:34 UTC,754260,https://static.inaturalist.org/photos/25139080/medium.jpeg?1537307291,"3334 NW Covey Run, Corvallis, OR 97330, USA",44.59920368,-123.3156444,8,,Benton,Oregon,Oregon,Benton,Symphyotrichum subspicatum,,backyard,14,net,EW,180,,
16672653,9/18/2018,2018-09-18 23:27:39 UTC,754260,https://static.inaturalist.org/photos/25144059/medium.jpeg?1537313366,"3334 NW Covey Run, Corvallis, OR 97330, USA",44.59928376,-123.3150537,9,,Benton,Oregon,Oregon,Benton,Asclepias fascicularis,,backyard,18,net,EW,181,,
16730385,9/20/2018,2018-09-20 21:37:02 UTC,754260,https://static.inaturalist.org/photos/25264614/medium.jpeg?1537510724,"2873 NW Daylily Ave, Corvallis, OR 97330, USA",44.59768691,-123.2873019,8,,Benton,Oregon,Oregon,Benton,Baccharis pilularis,,Chepenefa Springs Park,15,net,EW,182,,
16948332,9/26/2018,2018-09-26 22:53:42 UTC,754260,https://static.inaturalist.org/photos/25615694/medium.jpeg?1538002974,"3334 NW Covey Run, Corvallis, OR 97330, USA",44.59910948,-123.3149302,13,,Benton,Oregon,Oregon,Benton,Pyrobombus,,backyard,1,net,EW,183,,
11322664,4/19/2018,2018-04-19 20:45:00 UTC,843723,https://static.inaturalist.org/photos/16122140/medium.jpeg?1524414264,tumalo bend oregon,44.18173,-121.317563,47,,Deschutes,Oregon,Oregon,Deschutes,Ribes cereum,,Twin Bridges trailhead,6,net,GP,1,,
11323792,4/20/2018,2018-04-20 17:30:00 UTC,843723,https://static.inaturalist.org/photos/16123517/medium.jpeg?1524415439,eagle crest resort oregon,44.267583,-121.255859,,,Deschutes,Oregon,Oregon,Deschutes,Ribes cereum,,Eagle Crest river trail,3,net,GP,2,,
11323902,4/20/2018,2018-04-20 18:30:00 UTC,843723,https://static.inaturalist.org/photos/16123710/medium.jpeg?1524415595,eagle crest resort oregon,44.267522,-121.255065,,,Deschutes,Oregon,Oregon,Deschutes,Ribes cereum,,Eagle Crest river trail,3,net,GP,3,,
11324081,4/21/2018,2018-04-21 20:15:00 UTC,843723,https://static.inaturalist.org/photos/16124044/medium.jpeg?1524415863,"Safeway Century Drive, Bend, Oregon",44.047323,-121.329507,,,Deschutes,Oregon,Oregon,Deschutes,Ribes aureum,,"Safeway, Century Dr.",2,net,GP,4,,
11403524,4/23/2018,,843723,https://static.inaturalist.org/photos/16257305/medium.jpg?1524607144,"Deschutes Co, Bend, Tumalo Resevoir",44.136352,-121.416387,,,Deschutes,Oregon,Oregon,Deschutes,,,Tumalo Reservoir,5,net,GP,5,,
11464403,4/26/2018,2018-04-26 16:45:00 UTC,843723,https://static.inaturalist.org/photos/16358501/medium.jpeg?1524783501,"Deschutes Co., Bend, Old Mill, dog park",44.042139,-121.319701,,,Deschutes,Oregon,Oregon,Deschutes,Ribes aureum,,Old Mill Dog Park,1,net,GP,6,,
11464561,4/26/2018,2018-04-26 17:15:00 UTC,843723,https://static.inaturalist.org/photos/16358601/medium.jpeg?1524783631,"Deschutes Co., Bend, Old Mill, dog park",44.042039,-121.321031,,,Deschutes,Oregon,Oregon,Deschutes,Ribes cereum,,Old Mill Dog Park,8,net,GP,7,,
12172810,5/3/2018,2018-05-03 16:50:00 UTC,843723,https://static.inaturalist.org/photos/17476305/medium.jpg?1525554310,Eagle Crest Resort river trail,44.26732,-121.254376,47,,Deschutes,Oregon,Oregon,Deschutes,Ribes cereum,,Eagle Crest Resort river trail,2,net,GP,8,,
12172944,5/3/2018,2018-05-03 17:30:00 UTC,843723,https://static.inaturalist.org/photos/17476557/medium.jpg?1525554602,Eagle Crest Resort river trail,44.26719,-121.253582,47,,Deschutes,Oregon,Oregon,Deschutes,Brassicaceae,,Eagle Crest Resort river trail,2,net,GP,9,,
12173075,5/3/2018,2018-05-03 17:55:00 UTC,843723,https://static.inaturalist.org/photos/17476741/medium.jpg?1525554772,Eagle Crest Resort river trail,44.267328,-121.253196,,,Deschutes,Oregon,Oregon,Deschutes,Ribes cereum,,Eagle Crest Resort river trail,1,net,GP,10,,
12173170,5/3/2018,2018-05-03 18:35:00 UTC,843723,https://static.inaturalist.org/photos/17476957/medium.jpg?1525554949,Eagle Crest Resort river trail,44.267436,-121.252552,,,Deschutes,Oregon,Oregon,Deschutes,Ribes cereum,,Eagle Crest Resort river trail,7,net,GP,11,,
12173588,5/4/2018,2018-05-04 18:10:00 UTC,843723,https://static.inaturalist.org/photos/17477658/medium.jpg?1525555606,Deschutes River Lava Island Falls trailhead,43.985203,-121.399339,,,Deschutes,Oregon,Oregon,Deschutes,Salix,,Lava Island Falls trailhead,5,net,GP,12,,
12400376,5/8/2018,2018-05-08 18:50:00 UTC,843723,https://static.inaturalist.org/photos/17873339/medium.jpeg?1526172438,"Harney Co.,Hwy 20, 20 miles West of Burns",43.592194,-119.054625,,,Harney,Oregon,Oregon,Harney,Ribes aureum,,"west of Burns, OR",5,net,GP,13,,
12400473,5/8/2018,2018-05-08 21:10:00 UTC,843723,https://static.inaturalist.org/photos/17873525/medium.jpeg?1526172647,"Harney Co.,Hwy 20, 7 miles east of Burns",43.614001,-119.003142,,,Harney,Oregon,Oregon,Harney,Lepidium appelianum,,"east of Burns, OR",2,net,GP,14,,
12400617,5/9/2018,2018-05-09 16:15:00 UTC,843723,https://static.inaturalist.org/photos/17873674/medium.jpeg?1526172863,"Malheur Co., Succor Crk. campground",43.453508,-117.120211,48,,Malheur,Oregon,Oregon,Malheur,Salix,,Succor Creek Campground,10,net,GP,15,,
12400651,5/9/2018,2018-05-09 17:00:00 UTC,843723,https://static.inaturalist.org/photos/17873753/medium.jpeg?1526172973,"Malheur Co., Succor Crk. campground",43.453508,-117.120211,48,,Malheur,Oregon,Oregon,Malheur,Erodium cicutarium,,Succor Creek Campground,2,net,GP,16,,
12400759,5/9/2018,2018-05-09 17:40:00 UTC,843723,https://static.inaturalist.org/photos/17873930/medium.jpeg?1526173217,"Malheur Co., Succor Crk. Rd.",43.450829,-117.120812,,,Malheur,Oregon,Oregon,Malheur,Astragalus filipes,,Succor Creek Rd.,4,net,GP,17,,
12400815,5/9/2018,2018-05-09 18:45:00 UTC,843723,https://static.inaturalist.org/photos/17874073/medium.jpg?1526173372,"Malheur Co., Succor Crk. Road",43.450829,-117.120812,,,Malheur,Oregon,Oregon,Malheur,Penstemon,,Succor Creek Road,1,net,GP,18,,
12401037,5/9/2018,2018-05-09 19:20:00 UTC,843723,https://static.inaturalist.org/photos/17874407/medium.jpeg?1526173718,"Malheur Co., Succor Crk. Road",43.350052,-117.118237,,,Malheur,Oregon,Oregon,Malheur,Balsamorhiza hookeri,,Succor Creek Rd.,14,net,GP,19,,
12401102,5/9/2018,2018-05-09 19:30:00 UTC,843723,https://static.inaturalist.org/photos/17874493/medium.jpeg?1526173839,"Malheur Co., Succor Crk. Road",43.350052,-117.118237,,,Malheur,Oregon,Oregon,Malheur,Lithospermum ruderale,,Succor Creek Rd.,1,net,GP,20,,
12401154,5/9/2018,2018-05-09 19:40:00 UTC,843723,https://static.inaturalist.org/photos/17874652/medium.jpeg?1526174082,"Malheur Co., Succor Crk. Road",43.350052,-117.118237,,,Malheur,Oregon,Oregon,Malheur,Lepidium appelianum,,Succor Creek Rd.,1,net,GP,21,,
12401193,5/9/2018,2018-05-09 19:45:00 UTC,843723,https://static.inaturalist.org/photos/17874778/medium.jpeg?1526174208,"Malheur Co., Succor Crk. Road",43.350052,-117.118237,,,Malheur,Oregon,Oregon,Malheur,Lepidium appelianum,,Succor Creek Rd.,1,net,GP,22,,
12401309,5/9/2018,2018-05-09 23:40:00 UTC,843723,https://static.inaturalist.org/photos/17875030/medium.jpg?1526174443,"Malheur Co., Leslie Gulch",43.293565,-117.254506,,,Malheur,Oregon,Oregon,Malheur,Phacelia hastata,,Leslie Gulch,16,net,GP,23,,
12401346,5/9/2018,2018-05-10 00:10:00 UTC,843723,https://static.inaturalist.org/photos/17875141/medium.jpeg?1526174534,"Malheur Co., Leslie Gulch",43.293565,-117.254506,,,Malheur,Oregon,Oregon,Malheur,Prunus virginiana,,Leslie Gulch,3,net,GP,24,,
12401644,5/10/2018,2018-05-10 21:00:00 UTC,843723,https://static.inaturalist.org/photos/17875686/medium.jpeg?1526175140,"Malheur Co., Malheur NWR French Round Barn, 3 mi. west of",43.038056,-118.745041,1553,,Harney,Oregon,Oregon,Harney,Chorispora tenella,,Malheur NWR near French round barn,3,net,GP,25,,
12401708,5/10/2018,2018-05-10 21:50:00 UTC,843723,https://static.inaturalist.org/photos/17875863/medium.jpg?1526175330,"Malheur Co., Malheur NWR French Round Barn, 3 mi. west of",43.01848,-118.850098,,,Harney,Oregon,Oregon,Harney,Salix,,Hwy 205 near French Glen,10,net,GP,26,,
12401789,5/10/2018,2018-05-10 22:35:00 UTC,843723,https://static.inaturalist.org/photos/17876015/medium.jpeg?1526175528,"Malheur Co., Page Springs Campground",42.803997,-118.866963,48,,Harney,Oregon,Oregon,Harney,Thermopsis rhombifolia,,Page Springs CG,4,net,GP,27,,
12459784,5/13/2018,2018-05-13 19:15:00 UTC,843723,https://static.inaturalist.org/photos/17976095/medium.jpg?1526330686,"Crook Co., Mill Creek Rd.",44.438669,-120.58406,44,,Crook,Oregon,Oregon,Crook,Ribes aureum,,Mill Creek Rd. near NF33,3,net,GP,28,,
12459829,5/13/2018,2018-05-13 19:30:00 UTC,843723,https://static.inaturalist.org/photos/17976179/medium.jpg?1526330805,"Crook Co., Mill Creek Rd.",44.438669,-120.58406,44,,Crook,Oregon,Oregon,Crook,Amelanchier alnifolia,,Mill Creek Rd. near NF33,5,net,GP,29,,
12459936,5/13/2018,2018-05-13 21:00:00 UTC,843723,https://static.inaturalist.org/photos/17976366/medium.jpg?1526331085,"Crook Co., Mill Creek Rd.",44.440048,-120.580071,44,,Crook,Oregon,Oregon,Crook,Collinsia,,Wildcat Campground Trail,2,net,GP,30,,
12460019,5/13/2018,2018-05-13 21:12:00 UTC,843723,https://static.inaturalist.org/photos/17976512/medium.jpg?1526331266,"Crook Co., Mill Creek Rd.",44.440048,-120.580071,44,,Crook,Oregon,Oregon,Crook,Ribes cereum,,"Mill Creek, Wildcat campgound trail",1,net,GP,31,,
12460108,5/13/2018,2018-05-13 21:12:00 UTC,843723,https://static.inaturalist.org/photos/17976671/medium.jpg?1526331451,"Crook Co., Mill Creek Rd.",44.440048,-120.580071,44,,Crook,Oregon,Oregon,Crook,Hydrophyllum capitatum,,"Mill Creek, Wildcat Campground trail",1,net,GP,32,,
12591878,5/17/2018,2018-05-17 17:00:00 UTC,843723,https://static.inaturalist.org/photos/18200326/medium.jpg?1526691560,"Deschutes Co, Eagle Crest Resort, River Trail",44.267597,-121.255453,2,,Deschutes,Oregon,Oregon,Deschutes,Descurainia sophia,,Eagle Crest river trail,2,net,GP,33,,
12591931,5/17/2018,2018-05-17 17:35:00 UTC,843723,https://static.inaturalist.org/photos/18200421/medium.jpg?1526691745,"Deschutes Co, Eagle Crest Resort, River Trail",44.267447,-121.254809,,,Deschutes,Oregon,Oregon,Deschutes,Thelypodium laciniatum,,Eagle Crest River Trail,5,net,GP,34,,
12591969,5/17/2018,2018-05-17 18:06:00 UTC,843723,https://static.inaturalist.org/photos/18200486/medium.jpg?1526691866,"Deschutes Co, Eagle Crest Resort, River Trail",44.266848,-121.255667,,,Deschutes,Oregon,Oregon,Deschutes,Taraxacum officinale,,Eagle Crest River Trail,1,net,GP,35,,
12645988,5/19/2018,2018-05-19 21:00:00 UTC,843723,https://static.inaturalist.org/photos/18294525/medium.jpg?1526838218,"18925 Pinehurst Rd. Bend, OR",44.16398,-121.377396,23,,Deschutes,Oregon,Oregon,Deschutes,Rhus aromatica,,"Pinehurst Rd., Bend, OR",16,net,GP,36,,
